,Tour Name,Tour Type,Tour Duration,Tour Price,Price Per,Cancellation,Tour By,City,Country,Link
210,6 Hours - Athens Sightseeing Private Tour,Bus Tours,6 hours,$161.22,per adult,Free cancellation,By Olive Sea Travel,Athens,Greece,https://www.tripadvisor.com/Attraction_Review-g189400-d12858625-Reviews-Olive_Sea_Travel-Athens_Attica.html
211,Acropolis Of Athens & Acropolis Museum Skip The Line Private Guided Tour,Shore Excursions,4 hours,$195.73,per adult,Free cancellation,By Crispy Local,Athens,Greece,https://www.tripadvisor.com/Attraction_Review-g189400-d17314098-Reviews-Crispy_Local-Athens_Attica.html
212,Learn to Cook in a Local Home: A Taste of the Greek Islands in Athens,Cooking Classes,3 hours,$130.00,per adult,Free cancellation,By Traveling Spoon,Athens,Greece,https://www.tripadvisor.com/Attraction_Review-g189400-d12564841-Reviews-Traveling_Spoon-Athens_Attica.html
213,Athens at Night Small-Group Walking Tour with Dinner,Private and Luxury,5 hours,$84.85,per adult,Free cancellation,By Getaways Greece,Athens,Greece,https://www.tripadvisor.com/Attraction_Review-g189400-d8295460-Reviews-Getaways_Greece-Athens_Attica.html
214,Ancient Corinth and Daphni Monastery Half-Day Tour from Athens,Bus Tours,6 hours,$70.14,per adult,Free cancellation,By Keytours - Greece,Athens,Greece,https://www.tripadvisor.com/Attraction_Review-g189400-d20151049-Reviews-Keytours_Greece-Athens_Attica.html
215,Epidaurus & Mycenae One Day Tour from Athens,Full-day Tours,6+ hours,$99.56,per adult,Free cancellation,By Let's Book Travel,Athens,Greece,https://www.tripadvisor.com/Attraction_Review-g189400-d15238655-Reviews-Let_s_Book_Travel-Athens_Attica.html
216,"Athens, The Acropolis and Cape Sounion Full-Day Tour with Lunch",Full-day Tours,6+ hours,$100.69,per adult,Free cancellation,By Chat Tours,Athens,Greece,https://www.tripadvisor.com/Attraction_Review-g189400-d2020955-Reviews-Chat_Tours-Athens_Attica.html
217,Athens Shore Excursion: Acropolis Walking Tour,City Tours,3–4 hours,$88.25,per adult,Free cancellation,By Athens Walking Tours,Athens,Greece,https://www.tripadvisor.com/Attraction_Review-g189400-d3198860-Reviews-Athens_Walking_Tours-Athens_Attica.html
218,Learn the Art of Phyllo: Private Cooking Class in Athens,Cooking Classes,3 hours,$120.00,per adult,Free cancellation,By Traveling Spoon,Athens,Greece,https://www.tripadvisor.com/Attraction_Review-g189400-d12564841-Reviews-Traveling_Spoon-Athens_Attica.html
219,Day Trip to Hydra Island from Athens,Full-day Tours,6+ hours,$150.47,per adult,Free cancellation,By Keytours - Greece,Athens,Greece,https://www.tripadvisor.com/Attraction_Review-g189400-d20151049-Reviews-Keytours_Greece-Athens_Attica.html
220,Skip the Line Acropolis Museum Tour,Walking Tours,1–2 hours,$36.20,per adult,Free cancellation,By Athens Walking Tours,Athens,Greece,https://www.tripadvisor.com/Attraction_Review-g189400-d3198860-Reviews-Athens_Walking_Tours-Athens_Attica.html
221,120 Minute Couples Royal Massage Treatment,,2 hours,$192.33,per group,,By Massage Point - Athens,Athens,Greece,https://www.tripadvisor.com/Attraction_Review-g189400-d1553269-Reviews-Massage_Point_Athens-Athens_Attica.html
222,Withlocals Your Way: Greece 100% Personalised Private Food Tour,Walking Tours,3 hours,$77.15,per adult,Free cancellation,By Withlocals,Athens,Greece,https://www.tripadvisor.com/Attraction_Review-g189400-d12429012-Reviews-Withlocals-Athens_Attica.html
223,"Thermopylae, Meteora and Delphi Full Day Tour",Bus Tours,6+ hours,$356.38,per adult,Free cancellation,By Theodores Travel,Athens,Greece,https://www.tripadvisor.com/Attraction_Review-g3695522-d14178099-Reviews-Theodores_Travel-Nea_Ionia_Attica.html
224,Get a Taste of Athens Food Tour,Walking Tours,3–4 hours,$61.09,per adult,Free cancellation,By Truevoyagers,Athens,Greece,https://www.tripadvisor.com/Attraction_Review-g189400-d13477135-Reviews-Truevoyagers-Athens_Attica.html
225,,8,10,,,,,Athens,Greece,
226,,,,,,,Clear all filters,Athens,Greece,
227,Private Biblical tour of Ancient Corinth & Corinth Canal from Athens & Corinth,Bus Tours,8–9 hours,$84.85,per adult,Free cancellation,By My Athens Transfers,Athens,Greece,https://www.tripadvisor.com/Attraction_Review-g189400-d9846275-Reviews-My_Athens_Transfers-Athens_Attica.html
228,Panorama of Athens in 6 Hours:Private Tour,Shore Excursions,5–6 hours,$293.02,per group,Free cancellation,By Athens Tour 365,Athens,Greece,https://www.tripadvisor.com/Attraction_Review-g189400-d3997249-Reviews-Athens_Tour_365-Athens_Attica.html
229,Acropolis & Athens Highlights with Food Tasting,Walking Tours,4 hours,$123.32,per adult,Free cancellation,By Athens Walking Tours,Athens,Greece,https://www.tripadvisor.com/Attraction_Review-g189400-d3198860-Reviews-Athens_Walking_Tours-Athens_Attica.html
230,"4-Day Classical Greece Private Tour - With Expert Guide, Tickets & Hotel Options",Bus Tours,3+ days,"$1,641.61",per adult,Free cancellation,By Warmpenguin,Athens,Greece,https://www.tripadvisor.com/Attraction_Review-g189400-d8776669-Reviews-Warmpenguin-Athens_Attica.html
231,Central Athens Highlights Small Group Tour by TRIKKE,Trikke Tours,2 hours,$78.06,per adult,Free cancellation,By Scooterise,Athens,Greece,https://www.tripadvisor.com/Attraction_Review-g189400-d4915793-Reviews-Scooterise-Athens_Attica.html
232,Private Layover Athens Sightseeing Tour from the Airport or Port,Bus Tours,5 hours,$119.92,per adult,Free cancellation,By Welcome Pickups,Athens,Greece,https://www.tripadvisor.com/Attraction_Review-g189400-d8609163-Reviews-Welcome_Pickups-Athens_Attica.html
233,Ancient Corinth and Corinth Canal Private Tour from Athens,Bus Tours,5–6 hours,$287.83,per group,Free cancellation,By CATTaxi,Athens,Greece,https://www.tripadvisor.com/Attraction_Review-g189400-d8378546-Reviews-CATTaxi-Athens_Attica.html
234,Thermal SPA - Wellness & Leisure Experience At Lake Vouliagmeni in Athens,City Tours,4–5 hours,$117.44,per adult,Free cancellation,By Crispy Local,Athens,Greece,https://www.tripadvisor.com/Attraction_Review-g189400-d17314098-Reviews-Crispy_Local-Athens_Attica.html
235,Acropolis Half-day Walking and Trikke Tour,E-Bike Tours,4 hours,$100.69,per adult,Free cancellation,By Scooterise,Athens,Greece,https://www.tripadvisor.com/Attraction_Review-g189400-d4915793-Reviews-Scooterise-Athens_Attica.html
236,Cooking Class in Athens with Shopping in Central Market & Lunch,Cooking Classes,4 hours,$98.43,per adult,Free cancellation,By Active Athens Holidays,Athens,Greece,https://www.tripadvisor.com/Attraction_Review-g189400-d3694091-Reviews-Active_Athens_Holidays-Athens_Attica.html
237,Skip the Line Ancient Agora and the Agora Museum Tour,Walking Tours,1–2 hours,$36.20,per adult,Free cancellation,By Athens Walking Tours,Athens,Greece,https://www.tripadvisor.com/Attraction_Review-g189400-d3198860-Reviews-Athens_Walking_Tours-Athens_Attica.html
238,OLYMPIC games in Ancient Olympia Full-Day Small-Group Tour from Athens,Bus Tours,6+ hours,$197.99,per adult,Free cancellation,By EASYEXPERIENCES,Athens,Greece,https://www.tripadvisor.com/Attraction_Review-g189400-d17836236-Reviews-EASYEXPERIENCES-Athens_Attica.html
239,Athens All Included: Acropolis and Museum In a Cultural Guided Walking Tour,Shore Excursions,3 hours,$106.35,per adult,Free cancellation,By Walks In Europe - Athens,Athens,Greece,https://www.tripadvisor.com/Attraction_Review-g189400-d11747190-Reviews-Walks_In_Europe_Athens-Athens_Attica.html
240,Private Cruise in Athens with Snorkeling and Swimming,Adventure Tours,6 hours,$437.84,per adult,Free cancellation,By Extreme Divers,Athens,Greece,https://www.tripadvisor.com/Attraction_Review-g189400-d6726058-Reviews-Extreme_Divers-Athens_Attica.html
241,Mycenae and Epidaurus Full Day Trip from Athens with Walking Tour in Nafplio,Bus Tours,6+ hours,$113.14,per adult,Free cancellation,By Keytours - Greece,Athens,Greece,https://www.tripadvisor.com/Attraction_Review-g189400-d20151049-Reviews-Keytours_Greece-Athens_Attica.html
242,"Kalavryta (Rack railway) Cave of Lakes, private tour from Athens/ Nafplion (11h)",Full-day Tours,6+ hours,$113.14,per adult,Free cancellation,By GREECE TAXI,Athens,Greece,https://www.tripadvisor.com/Attraction_Review-g189400-d16713235-Reviews-GREECE_TAXI-Athens_Attica.html
243,1-Hour Aroma Oil Massage plus 20-Minute Free Fish Pedi,,1–2 hours,$90.51,per adult,Free cancellation,By Athens Fish Spa Massage & Hammam,Athens,Greece,https://www.tripadvisor.com/Attraction_Review-g189400-d2099485-Reviews-Athens_Fish_Spa_Massage_Hammam-Athens_Attica.html
244,3-Day Trip to Delphi and Meteora from Athens,Bus Tours,3 days,$391.45,per adult,Free cancellation,By Chat Tours,Athens,Greece,https://www.tripadvisor.com/Attraction_Review-g189400-d2020955-Reviews-Chat_Tours-Athens_Attica.html
245,Cape Sounio Afternoon Tour,Bus Tours,4 hours,$62.22,per adult,Free cancellation,By Let's Book Travel,Athens,Greece,https://www.tripadvisor.com/Attraction_Review-g189400-d15238655-Reviews-Let_s_Book_Travel-Athens_Attica.html
246,Private City Kickstart Tour: Athens,City Tours,1–2 hours,$58.83,per adult,Free cancellation,By Withlocals,Athens,Greece,https://www.tripadvisor.com/Attraction_Review-g189400-d12429012-Reviews-Withlocals-Athens_Attica.html
247,Ancient Athens for Kids 4-Hour Private Walking Tour,Walking Tours,4 hours,$138.16,per adult,Free cancellation,By Be a Greek,Athens,Greece,https://www.tripadvisor.com/Attraction_Review-g189400-d11884729-Reviews-Be_a_Greek-Athens_Attica.html
248,Athens Riverside: A Journey in Mythical Athens,City Tours,3 hours,$46.06,per adult,Free cancellation,By Urban Athens Collective,Athens,Greece,https://www.tripadvisor.com/Attraction_Review-g189400-d9570585-Reviews-Urban_Athens_Collective-Athens_Attica.html
249,Get Lost in Athens with an Insider,City Tours,3 hours,$28.41,per adult,Free cancellation,By Urban Athens Collective,Athens,Greece,https://www.tripadvisor.com/Attraction_Review-g189400-d9570585-Reviews-Urban_Athens_Collective-Athens_Attica.html
250,Athens Greece Half Day Private Tour,Bus Tours,5 hours,$390.32,per group,Free cancellation,By Elegant Greek Tours,Athens,Greece,https://www.tripadvisor.com/Attraction_Review-g189400-d16755419-Reviews-Elegant_Greek_Tours-Athens_Attica.html
251,Skip-the-Line Multipass to Top Attractions of Athens,Ancient Ruins,3+ days,$47.52,per adult,Free cancellation,By Keytours - Greece,Athens,Greece,https://www.tripadvisor.com/Attraction_Review-g189400-d20151049-Reviews-Keytours_Greece-Athens_Attica.html
252,Rail Tour from Athens to Meteora 3 Days - 2 Nights,Bus Tours,2 days,$305.47,per adult,Free cancellation,By Visit Meteora Travel,Athens,Greece,https://www.tripadvisor.com/Attraction_Review-g315843-d4222253-Reviews-Visit_Meteora_Travel-Kalambaka_Trikala_Region_Thessaly.html
253,Athens Sunset Electric Bike Tour,E-Bike Tours,3 hours,$50.91,per adult,Free cancellation,By Athens by Bike,Athens,Greece,https://www.tripadvisor.com/Attraction_Review-g189400-d1783079-Reviews-Athens_by_Bike-Athens_Attica.html
254,Acropolis Morning Walking Tour(Small Group),Walking Tours,1–2 hours,$36.54,per adult,Free cancellation,By Mister Plato,Athens,Greece,https://www.tripadvisor.com/Attraction_Review-g189400-d16696159-Reviews-Mister_Plato-Athens_Attica.html
255,Athens Photography Tour,Private and Luxury,2–3 hours,$121.28,per adult,Free cancellation,By Athens Photo Tour,Athens,Greece,https://www.tripadvisor.com/Attraction_Review-g189400-d4942063-Reviews-Athens_Photo_Tour-Athens_Attica.html
256,"Athens Street Culture & Food, off-the-beaten path",Walking Tours,3 hours,$55.44,per adult,Free cancellation,By Athens Walking Tours,Athens,Greece,https://www.tripadvisor.com/Attraction_Review-g189400-d3198860-Reviews-Athens_Walking_Tours-Athens_Attica.html
257,,9,11,,,,,Athens,Greece,
258,,,,,,,Clear all filters,Athens,Greece,
259,"Epidaurus, Mycenae and Nafplio Small-Group Tour from Athens",Bus Tours,6+ hours,$124.45,per adult,Free cancellation,By Getaways Greece,Athens,Greece,https://www.tripadvisor.com/Attraction_Review-g189400-d8295460-Reviews-Getaways_Greece-Athens_Attica.html
260,"Private Tour of Nafplio, Mycenae, Epidaurus & Canal From Athens",Day Trips,6+ hours,$253.99,per adult,Free cancellation,By Ancient Greece Tours & Transfers,Athens,Greece,https://www.tripadvisor.com/Attraction_Review-g189484-d9985820-Reviews-Ancient_Greece_Tours_Transfers-Corinth_Corinthia_Region_Peloponnese.html
261,4 Hours - Athens & Acropolis Highlights Private Tour,Bus Tours,4 hours,$138.59,per adult,Free cancellation,By Olive Sea Travel,Athens,Greece,https://www.tripadvisor.com/Attraction_Review-g189400-d12858625-Reviews-Olive_Sea_Travel-Athens_Attica.html
262,Private Athens Walking Tour with a Personal Photographer,Walking Tours,1–2 hours,$225.14,per group,Free cancellation,By Athens Photo Tour,Athens,Greece,https://www.tripadvisor.com/Attraction_Review-g189400-d4942063-Reviews-Athens_Photo_Tour-Athens_Attica.html
263,"Private Sunset Tour of Cape Sounion, Temple of Poseidon & Athens Riviera",Car Tours,5 hours,$147.08,per adult,Free cancellation,By Ancient Greece Tours & Transfers,Athens,Greece,https://www.tripadvisor.com/Attraction_Review-g189484-d9985820-Reviews-Ancient_Greece_Tours_Transfers-Corinth_Corinthia_Region_Peloponnese.html
264,Electricityrides | e-bike night rides,E-Bike Tours,2–3 hours,$39.60,per adult,Free cancellation,By electricityrides,Athens,Greece,https://www.tripadvisor.com/Attraction_Review-g189400-d17540383-Reviews-Electricityrides-Athens_Attica.html
265,Half Day Athens Sightseeing Tour with Acropolis Museum,Bus Tours,5 hours,$76.93,per adult,Free cancellation,By Let's Book Travel,Athens,Greece,https://www.tripadvisor.com/Attraction_Review-g189400-d15238655-Reviews-Let_s_Book_Travel-Athens_Attica.html
266,Half Day Private Athens Shore Excursion,Bus Tours,5 hours,$137.14,per adult,Free cancellation,By Tours of Athens,Athens,Greece,https://www.tripadvisor.com/Attraction_Review-g189400-d5568141-Reviews-Tours_of_Athens-Athens_Attica.html
267,Private Full Day Athens Tour,Full-day Tours,6+ hours,$184.22,per adult,Free cancellation,By Athens Limo Tours,Athens,Greece,https://www.tripadvisor.com/Attraction_Review-g189400-d3239740-Reviews-Athens_Limo_Tours-Athens_Attica.html
268,Piraeus port to Athens hotels Private arrival transfer,,30 minutes,$23.76,per adult,Free cancellation,By My Athens Transfers,Athens,Greece,https://www.tripadvisor.com/Attraction_Review-g189400-d9846275-Reviews-My_Athens_Transfers-Athens_Attica.html
269,Private Tour Corinth to walk at the Path's of Apostle Paul!,Bus Tours,5 hours,$169.70,per adult,Free cancellation,By Private Tours Greece,Athens,Greece,https://www.tripadvisor.com/Attraction_Review-g189400-d7119301-Reviews-Private_Tours_Greece-Athens_Attica.html
270,Acropolis Museum Night tour on Fridays with optional dinner,Private and Luxury,2 hours,$56.57,per adult,Free cancellation,By Athens Walks Tour Company,Athens,Greece,https://www.tripadvisor.com/Attraction_Review-g189400-d3190873-Reviews-Athens_Walks_Tour_Company-Athens_Attica.html
271,Private-Your Own Ancient Calculating Mechanism workshop (Antikythera Mechanism),,4 hours,$134.63,per adult,Free cancellation,By SpecialTy Tours - Greece,Athens,Greece,https://www.tripadvisor.com/Attraction_Review-g189400-d16858537-Reviews-SpecialTy_Tours_Greece-Athens_Attica.html
272,"Discover your talent in sculpture, in a country where golden section was born.",Pottery Classes,2 hours,$49.32,per adult,Free cancellation,By Ancient Symposium,Athens,Greece,https://www.tripadvisor.com/Attraction_Review-g189400-d17583327-Reviews-Ancient_Symposium-Athens_Attica.html
273,Day trip to Ancient Olympia from Athens,Bus Tours,6+ hours,$218.76,per adult,Free cancellation,By My Transfers Athens,Athens,Greece,https://www.tripadvisor.com/Attraction_Review-g189400-d19954139-Reviews-My_Transfers_Athens-Athens_Attica.html
274,Greek Wine Tasting,,1 hour,$19.23,per adult,Free cancellation,By Cinque Wine Delights,Athens,Greece,https://www.tripadvisor.com/Attraction_Review-g189400-d13204825-Reviews-Cinque_Wine_Delights-Athens_Attica.html
275,Acropolis Museum: Athenian Discovery Small Group Tour,Walking Tours,2 hours,$56.57,per adult,Free cancellation,By Alternative Athens,Athens,Greece,https://www.tripadvisor.com/Attraction_Review-g189400-d3820406-Reviews-Alternative_Athens-Athens_Attica.html
276,Delphi Guided Small Group Day Tour from Athens,Bus Tours,6+ hours,$124.45,per adult,Free cancellation,By Getaways Greece,Athens,Greece,https://www.tripadvisor.com/Attraction_Review-g189400-d8295460-Reviews-Getaways_Greece-Athens_Attica.html
277,Shared Departure Transfer: Hotel to Athens Airport,,45 minutes,$23.76,per adult,Free cancellation,By Key Transfers,Athens,Greece,https://www.tripadvisor.com/Attraction_Review-g562633-d20067405-Reviews-Key_Transfers-Voula_East_Attica_Region_Attica.html
278,Athens:Half day tour to Acropolis and the must-see historical sites and downtown,Bus Tours,5–6 hours,$107.46,per adult,Free cancellation,By Greece Athens Taxi GAT,Athens,Greece,https://www.tripadvisor.com/Attraction_Review-g189400-d16827695-Reviews-Greece_Athens_Taxi_GAT-Athens_Attica.html
279,Ancient Corinth - Acrocorinth & Corinth Canal Private Half-Day Trip from Athens,Shore Excursions,6–8 hours,$139.16,per adult,Free cancellation,By Crispy Local,Athens,Greece,https://www.tripadvisor.com/Attraction_Review-g189400-d17314098-Reviews-Crispy_Local-Athens_Attica.html
280,Athens By Night & Greek Dance Show,Bus Tours,4 hours,$76.93,per adult,Free cancellation,By Let's Book Travel,Athens,Greece,https://www.tripadvisor.com/Attraction_Review-g189400-d15238655-Reviews-Let_s_Book_Travel-Athens_Attica.html
281,"Private Nemean Wine Tour, Ancient Nemea & Mycenae from Athens",Car Tours,6+ hours,$231.36,per adult,Free cancellation,By Ancient Greece Tours & Transfers,Athens,Greece,https://www.tripadvisor.com/Attraction_Review-g189484-d9985820-Reviews-Ancient_Greece_Tours_Transfers-Corinth_Corinthia_Region_Peloponnese.html
282,"Shore Excursion: Acropolis, Athens City tour and The New Acropolis Museum",City Tours,5–6 hours,$110.87,per adult,Free cancellation,By Athens Walking Tours,Athens,Greece,https://www.tripadvisor.com/Attraction_Review-g189400-d3198860-Reviews-Athens_Walking_Tours-Athens_Attica.html
283,Athens: Acropolis Only,Shore Excursions,2 hours,$83.72,per adult,Free cancellation,By Walks In Europe - Athens,Athens,Greece,https://www.tripadvisor.com/Attraction_Review-g189400-d11747190-Reviews-Walks_In_Europe_Athens-Athens_Attica.html
284,Private Transfer Athens Airport Pick-up (Shuttle Service),Bus Tours,1 hour,$73.54,per group,Free cancellation,By Happy Car Rental,Athens,Greece,https://www.tripadvisor.com/Attraction_Review-g189400-d18980794-Reviews-Happy_Car_Rental-Athens_Attica.html
285,Discover Awesome Street Art with a Street Art Photographer in Athens Small-Group,Walking Tours,3 hours,$40.30,per adult,Free cancellation,By Awesome Athens Experiences,Athens,Greece,https://www.tripadvisor.com/Attraction_Review-g189400-d20950919-Reviews-Awesome_Athens_Experiences-Athens_Attica.html
286,From Athens: 1-Day Rail Tour to Meteora,Bus Tours,4 hours,$107.48,per adult,Free cancellation,By Meteora Trip - Boutique Travel Experience,Athens,Greece,https://www.tripadvisor.com/Attraction_Review-g315843-d16874417-Reviews-Meteora_Trip_Boutique_Travel_Experience-Kalambaka_Trikala_Region_Thessaly.html
287,Historical Athens and Acropolis of Athens Walking Tour,Walking Tours,3 hours,$44.12,per adult,Free cancellation,By Chat Tours,Athens,Greece,https://www.tripadvisor.com/Attraction_Review-g189400-d2020955-Reviews-Chat_Tours-Athens_Attica.html
288,Athens Museum Unlimited Pass,Skip-the-Line Tours,3 days,$62.22,per adult,Free cancellation,By Keytours - Greece,Athens,Greece,https://www.tripadvisor.com/Attraction_Review-g189400-d20151049-Reviews-Keytours_Greece-Athens_Attica.html
289,,10,12,,,,,Athens,Greece,
290,,,,,,,Clear all filters,Athens,Greece,
291,Traditional Dinner in a Greek Tavern,,3 hours,$72.41,per adult,Free cancellation,By MTM DMC Ltd - Greece,Athens,Greece,https://www.tripadvisor.com/Attraction_Review-g189400-d20083914-Reviews-MTM_DMC_Ltd_Greece-Athens_Attica.html
292,Shared Arrival Transfer: Athens Airport to Hotel,,45 minutes,$23.76,per adult,Free cancellation,By Key Transfers,Athens,Greece,https://www.tripadvisor.com/Attraction_Review-g562633-d20067405-Reviews-Key_Transfers-Voula_East_Attica_Region_Attica.html
293,Full day Mycenae - Nafplio - Epidavros private tour,Bus Tours,6+ hours,$206.33,per adult,Free cancellation,By Athens Experiences,Athens,Greece,https://www.tripadvisor.com/Attraction_Review-g189400-d15335939-Reviews-Athens_Experiences-Athens_Attica.html
294,Athens Private Transfer: Central Athens to Piraeus Cruise Port,,30 minutes,$19.80,per adult,Free cancellation,By Key Transfers,Athens,Greece,https://www.tripadvisor.com/Attraction_Review-g562633-d20067405-Reviews-Key_Transfers-Voula_East_Attica_Region_Attica.html
295,Athens Airport ROUND-TRIP Transfer,,40 minutes,$113.14,per group,Free cancellation,By My Transfers Athens,Athens,Greece,https://www.tripadvisor.com/Attraction_Review-g189400-d19954139-Reviews-My_Transfers_Athens-Athens_Attica.html
296,Greek Dancing in Plaka with 3-Course Meal and Wine,Bus Tours,3–30 minutes,$90.51,per adult,Free cancellation,By MTM DMC Ltd - Greece,Athens,Greece,https://www.tripadvisor.com/Attraction_Review-g189400-d20083914-Reviews-MTM_DMC_Ltd_Greece-Athens_Attica.html
297,"The Athens Pass including Gray Line Hop-On Hop-Off, Acropolis and 30 Attractions",Skip-the-Line Tours,1–7 days,$33.94,per adult,Free cancellation,By Keytours - Greece,Athens,Greece,https://www.tripadvisor.com/Attraction_Review-g189400-d20151049-Reviews-Keytours_Greece-Athens_Attica.html
298,Athens City Center to airport departure transfer,,45 minutes,$24.89,per adult,Free cancellation,By Travelguru,Athens,Greece,https://www.tripadvisor.com/Attraction_Review-g189400-d16824881-Reviews-Travelguru-Athens_Attica.html
299,Mount Lycabettus Walking Tour in Athens,City Tours,3 hours,$39.60,per adult,Free cancellation,By Urban Athens Collective,Athens,Greece,https://www.tripadvisor.com/Attraction_Review-g189400-d9570585-Reviews-Urban_Athens_Collective-Athens_Attica.html
300,Polykala Distillery showroom. A122 years of history along with liqueur tasting.,Private and Luxury,20 minutes,$12.44,per adult,Free cancellation,By Polykala's Distillery Show room,Athens,Greece,https://www.tripadvisor.com/Attraction_Review-g189400-d17332512-Reviews-Polykala_s_Distillery_Show_room-Athens_Attica.html
301,Piraeus port/ hotels to Athens airport Private transfer,,50–70 minutes,$38.47,per adult,Free cancellation,By My Athens Transfers,Athens,Greece,https://www.tripadvisor.com/Attraction_Review-g189400-d9846275-Reviews-My_Athens_Transfers-Athens_Attica.html
302,Athens Bike Tour,Bike Tours,3 hours,$39.60,per adult,Free cancellation,By Active Athens Holidays,Athens,Greece,https://www.tripadvisor.com/Attraction_Review-g189400-d3694091-Reviews-Active_Athens_Holidays-Athens_Attica.html
303,Athens Private Airport Transfer with 1 hour Sightseeing,,2 hours,$76.93,per adult,Free cancellation,By Welcome Pickups,Athens,Greece,https://www.tripadvisor.com/Attraction_Review-g189400-d8609163-Reviews-Welcome_Pickups-Athens_Attica.html
304,Athens Airport Private Transfer,,45 minutes,$31.68,per adult,Free cancellation,By Let's Book Travel,Athens,Greece,https://www.tripadvisor.com/Attraction_Review-g189400-d15238655-Reviews-Let_s_Book_Travel-Athens_Attica.html
305,Athens Airport Private Transfer Pick up-Drop Off,,30 minutes,$60.35,per group,Free cancellation,By Happy Car Rental,Athens,Greece,https://www.tripadvisor.com/Attraction_Review-g189400-d18980794-Reviews-Happy_Car_Rental-Athens_Attica.html
306,Skip the Line: War Museum of Athens Entrance Ticket,Skip-the-Line Tours,1–8 hours,$6.79,per adult,Free cancellation,By Keytours - Greece,Athens,Greece,https://www.tripadvisor.com/Attraction_Review-g189400-d20151049-Reviews-Keytours_Greece-Athens_Attica.html
307,Athens airport to City Center arrival transfer,,30–45 minutes,$24.89,per adult,Free cancellation,By Travelguru,Athens,Greece,https://www.tripadvisor.com/Attraction_Review-g189400-d16824881-Reviews-Travelguru-Athens_Attica.html
308,Electricityrides | e-bike day rides,Full-day Tours,2–3 hours,$39.60,per adult,Free cancellation,By electricityrides,Athens,Greece,https://www.tripadvisor.com/Attraction_Review-g189400-d17540383-Reviews-Electricityrides-Athens_Attica.html
309,Athens 70 Minute Express Day Spa Treatment,,1–2 hours,$71.21,per adult,Free cancellation,By Athens Fish Spa Massage & Hammam,Athens,Greece,https://www.tripadvisor.com/Attraction_Review-g189400-d2099485-Reviews-Athens_Fish_Spa_Massage_Hammam-Athens_Attica.html
310,Lʏᴄᴀʙᴇᴛᴛᴜs sᴜɴsᴇᴛ ᴘᴏʀᴛ Pɪʀᴀᴇᴜs ᴀɴᴅ Aᴛʜᴇɴs ʙʏ ɴɪɢʜᴛ ᴅʀɪᴠɪɴɢ ᴛᴏᴜʀ ❗,Bus Tours,4–5 hours,$52.04,per adult,Free cancellation,By EASYEXPERIENCES,Athens,Greece,https://www.tripadvisor.com/Attraction_Review-g189400-d17836236-Reviews-EASYEXPERIENCES-Athens_Attica.html
311,Medieval Senses Walking Tour in Athens,City Tours,3 hours,$46.06,per adult,Free cancellation,By Urban Athens Collective,Athens,Greece,https://www.tripadvisor.com/Attraction_Review-g189400-d9570585-Reviews-Urban_Athens_Collective-Athens_Attica.html
312,20-Minutes Natural Pedicure with Exotic Fish,,20 minutes,$18.10,per adult,Free cancellation,By Athens Fish Spa Massage & Hammam,Athens,Greece,https://www.tripadvisor.com/Attraction_Review-g189400-d2099485-Reviews-Athens_Fish_Spa_Massage_Hammam-Athens_Attica.html
313,Athens Airport Arrival Transfer (Airport to Athens Hotels or Address),,45 minutes,$56.57,per group,Free cancellation,By My Transfers Athens,Athens,Greece,https://www.tripadvisor.com/Attraction_Review-g189400-d19954139-Reviews-My_Transfers_Athens-Athens_Attica.html
