,Tour Name,Tour Type,Tour Duration,Tour Price,Price Per,Cancellation,Tour By,City,Country,Link
314,Hard Rock Cafe Athens Including Meal,,1–2 hours,$23.92,per adult,Free cancellation,By Hard Rock Cafe Athens,Athens,Greece,https://www.tripadvisor.com/Attraction_Review-g189400-d21295391-Reviews-Hard_Rock_Cafe_Athens-Athens_Attica.html
315,Skip the Line: Roman Agora of Athens Entrance Ticket,Ancient Ruins,3 hours,$7.92,per adult,Free cancellation,By Keytours - Greece,Athens,Greece,https://www.tripadvisor.com/Attraction_Review-g189400-d20151049-Reviews-Keytours_Greece-Athens_Attica.html
316,"Athens: Acropolis Hill & Museum, Zeus Temple, Agora Audio Tours (no tickets)",Walking Tours,5–6 hours,$28.28,per adult,Free cancellation,By Clio Muse Tours,Athens,Greece,https://www.tripadvisor.com/Attraction_Review-g189400-d16856505-Reviews-Clio_Muse_Tours-Athens_Attica.html
317,Athens Highlights Trail Urban Run,,1–2 hours,$20.36,per adult,Free cancellation,By Drastirioi,Athens,Greece,https://www.tripadvisor.com/Attraction_Review-g189400-d17720052-Reviews-Drastirioi-Athens_Attica.html
318,Athens: Self-Guided City Experience,City Tours,1–24 hours,$11.31,per adult,,By Vox City: Athens,Athens,Greece,https://www.tripadvisor.com/Attraction_Review-g189400-d21180214-Reviews-Vox_City_Athens-Athens_Attica.html
319,Ancient Agora of Athens: e-Ticket and Audio Tour on Your Smartphone,Ancient Ruins,1–2 hours,$16.97,per adult,Free cancellation,By Clio Muse Tours,Athens,Greece,https://www.tripadvisor.com/Attraction_Review-g189400-d16856505-Reviews-Clio_Muse_Tours-Athens_Attica.html
320,Aroma Massage - Enjoy a complete Spa experience from the comfort of your room,,1 hour,$60.35,per adult,Free cancellation,By Aroma Massage,Athens,Greece,https://www.tripadvisor.com/Attraction_Review-g189400-d17778704-Reviews-Aroma_Massage-Athens_Attica.html
321,,11,13,,,,,Athens,Greece,
322,,,,,,,Clear all filters,Athens,Greece,
323,Skip the Line: Frissiras Museum Entrance Ticket,Skip-the-Line Tours,1–5 hours,$6.79,per adult,Free cancellation,By Keytours - Greece,Athens,Greece,https://www.tripadvisor.com/Attraction_Review-g189400-d20151049-Reviews-Keytours_Greece-Athens_Attica.html
324,Athens Full Day Private Sightseeing Tour,Bus Tours,6+ hours,$124.45,per adult,Free cancellation,By Xenon Travel,Athens,Greece,https://www.tripadvisor.com/Attraction_Review-g189400-d21337622-Reviews-Xenon_Travel-Athens_Attica.html
325,"Private Gods, Myths & Tales of Athens Tour with your Family",City Tours,3 hours,$93.90,per adult,Free cancellation,By Withlocals,Athens,Greece,https://www.tripadvisor.com/Attraction_Review-g189400-d12429012-Reviews-Withlocals-Athens_Attica.html
326,"Small-Group Athens Greek Food & Culture Tour W/ Tastings, Tavernas & Hidden Gems",Walking Tours,3–4 hours,$74.66,per adult,Free cancellation,By Buzz Tours,Athens,Greece,https://www.tripadvisor.com/Attraction_Review-g189400-d19814860-Reviews-Buzz_Tours-Athens_Attica.html
327,Private City Kickstart Tour: Hidden Districts,Walking Tours,1–2 hours,$38.47,per adult,Free cancellation,By Withlocals,Athens,Greece,https://www.tripadvisor.com/Attraction_Review-g189400-d12429012-Reviews-Withlocals-Athens_Attica.html
328,Private Transfer From Athens Airport To Athens Center/Suburbs,,45 minutes,$78.45,per adult,Free cancellation,By Athens Limo Tours,Athens,Greece,https://www.tripadvisor.com/Attraction_Review-g189400-d3239740-Reviews-Athens_Limo_Tours-Athens_Attica.html
329,Private Transfer Athens International AirPort from /To Athens City Center,,1 hour,$30.54,per adult,Free cancellation,By Yomadic,Athens,Greece,https://www.tripadvisor.com/Attraction_Review-g189400-d20313626-Reviews-Yomadic-Athens_Attica.html
330,Delphi Full Day Private Tour From Athens,Car Tours,7–9 hours,$169.70,per adult,Free cancellation,By Crispy Local,Athens,Greece,https://www.tripadvisor.com/Attraction_Review-g189400-d17314098-Reviews-Crispy_Local-Athens_Attica.html
331,Airport transfer,,35–75 minutes,$135.76,per group,Free cancellation,By Greece Private Transfer,Athens,Greece,https://www.tripadvisor.com/Attraction_Review-g189400-d13748433-Reviews-Greece_Private_Transfer-Athens_Attica.html
332,Private photo tour in Athens,,4 hours,$135.76,per adult,Free cancellation,By Stefanos Symeonidis,Athens,Greece,https://www.tripadvisor.com/Attraction_Review-g189400-d23521711-Reviews-Stefanos_Symeonidis-Athens_Attica.html
333,Athens Full Day 8 Hours Open Tour.,Bus Tours,6+ hours,$106.35,per adult,Free cancellation,By E&G Travel in Greece,Athens,Greece,https://www.tripadvisor.com/Attraction_Review-g189400-d20035005-Reviews-E_G_Travel_in_Greece-Athens_Attica.html
334,"2 Day Private Tour Of Delphi, Meteora & Thermopylae From Athens & Corinthia - Overnight At Kalambaka or Kastraki",Car Tours,2 days,$475.17,per adult,Free cancellation,By Ancient Greece Tours & Transfers,Athens,Greece,https://www.tripadvisor.com/Attraction_Review-g189484-d9985820-Reviews-Ancient_Greece_Tours_Transfers-Corinth_Corinthia_Region_Peloponnese.html
335,Athens city Full Day Private Tour with Greek Traditional Food,Bus Tours,8–9 hours,$127.28,per adult,Free cancellation,By My Athens Transfers,Athens,Greece,https://www.tripadvisor.com/Attraction_Review-g189400-d9846275-Reviews-My_Athens_Transfers-Athens_Attica.html
336,Mycenae-Nafplio-Epidaurus Full Day Private Tour from Athens With Lunch,Shore Excursions,8–9 hours,$214.96,per adult,Free cancellation,By Crispy Local,Athens,Greece,https://www.tripadvisor.com/Attraction_Review-g189400-d17314098-Reviews-Crispy_Local-Athens_Attica.html
337,Sounion Sunset Private Tour,Skyscrapers & Towers,5 hours,$294.15,per group,Free cancellation,By H.P. Tours - Hellenic Private Tours,Athens,Greece,https://www.tripadvisor.com/Attraction_Review-g189400-d3138366-Reviews-H_P_Tours_Hellenic_Private_Tours-Athens_Attica.html
338,Athens and Piraeus private tour for groups,Bus Tours,4–6 hours,$212.54,per group,Free cancellation,By Sights of Athens,Athens,Greece,https://www.tripadvisor.com/Attraction_Review-g189400-d6999086-Reviews-Sights_of_Athens-Athens_Attica.html
339,Private Half Day Athens Tour,Bus Tours,5 hours,$137.14,per adult,Free cancellation,By Athens Limo Tours,Athens,Greece,https://www.tripadvisor.com/Attraction_Review-g189400-d3239740-Reviews-Athens_Limo_Tours-Athens_Attica.html
340,"Mycenae, Epidaurus & Nafplio Private Tour From Athens up to 9h",Bus Tours,6+ hours,$164.04,per adult,Free cancellation,By Yomadic,Athens,Greece,https://www.tripadvisor.com/Attraction_Review-g189400-d20313626-Reviews-Yomadic-Athens_Attica.html
341,"Mercedes Private Full-Day Tour, Nafplio, Corinth Canal and Wine Tasting",Bus Tours,6+ hours,$186.67,per adult,Free cancellation,By Greece Experience Tours,Athens,Greece,https://www.tripadvisor.com/Attraction_Review-g189400-d20263718-Reviews-Greece_Experience_Tours-Athens_Attica.html
342,Athens city + Cape Sounio combo Full Day Private Tour,Bus Tours,8–9 hours,$141.42,per adult,Free cancellation,By My Athens Transfers,Athens,Greece,https://www.tripadvisor.com/Attraction_Review-g189400-d9846275-Reviews-My_Athens_Transfers-Athens_Attica.html
343,Athens Private Full Day Tour 8 hours,Full-day Tours,6+ hours,$276.32,per adult,,By My Athens Tour,Athens,Greece,https://www.tripadvisor.com/Attraction_Review-g189400-d2666599-Reviews-My_Athens_Tour-Athens_Attica.html
344,"2 or 3-Day Private Tour: Ancient Olympia, Corinth, Mycenae, Epidaurus, Nafplion",Bus Tours,3 days,$709.36,per adult,Free cancellation,By Warmpenguin,Athens,Greece,https://www.tripadvisor.com/Attraction_Review-g189400-d8776669-Reviews-Warmpenguin-Athens_Attica.html
345,Athens airport to Piraeus port/ hotels Private transfer,,50–70 minutes,$38.47,per adult,Free cancellation,By My Athens Transfers,Athens,Greece,https://www.tripadvisor.com/Attraction_Review-g189400-d9846275-Reviews-My_Athens_Transfers-Athens_Attica.html
346,Best of Athens Half Day Private Tour,Bus Tours,5 hours,$181.02,per adult,Free cancellation,By Theodores Travel,Athens,Greece,https://www.tripadvisor.com/Attraction_Review-g3695522-d14178099-Reviews-Theodores_Travel-Nea_Ionia_Attica.html
347,Greek food and wine tasting,,2 hours,$39.60,per adult,Free cancellation,By Cinque Wine Delights,Athens,Greece,https://www.tripadvisor.com/Attraction_Review-g189400-d13204825-Reviews-Cinque_Wine_Delights-Athens_Attica.html
348,"Corinth Canal, Ancient Corinth, Myceae, Nafplio Private Sightseeing",Bus Tours,6+ hours,$112.56,per adult,Free cancellation,By Enjoy Greece Tours,Athens,Greece,https://www.tripadvisor.com/Attraction_Review-g189400-d11801133-Reviews-Enjoy_Greece_Tours-Athens_Attica.html
349,Acropolis Of Athens & The Acropolis Museum Private Guided Tour,Shore Excursions,4 hours,$285.76,per group,Free cancellation,By Crispy Local,Athens,Greece,https://www.tripadvisor.com/Attraction_Review-g189400-d17314098-Reviews-Crispy_Local-Athens_Attica.html
350,Athens Highlights: Myths & Philosophers Walking Tour,Walking Tours,4 hours,$147.08,per adult,Free cancellation,By Be a Greek,Athens,Greece,https://www.tripadvisor.com/Attraction_Review-g189400-d11884729-Reviews-Be_a_Greek-Athens_Attica.html
351,"""Athens city tour""",Bus Tours,5–6 hours,$245.62,per group,Free cancellation,By Greece Athens Taxi GAT,Athens,Greece,https://www.tripadvisor.com/Attraction_Review-g189400-d16827695-Reviews-Greece_Athens_Taxi_GAT-Athens_Attica.html
352,Private Transfer from Athens International Airport to Athens Center,,45 minutes,$30.17,per adult,Free cancellation,By Athenians First,Athens,Greece,https://www.tripadvisor.com/Attraction_Review-g189400-d13962674-Reviews-Athenians_First-Athens_Attica.html
353,,12,14,,,,,Athens,Greece,
354,,,,,,,Clear all filters,Athens,Greece,
355,"Amazing Sunset at Poseidon's Temple, Cape Sounio",Bus Tours,5 hours,$80.07,per adult,Free cancellation,By Enjoy Greece Tours,Athens,Greece,https://www.tripadvisor.com/Attraction_Review-g189400-d11801133-Reviews-Enjoy_Greece_Tours-Athens_Attica.html
356,"Mycenae,Nafplio & Epidaurus Private Tour from Athens",Bus Tours,8–9 hours,$183.45,per adult,Free cancellation,By LS Tours,Athens,Greece,https://www.tripadvisor.com/Attraction_Review-g189400-d23642249-Reviews-LS_Tours-Athens_Attica.html
357,"Delphi Full Day Private Tour: Temple of Apollo, Museum, Navel of Earth & Oracle",Full-day Tours,7–9 hours,$478.95,per group,Free cancellation,By Athens Taxi Travel,Athens,Greece,https://www.tripadvisor.com/Attraction_Review-g189400-d12962636-Reviews-Athens_Taxi_Travel-Athens_Attica.html
358,"10 Day to Ancient Greece, Mycenae, Olympia, Delphi, Meteora & Santorini Island",Bus Tours,3+ days,"$2,905.34",per adult,Free cancellation,By Private Tours Greece,Athens,Greece,https://www.tripadvisor.com/Attraction_Review-g189400-d7119301-Reviews-Private_Tours_Greece-Athens_Attica.html
359,Taste Athens Food Walk: Market Visit & Delicious Lunch for small groups,Walking Tours,3 hours,$90.58,per adult,Free cancellation,By Eatwith Athens,Athens,Greece,https://www.tripadvisor.com/Attraction_Review-g189400-d19512841-Reviews-Eatwith_Athens-Athens_Attica.html
360,e-TUK Athens Old Town Tour by Day,Private and Luxury,2 hours,$173.17,per adult,Free cancellation,By Tuk Tuk Tours,Athens,Greece,https://www.tripadvisor.com/Attraction_Review-g189400-d15351934-Reviews-Tuk_Tuk_Tours-Athens_Attica.html
361,"Athens Private All Included: Acropolis and Museum,Cultural Guided Walking Tour",Shore Excursions,3 hours,$226.27,per adult,Free cancellation,By Walks In Europe - Athens,Athens,Greece,https://www.tripadvisor.com/Attraction_Review-g189400-d11747190-Reviews-Walks_In_Europe_Athens-Athens_Attica.html
362,Athens city private tour,Bus Tours,4–5 hours,$135.10,per adult,Free cancellation,By Athens Experiences,Athens,Greece,https://www.tripadvisor.com/Attraction_Review-g189400-d15335939-Reviews-Athens_Experiences-Athens_Attica.html
363,Full-Day Tour to Panos Cave and Ancient Aqueduct from Athens,Adventure Tours,6+ hours,$107.48,per adult,Free cancellation,By MyGreece,Athens,Greece,https://www.tripadvisor.com/Attraction_Review-g189473-d20943622-Reviews-MyGreece-Thessaloniki_Thessaloniki_Region_Central_Macedonia.html
364,Cape Sounio Temple Of Poseidon & Vouliagmeni Lake. Private Tour From Athens 4h,Bus Tours,4 hours,$90.50,per adult,Free cancellation,By Yomadic,Athens,Greece,https://www.tripadvisor.com/Attraction_Review-g189400-d20313626-Reviews-Yomadic-Athens_Attica.html
365,Athens in a day: The Best 1 Day Itinerary.A surprising number of top attractions,Bus Tours,8–10 hours,$138.16,per adult,Free cancellation,By Greece Athens Taxi GAT,Athens,Greece,https://www.tripadvisor.com/Attraction_Review-g189400-d16827695-Reviews-Greece_Athens_Taxi_GAT-Athens_Attica.html
366,Essential Athens Highlights Full-Day Private Tour with Flexible Options,Bus Tours,7–8 hours,$226.27,per adult,Free cancellation,By Warmpenguin,Athens,Greece,https://www.tripadvisor.com/Attraction_Review-g189400-d8776669-Reviews-Warmpenguin-Athens_Attica.html
367,"Feel Ancient thermal Spa Visit Delphi, Leonidas ℨoo Spaʀtans",Bus Tours,6+ hours,$175.36,per adult,Free cancellation,By EASYEXPERIENCES,Athens,Greece,https://www.tripadvisor.com/Attraction_Review-g189400-d17836236-Reviews-EASYEXPERIENCES-Athens_Attica.html
368,Layover Athens Highlights Drop off at Airport 5 Hours,Bus Tours,5 hours,$109.73,per adult,Free cancellation,By Yomadic,Athens,Greece,https://www.tripadvisor.com/Attraction_Review-g189400-d20313626-Reviews-Yomadic-Athens_Attica.html
369,"""Private tour in Athens""",Bus Tours,5–6 hours,$220.62,per group,Free cancellation,By Greece Athens Taxi GAT,Athens,Greece,https://www.tripadvisor.com/Attraction_Review-g189400-d16827695-Reviews-Greece_Athens_Taxi_GAT-Athens_Attica.html
370,Private Tour of Classical Athens,Car Tours,6+ hours,$195.16,per adult,Free cancellation,By Ancient Greece Tours & Transfers,Athens,Greece,https://www.tripadvisor.com/Attraction_Review-g189484-d9985820-Reviews-Ancient_Greece_Tours_Transfers-Corinth_Corinthia_Region_Peloponnese.html
371,"2 Days Herodotus History Tour - Marathon, Thermopylae, Delphi, Plataea, Salamis",Luxury Car Tours,2 days,$186.67,per adult,,By GREECE TAXI,Athens,Greece,https://www.tripadvisor.com/Attraction_Review-g189400-d16713235-Reviews-GREECE_TAXI-Athens_Attica.html
372,Athens Tour In 5 hours by a local,Bus Tours,5 hours,$101.82,per adult,Free cancellation,By Golden Greece Tours,Athens,Greece,https://www.tripadvisor.com/Attraction_Review-g189400-d12453204-Reviews-Golden_Greece_Tours-Athens_Attica.html
373,Private Transfer from Athens to Lefkada Town or Lefkada Marina,,4–5 hours,$452.54,per group,Free cancellation,By City Transfer,Athens,Greece,https://www.tripadvisor.com/Attraction_Review-g189400-d17143225-Reviews-City_Transfer-Athens_Attica.html
374,Half-day Sounio and Athenian Riviera private tour,Bus Tours,5 hours,$122.81,per adult,Free cancellation,By Athens Experiences,Athens,Greece,https://www.tripadvisor.com/Attraction_Review-g189400-d15335939-Reviews-Athens_Experiences-Athens_Attica.html
375,Private Transfer from Athens International Airport to Athens,,35–55 minutes,$92.77,per group,Free cancellation,By iolaos travel (transfers & tours),Athens,Greece,https://www.tripadvisor.com/Attraction_Review-g189400-d20905840-Reviews-Iolaos_travel_transfers_tours-Athens_Attica.html
376,The Top Meteora Greece Private Day Tour from Athens,Bus Tours,13–14 hours,$350.72,per adult,Free cancellation,By Four Seasons Greece Tours,Athens,Greece,https://www.tripadvisor.com/Attraction_Review-g189400-d19307055-Reviews-Four_Seasons_Greece_Tours-Athens_Attica.html
377,Half-day e-bike tour in Athens and Riviera,E-Bike Tours,3–4 hours,$50.91,per adult,Free cancellation,By Active Athens Holidays,Athens,Greece,https://www.tripadvisor.com/Attraction_Review-g189400-d3694091-Reviews-Active_Athens_Holidays-Athens_Attica.html
378,''Delphi - The navel of the earth'',Bus Tours,6+ hours,$199.57,per adult,Free cancellation,By Greece Athens Taxi GAT,Athens,Greece,https://www.tripadvisor.com/Attraction_Review-g189400-d16827695-Reviews-Greece_Athens_Taxi_GAT-Athens_Attica.html
379,Athens Airport Private Transfer To Athens Hotels,,45–60 minutes,$54.31,per adult,Free cancellation,By Crispy Local,Athens,Greece,https://www.tripadvisor.com/Attraction_Review-g189400-d17314098-Reviews-Crispy_Local-Athens_Attica.html
380,2 Day Private Tour to Amazing Delphi & Meteora,Bus Tours,2 days,"$1,244.50",per adult,Free cancellation,By Enjoy Greece Tours,Athens,Greece,https://www.tripadvisor.com/Attraction_Review-g189400-d11801133-Reviews-Enjoy_Greece_Tours-Athens_Attica.html
381,Mercedes Luxury Private Transfer Athens - Piraeus,,30 minutes,$16.63,per adult,Free cancellation,By Greece Experience Tours,Athens,Greece,https://www.tripadvisor.com/Attraction_Review-g189400-d20263718-Reviews-Greece_Experience_Tours-Athens_Attica.html
382,"Cape Sounio,Temple of Poseidon Half day Tour",Bus Tours,5 hours,$67.88,per adult,Free cancellation,By Greece Private Transfer,Athens,Greece,https://www.tripadvisor.com/Attraction_Review-g189400-d13748433-Reviews-Greece_Private_Transfer-Athens_Attica.html
383,2 Day Award Winning Private Tour to Delphi & Meteora from Athens,Bus Tours,2 days,$499.10,per adult,Free cancellation,By Private Tours Greece,Athens,Greece,https://www.tripadvisor.com/Attraction_Review-g189400-d7119301-Reviews-Private_Tours_Greece-Athens_Attica.html
384,"Private Full Day Tour to Ancient Olympia with Lunch, Guide & Admission Options",Bus Tours,9–11 hours,$357.51,per adult,Free cancellation,By Warmpenguin,Athens,Greece,https://www.tripadvisor.com/Attraction_Review-g189400-d8776669-Reviews-Warmpenguin-Athens_Attica.html
385,,13,15,,,,,Athens,Greece,
386,,,,,,,Clear all filters,Athens,Greece,
387,Ancient Olympia Private Tour from Athens,Bus Tours,6+ hours,$307.16,per adult,Free cancellation,By Olive Sea Travel,Athens,Greece,https://www.tripadvisor.com/Attraction_Review-g189400-d12858625-Reviews-Olive_Sea_Travel-Athens_Attica.html
388,Small Group - Athens Highlights Semi-Private Tour,Full-day Tours,6+ hours,$107.48,per adult,Free cancellation,By Olive Sea Travel,Athens,Greece,https://www.tripadvisor.com/Attraction_Review-g189400-d12858625-Reviews-Olive_Sea_Travel-Athens_Attica.html
389,Athens International Airport Private Transfers,,30–45 minutes,$54.31,per group,Free cancellation,By Be my Guest Transfers and Tours,Athens,Greece,https://www.tripadvisor.com/Attraction_Review-g189400-d16897799-Reviews-Be_my_Guest_Transfers_and_Tours-Athens_Attica.html
390,Athens Private Tour,Luxury Car Tours,4–5 hours,$337.72,per group,Free cancellation,By Minibus Athens Tours,Athens,Greece,https://www.tripadvisor.com/Attraction_Review-g189400-d10162695-Reviews-Minibus_Athens_Tours-Athens_Attica.html
391,Mercedes Luxury Private Tour Apostle Paul & Ancient Corinth 6 Hours,Bus Tours,6 hours,$169.70,per adult,Free cancellation,By Greece Experience Tours,Athens,Greece,https://www.tripadvisor.com/Attraction_Review-g189400-d20263718-Reviews-Greece_Experience_Tours-Athens_Attica.html
392,Roundtrip Transfer from Athens Airport to Athens City,,45 minutes,$54.64,per adult,Free cancellation,By CityCab,Athens,Greece,https://www.tripadvisor.com/Attraction_Review-g189400-d10002022-Reviews-CityCab-Athens_Attica.html
393,Acropolis & Acropolis Museum (Small Group Morning Walking Tour),Walking Tours,3–4 hours,$61.33,per adult,Free cancellation,By Mister Plato,Athens,Greece,https://www.tripadvisor.com/Attraction_Review-g189400-d16696159-Reviews-Mister_Plato-Athens_Attica.html
394,Ancient Olympia and Corinth Canal Private Day Trip from Athens,Bus Tours,10–14 hours,$678.82,per group,Free cancellation,By CATTaxi,Athens,Greece,https://www.tripadvisor.com/Attraction_Review-g189400-d8378546-Reviews-CATTaxi-Athens_Attica.html
395,Amazing Full Day Tour to Zakynthos Island from Athens,Full-day Tours,6+ hours,$287.83,per adult,Free cancellation,By Travel agency Grand Greece,Athens,Greece,https://www.tripadvisor.com/Attraction_Review-g1429598-d21120141-Reviews-Travel_agency_Grand_Greece-Zakynthos_Town_Zakynthos_Ionian_Islands.html
396,Athens International Airport Private Transfer,,20–60 minutes,$53.17,per group,Free cancellation,By SAPPHIRE RENTAL,Athens,Greece,https://www.tripadvisor.com/Attraction_Review-g189400-d15711029-Reviews-SAPPHIRE_RENTAL-Athens_Attica.html
397,"Athens: On the prowl- Cats of Athens Plaka, Self-Guided audio tour on your Phone",Walking Tours,1 hour,$9.04,per adult,Free cancellation,By Clio Muse Tours,Athens,Greece,https://www.tripadvisor.com/Attraction_Review-g189400-d16856505-Reviews-Clio_Muse_Tours-Athens_Attica.html
398,"Private Day Trip to Corinth Canal, Sparta and Mystras",Full-day Tours,6+ hours,$256.39,per adult,Free cancellation,By Athens Limo Tours,Athens,Greece,https://www.tripadvisor.com/Attraction_Review-g189400-d3239740-Reviews-Athens_Limo_Tours-Athens_Attica.html
399,Private Transfer from Piraeus Port to Athens Airport,,50 minutes,$36.20,per adult,Free cancellation,By LS Tours,Athens,Greece,https://www.tripadvisor.com/Attraction_Review-g189400-d23642249-Reviews-LS_Tours-Athens_Attica.html
400,"Cape Sounio, Temple of Poseidon, Athenian Riviera Private Tour from Athens",Bus Tours,4–5 hours,$101.82,per adult,Free cancellation,By My Athens Transfers,Athens,Greece,https://www.tripadvisor.com/Attraction_Review-g189400-d9846275-Reviews-My_Athens_Transfers-Athens_Attica.html
401,Private Transfer: Athens to Eleftherios Venizelos International Airport (ATH),,40 minutes,$38.47,per group,Free cancellation,By Talixo - Athens,Athens,Greece,https://www.tripadvisor.com/Attraction_Review-g189400-d19732472-Reviews-Talixo_Athens-Athens_Attica.html
402,"Athens Airport Private Arrival Transfer: (Mini Van, 1-7 passengers)",,45 minutes,$99.56,per group,Free cancellation,By Key Transfers,Athens,Greece,https://www.tripadvisor.com/Attraction_Review-g562633-d20067405-Reviews-Key_Transfers-Voula_East_Attica_Region_Attica.html
403,Traditional Greek cooking class and dinner in Monastiraki for private groups,Cooking Classes,3 hours,$116.16,per adult,Free cancellation,By Eatwith Athens,Athens,Greece,https://www.tripadvisor.com/Attraction_Review-g189400-d19512841-Reviews-Eatwith_Athens-Athens_Attica.html
404,"Athens Riviera - Cape Sounio, Private Tour (gup 1 to 7 p)",Bus Tours,5 hours,$82.59,per adult,Free cancellation,By Onedaytours,Athens,Greece,https://www.tripadvisor.com/Attraction_Review-g189400-d19509604-Reviews-Onedaytours-Athens_Attica.html
405,Athens Shore Excursion: Private Athens Sightseeing and Acropolis Tour,Luxury Car Tours,4–5 hours,$75.53,per adult,Free cancellation,By Minibus Athens Tours,Athens,Greece,https://www.tripadvisor.com/Attraction_Review-g189400-d10162695-Reviews-Minibus_Athens_Tours-Athens_Attica.html
406,Corinth Half Day 5 Hours Private Tour.,Bus Tours,5 hours,$106.35,per adult,Free cancellation,By E&G Travel in Greece,Athens,Greece,https://www.tripadvisor.com/Attraction_Review-g189400-d20035005-Reviews-E_G_Travel_in_Greece-Athens_Attica.html
407,Meteora Leonidas ^ 300 Spartians battlefield visit the HomoSapien Cave 130.000BC,Bus Tours,6+ hours,$226.27,per adult,Free cancellation,By EASYEXPERIENCES,Athens,Greece,https://www.tripadvisor.com/Attraction_Review-g189400-d17836236-Reviews-EASYEXPERIENCES-Athens_Attica.html
408,"Athens Mythology Highlights Tour in 4 hrs: Acropolis, Acropolis Museum and more.",Bus Tours,5–6 hours,$106.91,per adult,Free cancellation,By Greece Athens Taxi GAT,Athens,Greece,https://www.tripadvisor.com/Attraction_Review-g189400-d16827695-Reviews-Greece_Athens_Taxi_GAT-Athens_Attica.html
409,Jewish tour and Athens sightseeing in 6 hours,Bus Tours,6 hours,$277.18,per group,Free cancellation,By Athens Tours Greece,Athens,Greece,https://www.tripadvisor.com/Attraction_Review-g189400-d2165694-Reviews-Athens_Tours_Greece-Athens_Attica.html
410,Athens hotels to Lavrio port private departure transfer,,1 hour,$39.03,per adult,Free cancellation,By My Athens Transfers,Athens,Greece,https://www.tripadvisor.com/Attraction_Review-g189400-d9846275-Reviews-My_Athens_Transfers-Athens_Attica.html
411,Private Transfer From Pireaus Port To Athens Airport,Ports of Call Tours,45–55 minutes,$73.09,per adult,Free cancellation,By Tours of Athens,Athens,Greece,https://www.tripadvisor.com/Attraction_Review-g189400-d5568141-Reviews-Tours_of_Athens-Athens_Attica.html
412,Traditional Greek cooking class and lunch with an Acropolis view,Cooking Classes,3 hours,$90.51,per adult,Free cancellation,By CookinAthens,Athens,Greece,https://www.tripadvisor.com/Attraction_Review-g189400-d17647613-Reviews-CookinAthens-Athens_Attica.html
413,Greek dinner on a luxury terrace rooftop with view of the Acropolis,,3 hours,$82.97,per adult,Free cancellation,By Eatwith Athens,Athens,Greece,https://www.tripadvisor.com/Attraction_Review-g189400-d19512841-Reviews-Eatwith_Athens-Athens_Attica.html
414,Electricityrides | e-bike rentals,Rentals,2–168 hours,$22.63,per adult,Free cancellation,By electricityrides,Athens,Greece,https://www.tripadvisor.com/Attraction_Review-g189400-d17540383-Reviews-Electricityrides-Athens_Attica.html
415,Athens Iconic Highlights Private Guided Tour With Car,Car Tours,2–6 hours,$130.11,per adult,Free cancellation,By Crispy Local,Athens,Greece,https://www.tripadvisor.com/Attraction_Review-g189400-d17314098-Reviews-Crispy_Local-Athens_Attica.html
416,"Cape Sounio, Poseidon Temple (5 hours). Day or Evening/ Sunset tour",,5 hours,$59.87,per adult,Free cancellation,By GREECE TAXI,Athens,Greece,https://www.tripadvisor.com/Attraction_Review-g189400-d16713235-Reviews-GREECE_TAXI-Athens_Attica.html
417,,14,16,,,,,Athens,Greece,
