,Tour Name,Tour Type,Tour Duration,Tour Price,Price Per,Cancellation,Tour By,City,Country,Link
0,,,,,,,Clear all filters,Las Vegas,USA,
1,Lower or X Antelope Canyon & Horseshoe Bend Small Group Tour - Las Vegas,Bus Tours,6+ hours,$299.99,per adult,Free cancellation,By Coexist West Coast,Las Vegas,USA,https://www.tripadvisor.com/Attraction_Review-g45963-d14032155-Reviews-Coexist_West_Coast-Las_Vegas_Nevada.html
2,Secret Food Tours Las Vegas w/ Private Tour Option,Walking Tours,3 hours,$138.03,per adult,,By Secret Food Tours Las Vegas,Las Vegas,USA,https://www.tripadvisor.com/Attraction_Review-g45963-d13945769-Reviews-Secret_Food_Tours_Las_Vegas-Las_Vegas_Nevada.html
3,Happy Hour on The High Roller at The LINQ,Skyscrapers & Towers,30 minutes,$65.25,per adult,,By High Roller,Las Vegas,USA,https://www.tripadvisor.com/Attraction_Review-g45963-d6509306-Reviews-High_Roller-Las_Vegas_Nevada.html
4,Mystère by Cirque du Soleil at Treasure Island Hotel & Casino,Cirque du Soleil,1–2 hours,$74.99,per adult,,By Mystère by Cirque du Soleil,Las Vegas,USA,https://www.tripadvisor.com/Attraction_Review-g45963-d143009-Reviews-Mystere_by_Cirque_du_Soleil-Las_Vegas_Nevada.html
5,Vegas Mini Baja Chase Dune Buggy Adventure,Adventure Tours,3–4 hours,$221.45,per adult,Free cancellation,By Sunbuggy Fun Rentals,Las Vegas,USA,https://www.tripadvisor.com/Attraction_Review-g45963-d14140925-Reviews-Sunbuggy_Fun_Rentals-Las_Vegas_Nevada.html
6,The High Roller at The LINQ Ticket,Skyscrapers & Towers,30 minutes,$28.12,per adult,,By High Roller,Las Vegas,USA,https://www.tripadvisor.com/Attraction_Review-g45963-d6509306-Reviews-High_Roller-Las_Vegas_Nevada.html
7,Grand Canyon West Rim Luxury Helicopter Tour,Bus Tours,3 hours,$399.00,per adult,Free cancellation,By 5 Star Grand Canyon Helicopter Tours,Las Vegas,USA,https://www.tripadvisor.com/Attraction_Review-g60881-d3160367-Reviews-5_Star_Grand_Canyon_Helicopter_Tours-Boulder_City_Nevada.html
8,Valley of Fire Hiking Tour from Las Vegas,Walking Tours,5 hours,$118.99,per adult,Free cancellation,By Love Hikes,Las Vegas,USA,https://www.tripadvisor.com/Attraction_Review-g45963-d5984367-Reviews-Love_Hikes-Las_Vegas_Nevada.html
9,Morning Maverick Horseback Ride with Breakfast from Las Vegas,,5 hours,$119.99,per adult,Free cancellation,By Wild West Horseback Adventures,Las Vegas,USA,https://www.tripadvisor.com/Attraction_Review-g45963-d2044045-Reviews-Wild_West_Horseback_Adventures-Las_Vegas_Nevada.html
10,Los Angeles and Hollywood Day Tour from Las Vegas,Bus Tours,6+ hours,$249.99,per adult,Free cancellation,By One Day Tours,Las Vegas,USA,https://www.tripadvisor.com/Attraction_Review-g45963-d1930007-Reviews-One_Day_Tours-Las_Vegas_Nevada.html
11,Las Vegas Dunes Tour by ATV,,2 hours,$130.00,per adult,Free cancellation,By Las Vegas ATVs,Las Vegas,USA,https://www.tripadvisor.com/Attraction_Review-g45963-d6998766-Reviews-Las_Vegas_ATVs-Las_Vegas_Nevada.html
12,Valley of Fire and Red Rock Canyon Day Tour from Las Vegas,Adventure Tours,6+ hours,$135.00,per adult,Free cancellation,By J.N.S. Just Never Stop LLC.,Las Vegas,USA,https://www.tripadvisor.com/Attraction_Review-g45963-d20283732-Reviews-J_N_S_Just_Never_Stop_LLC-Las_Vegas_Nevada.html
13,Downtown Vegas Sightseeing and Foodie Tour,Walking Tours,3 hours,$124.00,per adult,Free cancellation,By Taste Buzz Food Tours,Las Vegas,USA,https://www.tripadvisor.com/Attraction_Review-g45963-d11444817-Reviews-Taste_Buzz_Food_Tours-Las_Vegas_Nevada.html
14,Las Vegas Super Saver: Madame Tussauds with Gondola Boat Ride,Attractions & Museums,2 hours,$63.59,per adult,,By Madame Tussauds -  Las Vegas,Las Vegas,USA,https://www.tripadvisor.com/Attraction_Review-g45963-d106578-Reviews-Madame_Tussauds_Las_Vegas-Las_Vegas_Nevada.html
15,Las Vegas Horseback Ride with Meal,Adventure Tours,5 hours,$120.00,per adult,Free cancellation,By Wild West Horseback Adventures,Las Vegas,USA,https://www.tripadvisor.com/Attraction_Review-g45963-d2044045-Reviews-Wild_West_Horseback_Adventures-Las_Vegas_Nevada.html
16,Small Group Pahrump Wine Tasting with Death Valley Sightseeing and Stargazing,Full-day Tours,6+ hours,$269.00,per adult,Free cancellation,By iTravel USA,Las Vegas,USA,https://www.tripadvisor.com/Attraction_Review-g45963-d15612535-Reviews-ITravel_USA-Las_Vegas_Nevada.html
17,Grand Canyon Helicopter and Eagle Point Rim Landing Tour,Adventure Tours,4–5 hours,$532.00,per adult,Free cancellation,By 5 Star Grand Canyon Helicopter Tours,Las Vegas,USA,https://www.tripadvisor.com/Attraction_Review-g60881-d3160367-Reviews-5_Star_Grand_Canyon_Helicopter_Tours-Boulder_City_Nevada.html
18,Big Bus Las Vegas Hop-On Hop-Off Open Top Tour,Bus Tours,3 hours,$44.99,per adult,Free cancellation,By Big Bus Tours,Las Vegas,USA,https://www.tripadvisor.com/Attraction_Review-g45963-d1951312-Reviews-Big_Bus_Tours-Las_Vegas_Nevada.html
19,Hoover Dam Tour from Las Vegas,Adventure Tours,4–5 hours,$66.00,per adult,Free cancellation,By Gray Line Las Vegas,Las Vegas,USA,https://www.tripadvisor.com/Attraction_Review-g45963-d622824-Reviews-Gray_Line_Las_Vegas-Las_Vegas_Nevada.html
20,Las Vegas Hot Air Balloon Ride,Adventure Tours,5–6 hours,$299.00,per adult,Free cancellation,By Vegas Balloon Rides,Las Vegas,USA,https://www.tripadvisor.com/Attraction_Review-g45963-d2358555-Reviews-Vegas_Balloon_Rides-Las_Vegas_Nevada.html
21,The Beatles™ LOVE™ by Cirque du Soleil® at the Mirage Hotel and Casino,Cirque du Soleil,1–2 hours,$79.86,per adult,,By The Beatles - Love - Cirque du Soleil,Las Vegas,USA,https://www.tripadvisor.com/Attraction_Review-g45963-d615091-Reviews-The_Beatles_Love_Cirque_du_Soleil-Las_Vegas_Nevada.html
22,Michael Jackson ONE by Cirque du Soleil® at Mandalay Bay Resort and Casino,Cirque du Soleil,1–2 hours,$95.69,per adult,,By Michael Jackson ONE by Cirque du Soleil,Las Vegas,USA,https://www.tripadvisor.com/Attraction_Review-g45963-d4173939-Reviews-Michael_Jackson_ONE_by_Cirque_du_Soleil-Las_Vegas_Nevada.html
23,The Mentalist at Planet Hollywood Hotel and Casino,Comedy Shows,1 hour,$36.44,per adult,,By The Mentalist,Las Vegas,USA,https://www.tripadvisor.com/Attraction_Review-g45963-d1763967-Reviews-The_Mentalist-Las_Vegas_Nevada.html
24,Bryce Canyon and Zion National Park Day Tour from Las Vegas,Bus Tours,6+ hours,$109.00,per adult,Free cancellation,By National Park Express,Las Vegas,USA,https://www.tripadvisor.com/Attraction_Review-g45963-d15673500-Reviews-National_Park_Express-Las_Vegas_Nevada.html
25,1 Day Death Valley Small Group Guide Tour with Evening Sunset and Stars Viewing,Bus Tours,6+ hours,$299.00,per adult,Free cancellation,By Grand Canyon Auto Camping Tour,Las Vegas,USA,https://www.tripadvisor.com/Attraction_Review-g45963-d17790608-Reviews-Grand_Canyon_Auto_Camping_Tour-Las_Vegas_Nevada.html
26,Scooter Tours of Red Rock Canyon,Adventure Tours,4 hours,$149.00,per adult,Free cancellation,By Red Rock Scooter Tours,Las Vegas,USA,https://www.tripadvisor.com/Attraction_Review-g45963-d7738545-Reviews-Red_Rock_Scooter_Tours-Las_Vegas_Nevada.html
27,Grand Canyon West Bus Tour With Lake Mead Photo Stop and Optional Skywalk Ticket,Bus Tours,10–11 hours,$84.00,per adult,Free cancellation,By Grand Canyon Destinations,Las Vegas,USA,https://www.tripadvisor.com/Attraction_Review-g45963-d8517251-Reviews-Grand_Canyon_Destinations-Las_Vegas_Nevada.html
28,"Fly LINQ Zipline at The LINQ, Las Vegas",,30 minutes,$37.13,per adult,LIKELY TO SELL OUT*,By Fly LINQ Zipline Las Vegas,Las Vegas,USA,https://www.tripadvisor.com/Attraction_Review-g45963-d15352191-Reviews-Fly_LINQ_Zipline_Las_Vegas-Las_Vegas_Nevada.html
29,Two-Hour Exotic Car Driving Experience Package in Las Vegas,,2 hours,$199.00,per adult,Free cancellation,By Exotics Racing,Las Vegas,USA,https://www.tripadvisor.com/Attraction_Review-g45963-d1628624-Reviews-Exotics_Racing-Las_Vegas_Nevada.html
30,Nathan Burton Magic Show at V Theater,Comedy Shows,1–2 hours,$20.99,per adult,,By Nathan Burton Comedy Magic,Las Vegas,USA,https://www.tripadvisor.com/Attraction_Review-g45963-d1729080-Reviews-Nathan_Burton_Comedy_Magic-Las_Vegas_Nevada.html
31,,2,3,,,,,Las Vegas,USA,
32,,,,,,,Clear all filters,Las Vegas,USA,
33,"Grand Canyon National Park, Hoover Dam and Route 66 Small Group from Las Vegas",Bus Tours,6+ hours,$199.99,per adult,Free cancellation,By Coexist West Coast,Las Vegas,USA,https://www.tripadvisor.com/Attraction_Review-g45963-d14032155-Reviews-Coexist_West_Coast-Las_Vegas_Nevada.html
34,"Tournament of Kings Dinner and Show at the Excalibur Hotel and Casino, Las Vegas",Theaters,1–2 hours,$88.93,per adult,,By Tournament of Kings,Las Vegas,USA,https://www.tripadvisor.com/Attraction_Review-g45963-d209825-Reviews-Tournament_of_Kings-Las_Vegas_Nevada.html
35,2 Hour Las Vegas Desert Off Road Adventure,Adventure Tours,2–3 hours,$175.00,per adult,,By Desert Off Road Adventures,Las Vegas,USA,https://www.tripadvisor.com/Attraction_Review-g45963-d10136673-Reviews-Desert_Off_Road_Adventures-Las_Vegas_Nevada.html
36,Las Vegas Strip Sightseeing and Foodie Tour,Walking Tours,3 hours,$124.00,per adult,Free cancellation,By Taste Buzz Food Tours,Las Vegas,USA,https://www.tripadvisor.com/Attraction_Review-g45963-d11444817-Reviews-Taste_Buzz_Food_Tours-Las_Vegas_Nevada.html
37,Hoover Dam Comedy Tour with Lunch,Bus Tours,6–7 hours,$99.00,per adult,Free cancellation,By Comedy on Deck Tours,Las Vegas,USA,https://www.tripadvisor.com/Attraction_Review-g45963-d2022095-Reviews-Comedy_on_Deck_Tours-Las_Vegas_Nevada.html
38,Self-Guided Red Rock Canyon Tour on a CanAm Ryker: 2HR Experience!,Adventure Tours,2 hours,$185.00,per adult,Free cancellation,By Limitless Motoring,Las Vegas,USA,https://www.tripadvisor.com/Attraction_Review-g45963-d21378577-Reviews-Limitless_Motoring-Las_Vegas_Nevada.html
39,Small Group Hoover Dam Tour by Luxury Tour Trekker,Adventure Tours,3 hours,$117.69,per adult,Free cancellation,By Pink Jeep Tours Las Vegas,Las Vegas,USA,https://www.tripadvisor.com/Attraction_Review-g45963-d581526-Reviews-Pink_Jeep_Tours_Las_Vegas-Las_Vegas_Nevada.html
40,Half Day Kayak Tour in the Black Canyon - Self Drive,Adventure Tours,3 hours,$99.00,per adult,Free cancellation,By Blazin' Paddles,Las Vegas,USA,https://www.tripadvisor.com/Attraction_Review-g45963-d10465359-Reviews-Blazin_Paddles-Las_Vegas_Nevada.html
41,Valley of Fire Tour,Bus Tours,6 hours,$119.00,per adult,,By West Pearl Tours,Las Vegas,USA,https://www.tripadvisor.com/Attraction_Review-g45963-d16845148-Reviews-West_Pearl_Tours-Las_Vegas_Nevada.html
42,ATV Tour in Las Vegas with Hotel Pickup,Adventure Tours,3 hours,$145.19,per adult,Free cancellation,By Sunbuggy Fun Rentals,Las Vegas,USA,https://www.tripadvisor.com/Attraction_Review-g45963-d14140925-Reviews-Sunbuggy_Fun_Rentals-Las_Vegas_Nevada.html
43,Area 51 Day Tour from Las Vegas,Day Trips,6+ hours,$204.97,per adult,Free cancellation,By Adventure Photo Tours,Las Vegas,USA,https://www.tripadvisor.com/Attraction_Review-g45963-d552952-Reviews-Adventure_Photo_Tours-Las_Vegas_Nevada.html
44,2-Hour Horseback Riding through Red Rock Canyon,,5 hours,$139.00,per adult,Free cancellation,"By Cowboy Trail Rides, Inc.",Las Vegas,USA,https://www.tripadvisor.com/Attraction_Review-g45963-d552993-Reviews-Cowboy_Trail_Rides_Inc-Las_Vegas_Nevada.html
45,Shin Lim: Limitless at the Mirage Las Vegas,Theaters,1–2 hours,$76.29,per adult,,By Shin Lim: LIMITLESS,Las Vegas,USA,https://www.tripadvisor.com/Attraction_Review-g45963-d19386234-Reviews-Shin_Lim_LIMITLESS-Las_Vegas_Nevada.html
46,Elvis Themed Wedding or Vow Renewal at Graceland Chapel,,1 hour,$184.99,per adult,Free cancellation,By Graceland Wedding Chapel,Las Vegas,USA,https://www.tripadvisor.com/Attraction_Review-g45963-d8677074-Reviews-Graceland_Wedding_Chapel-Las_Vegas_Nevada.html
47,Emerald Cave Kayak Tour with Optional Las Vegas Pickup,,6 hours,$99.00,per adult,Free cancellation,By Las Vegas SUP Kayak Club,Las Vegas,USA,https://www.tripadvisor.com/Attraction_Review-g45963-d10807691-Reviews-Las_Vegas_SUP_Kayak_Club-Las_Vegas_Nevada.html
48,Grand Canyon Helicopter Tour from Las Vegas with VIP Skywalk and Pontoon Boat Ride,Adventure Tours,6+ hours,$739.00,per adult,Free cancellation,By Papillon Grand Canyon Helicopters,Las Vegas,USA,https://www.tripadvisor.com/Attraction_Review-g60881-d553004-Reviews-Papillon_Grand_Canyon_Helicopters-Boulder_City_Nevada.html
49,Red Rock Canyon Self-Guided Electric Bike Tour,Adventure Tours,4 hours,$109.00,per adult,Free cancellation,By EzRideLV Electric Bike Tours,Las Vegas,USA,https://www.tripadvisor.com/Attraction_Review-g45963-d12484560-Reviews-EzRideLV_Electric_Bike_Tours-Las_Vegas_Nevada.html
50,David Copperfield at the MGM Grand Hotel and Casino,Theaters,1–2 hours,$99.88,per adult,,By David Copperfield,Las Vegas,USA,https://www.tripadvisor.com/Attraction_Review-g45963-d1630313-Reviews-David_Copperfield-Las_Vegas_Nevada.html
51,3 Hour Hoover Dam Mini Tour and Seven Magic Mountains Small Group Combo Tour,Bus Tours,4 hours,$89.99,per adult,Free cancellation,By Mr. Las Vegas Tours,Las Vegas,USA,https://www.tripadvisor.com/Attraction_Review-g45963-d13189776-Reviews-Mr_Las_Vegas_Tours-Las_Vegas_Nevada.html
52,"Red Rock Canyon, 7 Magic Mountains, Boulder City and Hoover Dam Tour",Adventure Tours,6–7 hours,$144.00,per adult,Free cancellation,By MARVIT TOURS LLC,Las Vegas,USA,https://www.tripadvisor.com/Attraction_Review-g45963-d17352213-Reviews-MARVIT_TOURS_LLC-Las_Vegas_Nevada.html
53,Antelope Canyon & Horseshoe Bend Tour from Las Vegas,Bus Tours,6+ hours,$189.00,per adult,,,Las Vegas,USA,
54,Machine Gun Experience in Las Vegas,,1 hour,$134.99,per adult,Free cancellation,By Battlefield Vegas,Las Vegas,USA,https://www.tripadvisor.com/Attraction_Review-g45963-d3417767-Reviews-Battlefield_Vegas-Las_Vegas_Nevada.html
55,Best Bites on The Las Vegas Strip: A Beginner's Guide to Sin City,Walking Tours,2–3 hours,$69.00,per adult,Free cancellation,By Best Bet Vegas Tours,Las Vegas,USA,https://www.tripadvisor.com/Attraction_Review-g45963-d23642817-Reviews-Best_Bet_Vegas_Tours-Las_Vegas_Nevada.html
56,Marriage Can Be Murder - A LIVE Murder Mystery Dinner Show at The Orleans,Theaters,2 hours,$103.47,per adult,Free cancellation,By Marriage Can Be Murder,Las Vegas,USA,https://www.tripadvisor.com/Attraction_Review-g45963-d651376-Reviews-Marriage_Can_Be_Murder-Las_Vegas_Nevada.html
57,Off Road and Shoot Adrenaline Mountain,,4–5 hours,$360.00,per adult,Free cancellation,By Adrenaline Mountain,Las Vegas,USA,https://www.tripadvisor.com/Attraction_Review-g45963-d7697784-Reviews-Adrenaline_Mountain-Las_Vegas_Nevada.html
58,Las Vegas Strip Highlights Helicopter Tour,Adventure Tours,90–120 minutes,$89.00,per adult,Free cancellation,By Grand Canyon Helicopters - Las Vegas,Las Vegas,USA,https://www.tripadvisor.com/Attraction_Review-g45963-d6161453-Reviews-Grand_Canyon_Helicopters_Las_Vegas-Las_Vegas_Nevada.html
59,Las Vegas Red Rock Canyon Helicopter Tour,Adventure Tours,30 minutes,$189.00,per adult,Free cancellation,By 5 Star Las Vegas Helicopter Tours,Las Vegas,USA,https://www.tripadvisor.com/Attraction_Review-g45963-d7835594-Reviews-5_Star_Las_Vegas_Helicopter_Tours-Las_Vegas_Nevada.html
60,Ace of Adventure: Aerial Tour of the Grand Canyon's West Rim by Helicopter,Adventure Tours,180–210 minutes,$439.00,per adult,Free cancellation,By Grand Canyon Helicopters - Las Vegas,Las Vegas,USA,https://www.tripadvisor.com/Attraction_Review-g45963-d6161453-Reviews-Grand_Canyon_Helicopters_Las_Vegas-Las_Vegas_Nevada.html
61,"3-Day National Parks Tour: Zion, Bryce Canyon, Monument Valley and Grand Canyon",Bus Tours,3 days,$495.00,per adult,Free cancellation,By Bindlestiff Tours,Las Vegas,USA,https://www.tripadvisor.com/Attraction_Review-g45963-d2481056-Reviews-Bindlestiff_Tours-Las_Vegas_Nevada.html
62,Red Rock Canyon and Seven Magic Mountains Tour with Ghost Town option,Bus Tours,5 hours,$109.00,per adult,,By West Pearl Tours,Las Vegas,USA,https://www.tripadvisor.com/Attraction_Review-g45963-d16845148-Reviews-West_Pearl_Tours-Las_Vegas_Nevada.html
63,,3,2,,,4,,Las Vegas,USA,
64,,,,,,,Clear all filters,Las Vegas,USA,
65,Grand Canyon South Rim Small Group Tour,Adventure Tours,6+ hours,$165.00,per adult,Free cancellation,By Grand Canyon Destinations,Las Vegas,USA,https://www.tripadvisor.com/Attraction_Review-g45963-d8517251-Reviews-Grand_Canyon_Destinations-Las_Vegas_Nevada.html
66,Magic Mike Live Las Vegas at SAHARA Las Vegas,Theaters,1–2 hours,$63.36,per adult,Free cancellation,By Magic Mike Live Las Vegas at SAHARA Las Vegas,Las Vegas,USA,https://www.tripadvisor.com/Attraction_Review-g45963-d12400029-Reviews-Magic_Mike_Live_Las_Vegas_at_SAHARA_Las_Vegas-Las_Vegas_Nevada.html
67,Shark Reef at Mandalay Bay Hotel and Casino,Aquariums,1–2 hours,$20.52,per adult,LIKELY TO SELL OUT*,By Shark Reef Aquarium,Las Vegas,USA,https://www.tripadvisor.com/Attraction_Review-g45963-d3516016-Reviews-Shark_Reef_Aquarium-Las_Vegas_Nevada.html
68,Grand Canyon: 4-in-1 Grand Circle Two-Day Tour from Las Vegas,Bus Tours,2 days,$528.00,per adult,Free cancellation,By Fun Group Las Vegas,Las Vegas,USA,https://www.tripadvisor.com/Attraction_Review-g45963-d19886796-Reviews-Fun_Group_Las_Vegas-Las_Vegas_Nevada.html
69,Exotic Car Driving Experiences at Las Vegas Motor Speedway,,2 hours,$216.00,per adult,Free cancellation,By Dream Racing,Las Vegas,USA,https://www.tripadvisor.com/Attraction_Review-g45963-d2510911-Reviews-Dream_Racing-Las_Vegas_Nevada.html
70,Red Rock Canyon with Rocky Gap 4x4 Jeep Adventure,Adventure Tours,3 hours,$147.80,per adult,Free cancellation,By Pink Jeep Tours Las Vegas,Las Vegas,USA,https://www.tripadvisor.com/Attraction_Review-g45963-d581526-Reviews-Pink_Jeep_Tours_Las_Vegas-Las_Vegas_Nevada.html
71,Blue Man Group at the Luxor Hotel and Casino,Theaters,1–2 hours,$66.63,per adult,,By Blue Man Group,Las Vegas,USA,https://www.tripadvisor.com/Attraction_Review-g45963-d183421-Reviews-Blue_Man_Group-Las_Vegas_Nevada.html
72,ATV Tours in Las Vegas,,3 hours,$175.00,per adult,Free cancellation,By Vegas ATV Adventures,Las Vegas,USA,https://www.tripadvisor.com/Attraction_Review-g45963-d6023894-Reviews-Vegas_ATV_Adventures-Las_Vegas_Nevada.html
73,Mount Charleston and Lee Canyon,Bus Tours,5 hours,$119.00,per adult,,By West Pearl Tours,Las Vegas,USA,https://www.tripadvisor.com/Attraction_Review-g45963-d16845148-Reviews-West_Pearl_Tours-Las_Vegas_Nevada.html
74,4 Gun Vegas Desert Shooting Adventure with Lunch from Las Vegas,Adventure Tours,3 hours,$199.00,per adult,Free cancellation,By 2Vegas.com,Las Vegas,USA,https://www.tripadvisor.com/Attraction_Review-g45963-d16781531-Reviews-2Vegas_com-Las_Vegas_Nevada.html
75,Bryce Canyon and Zion National Parks Small-Group Tour from Las Vegas,Adventure Tours,6+ hours,$277.07,per adult,Free cancellation,By Adventure Photo Tours,Las Vegas,USA,https://www.tripadvisor.com/Attraction_Review-g45963-d552952-Reviews-Adventure_Photo_Tours-Las_Vegas_Nevada.html
76,Small Group Red Rock Canyon Sunset Tour Optional 7 Magic Mountains,Bus Tours,4–7 hours,$110.00,per adult,Free cancellation,By iTravel USA,Las Vegas,USA,https://www.tripadvisor.com/Attraction_Review-g45963-d15612535-Reviews-ITravel_USA-Las_Vegas_Nevada.html
77,Grand Canyon West plus Hoover Dam VIP Day Tour from Las Vegas,Bus Tours,6+ hours,$307.97,per adult,Free cancellation,By Adventure Photo Tours,Las Vegas,USA,https://www.tripadvisor.com/Attraction_Review-g45963-d552952-Reviews-Adventure_Photo_Tours-Las_Vegas_Nevada.html
78,Valley of Fire Helicopter Tour with Champagne Floor Landing,Adventure Tours,1–2 hours,$299.00,per adult,Free cancellation,By 5 Star Las Vegas Helicopter Tours,Las Vegas,USA,https://www.tripadvisor.com/Attraction_Review-g45963-d7835594-Reviews-5_Star_Las_Vegas_Helicopter_Tours-Las_Vegas_Nevada.html
79,Zombie Burlesque at Planet Hollywood Resort and Casino,Comedy Shows,1–2 hours,$79.99,per adult,,By Zombie Burlesque,Las Vegas,USA,https://www.tripadvisor.com/Attraction_Review-g45963-d5783601-Reviews-Zombie_Burlesque-Las_Vegas_Nevada.html
80,Zion and Bryce Canyon National Parks Small group tours from Las Vegas,Adventure Tours,12–14 hours,$219.00,per adult,Free cancellation,By MARVIT TOURS LLC,Las Vegas,USA,https://www.tripadvisor.com/Attraction_Review-g45963-d17352213-Reviews-MARVIT_TOURS_LLC-Las_Vegas_Nevada.html
81,MJ Live at the Tropicana Hotel and Casino,Shows,1 hour,$55.08,per adult,Free cancellation,By MJ Live,Las Vegas,USA,https://www.tripadvisor.com/Attraction_Review-g45963-d3870907-Reviews-MJ_Live-Las_Vegas_Nevada.html
82,Red Rock Canyon Electric Bike Half-Day Tour,Adventure Tours,4–5 hours,$128.39,per adult,Free cancellation,By Red E Bike Tours,Las Vegas,USA,https://www.tripadvisor.com/Attraction_Review-g45963-d5321461-Reviews-Red_E_Bike_Tours-Las_Vegas_Nevada.html
83,"Axes, Arrows, & Bullets Package",,3 hours,$234.00,per adult,Free cancellation,By Adrenaline Mountain,Las Vegas,USA,https://www.tripadvisor.com/Attraction_Review-g45963-d7697784-Reviews-Adrenaline_Mountain-Las_Vegas_Nevada.html
84,Valley of Fire and Red Rock Canyon from Las Vegas,Full-day Tours,6+ hours,$179.00,per adult,Free cancellation,By Coexist West Coast,Las Vegas,USA,https://www.tripadvisor.com/Attraction_Review-g45963-d14032155-Reviews-Coexist_West_Coast-Las_Vegas_Nevada.html
85,Las Vegas City Lights Night Tour by Jeep,Adventure Tours,3 hours,$115.90,per adult,Free cancellation,By Pink Jeep Tours Las Vegas,Las Vegas,USA,https://www.tripadvisor.com/Attraction_Review-g45963-d581526-Reviews-Pink_Jeep_Tours_Las_Vegas-Las_Vegas_Nevada.html
86,Wild West Sunset Horseback Ride with Dinner from Las Vegas,,5 hours,$159.99,per adult,Free cancellation,By Wild West Horseback Adventures,Las Vegas,USA,https://www.tripadvisor.com/Attraction_Review-g45963-d2044045-Reviews-Wild_West_Horseback_Adventures-Las_Vegas_Nevada.html
87,Small-Group Hollywood and Los Angeles Day Tour from Las Vegas,Bus Tours,6+ hours,$246.17,per adult,Free cancellation,By Adventure Photo Tours,Las Vegas,USA,https://www.tripadvisor.com/Attraction_Review-g45963-d552952-Reviews-Adventure_Photo_Tours-Las_Vegas_Nevada.html
88,Grand Circle 3-Day tour from Las Vegas,Bus Tours,3 days,$967.00,per adult,Free cancellation,By Fun Group Las Vegas,Las Vegas,USA,https://www.tripadvisor.com/Attraction_Review-g45963-d19886796-Reviews-Fun_Group_Las_Vegas-Las_Vegas_Nevada.html
89,Red Rock Canyon Hiking Tour,,4 hours,$129.99,per adult,Free cancellation,By Escape Adventures,Las Vegas,USA,https://www.tripadvisor.com/Attraction_Review-g45963-d4324387-Reviews-Escape_Adventures-Las_Vegas_Nevada.html
90,ULTIMATE Small Group Skywalk & Hoover Dam Tour,Full-day Tours,6+ hours,$210.00,per adult,Free cancellation,By Grand Adventures Tours,Las Vegas,USA,https://www.tripadvisor.com/Attraction_Review-g45963-d663940-Reviews-Grand_Adventures_Tours-Las_Vegas_Nevada.html
91,Death Valley Day Trip from Las Vegas,Bus Tours,6+ hours,$256.47,per adult,Free cancellation,By Adventure Photo Tours,Las Vegas,USA,https://www.tripadvisor.com/Attraction_Review-g45963-d552952-Reviews-Adventure_Photo_Tours-Las_Vegas_Nevada.html
92,Grand Canyon South Rim From Las Vegas,Full-day Tours,6+ hours,$95.00,per adult,Free cancellation,"By SWEETours, Inc.",Las Vegas,USA,https://www.tripadvisor.com/Attraction_Review-g45963-d1102793-Reviews-SWEETours_Inc-Las_Vegas_Nevada.html
93,Madame Tussauds Las Vegas Admission Ticket,Attractions & Museums,1 hour,$37.94,per adult,,By Madame Tussauds -  Las Vegas,Las Vegas,USA,https://www.tripadvisor.com/Attraction_Review-g45963-d106578-Reviews-Madame_Tussauds_Las_Vegas-Las_Vegas_Nevada.html
94,Grand Canyon and Antelope Canyon Small Group Overnight Tour,Bus Tours,2 days,$349.00,per adult,Free cancellation,By MaxTour,Las Vegas,USA,https://www.tripadvisor.com/Attraction_Review-g45963-d12334620-Reviews-MaxTour-Las_Vegas_Nevada.html
95,,4,3,,,5,,Las Vegas,USA,
96,,,,,,,Clear all filters,Las Vegas,USA,
97,Piff the Magic Dragon at the Flamingo Las Vegas,Shows,1–2 hours,$77.99,per adult,,By Piff the Magic Dragon,Las Vegas,USA,https://www.tripadvisor.com/Attraction_Review-g45963-d10209310-Reviews-Piff_the_Magic_Dragon-Las_Vegas_Nevada.html
98,Exotic Supercar Driving Experiences On A Real Racetrack in Las Vegas,,2 hours,$199.00,per adult,Free cancellation,By Speedvegas,Las Vegas,USA,https://www.tripadvisor.com/Attraction_Review-g45963-d10187865-Reviews-Speedvegas-Las_Vegas_Nevada.html
99,"Purple Reign, The Prince Tribute Show at the Tropicana Hotel Las Vegas",Theaters,1–2 hours,$55.29,per adult,Free cancellation,"By Purple Reign, THE Prince Tribute Show!",Las Vegas,USA,https://www.tripadvisor.com/Attraction_Review-g45963-d2322672-Reviews-Purple_Reign_THE_Prince_Tribute_Show-Las_Vegas_Nevada.html
100,"Grand Canyon, Hoover Dam and Route 66 Tour From Las Vegas",Full-day Tours,6+ hours,$195.00,per adult,Free cancellation,By Top Canyon Tours,Las Vegas,USA,https://www.tripadvisor.com/Attraction_Review-g45963-d18952580-Reviews-Top_Canyon_Tours-Las_Vegas_Nevada.html
101,2-Hour Guided Segway Tour of Downtown Las Vegas,Segway Tours,2 hours,$134.03,per adult,Free cancellation,By Segway Las Vegas,Las Vegas,USA,https://www.tripadvisor.com/Attraction_Review-g45963-d6368299-Reviews-Segway_Las_Vegas-Las_Vegas_Nevada.html
102,Fantasy at the Luxor Hotel and Casino,Theaters,1–2 hours,$58.54,per adult,,By Fantasy,Las Vegas,USA,https://www.tripadvisor.com/Attraction_Review-g45963-d2294396-Reviews-Fantasy-Las_Vegas_Nevada.html
103,Small-Group Guided Colorado River Half-Day Kayak Tour,Adventure Tours,4 hours,$98.00,per adult,,By Veteran Kayaks,Las Vegas,USA,https://www.tripadvisor.com/Attraction_Review-g45963-d23187439-Reviews-Veteran_Kayaks-Las_Vegas_Nevada.html
104,"Valley of Fire ATV, UTV, or Dune Buggy Adventure",Adventure Tours,6+ hours,$443.45,per adult,Free cancellation,By Sunbuggy Fun Rentals,Las Vegas,USA,https://www.tripadvisor.com/Attraction_Review-g45963-d14140925-Reviews-Sunbuggy_Fun_Rentals-Las_Vegas_Nevada.html
