,Tour Name,Tour Type,Tour Duration,Tour Price,Price Per,Cancellation,Tour By,City,Country,Link
313,Las Vegas Private Airport Roundtrip Transfer,,20 minutes,$141.00,per group,Free cancellation,By Bell Transportation Private Tours,Las Vegas,USA,https://www.tripadvisor.com/Attraction_Review-g45963-d2146319-Reviews-Bell_Transportation_Private_Tours-Las_Vegas_Nevada.html
314,Private Airport Transfer: from Las Vegas to McCarran International Airport (LAS),,20 minutes,$31.50,per adult,Free cancellation,By Taxi2Airport Las Vegas,Las Vegas,USA,https://www.tripadvisor.com/Attraction_Review-g45963-d20060083-Reviews-Taxi2Airport_Las_Vegas-Las_Vegas_Nevada.html
315,Tesla Model S Las Vegas Strip Tour,Luxury Car Tours,1 hour,$47.00,per adult,Free cancellation,By Lance McGowan,Las Vegas,USA,https://www.tripadvisor.com/Attraction_Review-g45963-d19922605-Reviews-Lance_McGowan-Las_Vegas_Nevada.html
316,Las Vegas Strip Club Crawl with Party Bus Experience & unlimited liquor,Bus Tours,4 hours,$50.00,per adult,Free cancellation,By Supreme Club Tours,Las Vegas,USA,https://www.tripadvisor.com/Attraction_Review-g45963-d8655595-Reviews-Supreme_Club_Tours-Las_Vegas_Nevada.html
317,Thin Blue Line Shooting Range Package,,30 minutes,$130.00,per adult,Free cancellation,By American Shooters,Las Vegas,USA,https://www.tripadvisor.com/Attraction_Review-g45963-d2255833-Reviews-American_Shooters-Las_Vegas_Nevada.html
318,Hard Rock Cafe Las Vegas,,2 hours,$32.99,per adult,Free cancellation,By Hard Rock Cafe,Las Vegas,USA,https://www.tripadvisor.com/Restaurant_Review-g45963-d1724529-Reviews-Hard_Rock_Cafe-Las_Vegas_Nevada.html
319,,11,10,,,12,,Las Vegas,USA,
320,,,,,,,Clear all filters,Las Vegas,USA,
321,Vegas Night Out: Fly and Dine with Dinner at Mott 32 at Palazzo Hotel and Casino,Adventure Tours,210–240 minutes,$269.00,per adult,Free cancellation,By Grand Canyon Helicopters - Las Vegas,Las Vegas,USA,https://www.tripadvisor.com/Attraction_Review-g45963-d6161453-Reviews-Grand_Canyon_Helicopters_Las_Vegas-Las_Vegas_Nevada.html
322,Downtown Las Vegas Nighttime Walking Tour,City Tours,2 hours,$36.37,per adult,Free cancellation,By Las Vegas Walking Tours,Las Vegas,USA,https://www.tripadvisor.com/Attraction_Review-g45963-d6781630-Reviews-Las_Vegas_Walking_Tours-Las_Vegas_Nevada.html
323,The Big Apple Coaster at New York New York Hotel and Casino,Attractions & Museums,30 minutes,$19.49,per adult,,By The Big Apple Coaster & Arcade,Las Vegas,USA,https://www.tripadvisor.com/Attraction_Review-g45963-d776701-Reviews-The_Big_Apple_Coaster_Arcade-Las_Vegas_Nevada.html
324,Quickie Las Vegas Wedding at Paradise Wedding Chapel,,15 minutes,$65.00,per group,Free cancellation,By Paradise Wedding Chapel,Las Vegas,USA,https://www.tripadvisor.com/Attraction_Review-g45963-d15074004-Reviews-Paradise_Wedding_Chapel-Las_Vegas_Nevada.html
325,Grand Canyon South Rim Bus Tour with Optional Upgrades,Bus Tours,6+ hours,$107.00,per adult,Free cancellation,By Gray Line Las Vegas,Las Vegas,USA,https://www.tripadvisor.com/Attraction_Review-g45963-d622824-Reviews-Gray_Line_Las_Vegas-Las_Vegas_Nevada.html
326,Boulder City Historic District from Las Vegas,Bus Tours,5 hours,$25.00,per adult,Free cancellation,By National Park Express,Las Vegas,USA,https://www.tripadvisor.com/Attraction_Review-g45963-d15673500-Reviews-National_Park_Express-Las_Vegas_Nevada.html
327,Skip the Line: Las Vegas Ghost Tours - Vegas Ghost & UFO Show Ticket,Theaters,1 hour,$24.95,per adult,,By Creepy Vegas: Las Vegas Ghost & UFO Show!,Las Vegas,USA,https://www.tripadvisor.com/Attraction_Review-g45963-d16929207-Reviews-Creepy_Vegas_Las_Vegas_Ghost_UFO_Show-Las_Vegas_Nevada.html
328,Las Vegas McCarran Airport (LAS) Private Arrival Transfer,,25–45 minutes,$35.00,per adult,Free cancellation,By Elife Limo,Las Vegas,USA,https://www.tripadvisor.com/Attraction_Review-g45963-d23181056-Reviews-Elife_Limo-Las_Vegas_Nevada.html
329,Party Bus Nightclub Crawl,Bus Tours,5–6 hours,$35.00,per adult,Free cancellation,By Club Crawl Co,Las Vegas,USA,https://www.tripadvisor.com/Attraction_Review-g45963-d18338592-Reviews-Club_Crawl_Co-Las_Vegas_Nevada.html
330,Carrot Top at the Luxor Hotel and Casino,Comedy Shows,1–2 hours,$62.95,per adult,,By Carrot Top,Las Vegas,USA,https://www.tripadvisor.com/Attraction_Review-g45963-d662769-Reviews-Carrot_Top-Las_Vegas_Nevada.html
331,Lockdown Underworld Escape Room in Las Vegas,,1 hour,$35.00,per adult,Free cancellation,By Lockdown - Las Vegas Flamingo,Las Vegas,USA,https://www.tripadvisor.com/Attraction_Review-g45963-d12681846-Reviews-Lockdown_Las_Vegas_Flamingo-Las_Vegas_Nevada.html
332,Las Vegas Scavenger Hunt: The True Gems of Vegas,Self-guided Tours & Rentals,2 hours,$12.31,per adult,,By Let's Roam Las Vegas,Las Vegas,USA,https://www.tripadvisor.com/Attraction_Review-g45963-d21215389-Reviews-Let_s_Roam_Las_Vegas-Las_Vegas_Nevada.html
333,Horseback Riding Tour with BBQ Lunch in Vegas,SPECIAL OFFER,1–2 hours,$112.00,per adult,,By Silver State Horseback Riding Tours,Las Vegas,USA,https://www.tripadvisor.com/Attraction_Review-g45963-d17568743-Reviews-Silver_State_Horseback_Riding_Tours-Las_Vegas_Nevada.html
334,The Cabin Escape room experience in Las Vegas,,1 hour,$41.03,per adult,,By Number One Escape Room,Las Vegas,USA,https://www.tripadvisor.com/Attraction_Review-g45963-d13008359-Reviews-Number_One_Escape_Room-Las_Vegas_Nevada.html
335,Admission to the Erotic Heritage Museum Las Vegas,Attractions & Museums,1 hour,$19.00,per adult,Free cancellation,"By Erotic Heritage Museum, Las Vegas",Las Vegas,USA,https://www.tripadvisor.com/Attraction_Review-g45963-d2490205-Reviews-Erotic_Heritage_Museum_Las_Vegas-Las_Vegas_Nevada.html
336,Mac King Comedy Magic Show at the Excalibur Hotel and Casino,Comedy Shows,1–2 hours,$62.57,per adult,,By Mac King Comedy Magic Show,Las Vegas,USA,https://www.tripadvisor.com/Attraction_Review-g45963-d553339-Reviews-Mac_King_Comedy_Magic_Show-Las_Vegas_Nevada.html
337,Soul Food Tour with Party Bus Experience and Unlimited Liquor,Bus Tours,3 hours,$50.00,per adult,Free cancellation,By Supreme Club Tours,Las Vegas,USA,https://www.tripadvisor.com/Attraction_Review-g45963-d8655595-Reviews-Supreme_Club_Tours-Las_Vegas_Nevada.html
338,Ultimate 4D Experience at the Excalibur Hotel and Casino,Attractions & Museums,15 minutes,$20.98,per adult,,By Fantasy Faire at Excalibur,Las Vegas,USA,https://www.tripadvisor.com/Attraction_Review-g45963-d151532-Reviews-Fantasy_Faire_at_Excalibur-Las_Vegas_Nevada.html
339,Bellagio Gallery of Fine Art at the Bellagio Hotel and Casino,Attractions & Museums,1 hour,$18.47,per adult,,By Bellagio Gallery of Fine Art,Las Vegas,USA,https://www.tripadvisor.com/Attraction_Review-g45963-d106584-Reviews-Bellagio_Gallery_of_Fine_Art-Las_Vegas_Nevada.html
340,The Eddie Griffin Experience at SAHARA Las Vegas,Comedy Shows,1–2 hours,$76.99,per adult,,By SAHARA Las Vegas,Las Vegas,USA,https://www.tripadvisor.com/Attraction_Review-g45963-d7610665-Reviews-SAHARA_Las_Vegas-Las_Vegas_Nevada.html
341,Antelope Canyon & Horseshoe Bend Day Trip from Las Vegas,Bus Tours,10–12 hours,$274.00,per adult,Free cancellation,By Universal Vision,Las Vegas,USA,https://www.tripadvisor.com/Attraction_Review-g47729-d16870286-Reviews-Universal_Vision-Flushing_Queens_New_York.html
342,Red Riding Hood Escape Games in Las Vegas,,1 hour,$41.03,per adult,,By Number One Escape Room,Las Vegas,USA,https://www.tripadvisor.com/Attraction_Review-g45963-d13008359-Reviews-Number_One_Escape_Room-Las_Vegas_Nevada.html
343,Las Vegas Self-Guided City Tour Experience,Walking Tours,1 day,$12.00,per adult,,By Vox City Las Vegas,Las Vegas,USA,https://www.tripadvisor.com/Attraction_Review-g45963-d23314940-Reviews-Vox_City_Las_Vegas-Las_Vegas_Nevada.html
344,Arrival Private Transfer Las Vegas in Luxury SUV or Limousine up to 8 pax,SPECIAL OFFER,1–2 hours,$62.15,per adult,Free cancellation,"By EUROPE SHUTTLE Las Vegas, United States",Las Vegas,USA,https://www.tripadvisor.com/Attraction_Review-g45963-d19512822-Reviews-EUROPE_SHUTTLE_Las_Vegas_United_States-Las_Vegas_Nevada.html
345,Vegas Rock Star Nightclub Tour,Bus Tours,5 hours,$59.00,per adult,Free cancellation,By Vegas Rockstar - Private Tours,Las Vegas,USA,https://www.tripadvisor.com/Attraction_Review-g45963-d3161157-Reviews-Vegas_Rockstar_Private_Tours-Las_Vegas_Nevada.html
346,Hidden Valley and Primm ATV Tour,Adventure Tours,4–5 hours,$248.99,per adult,Free cancellation,By American Adventure Tours,Las Vegas,USA,https://www.tripadvisor.com/Attraction_Review-g45963-d1206511-Reviews-American_Adventure_Tours-Las_Vegas_Nevada.html
347,Lower Antelope Canyon and Horseshoe Bend Small Group Day Tour from Las Vegas,Adventure Tours,6+ hours,$289.00,per adult,Free cancellation,By MaxTour,Las Vegas,USA,https://www.tripadvisor.com/Attraction_Review-g45963-d12334620-Reviews-MaxTour-Las_Vegas_Nevada.html
348,Flight Experience in Las Vegas,Adventure Tours,2 hours,$449.00,per adult,Free cancellation,By Sky Combat Ace,Las Vegas,USA,https://www.tripadvisor.com/Attraction_Review-g45981-d2072017-Reviews-Sky_Combat_Ace-North_Las_Vegas_Nevada.html
349,"3-Day Tour: Sedona, Monument Valley, and Antelope Canyon",Bus Tours,3 days,$590.00,per adult,Free cancellation,By Empire Vacations Day Tours,Las Vegas,USA,https://www.tripadvisor.com/Attraction_Review-g32655-d2145231-Reviews-Empire_Vacations_Day_Tours-Los_Angeles_California.html
350,Las Vegas Dunes ATV Tour,,2 hours,$180.00,per adult,Free cancellation,By Las Vegas ATV Nellis Dunes Tour,Las Vegas,USA,https://www.tripadvisor.com/Attraction_Review-g45963-d19689779-Reviews-Las_Vegas_ATV_Nellis_Dunes_Tour-Las_Vegas_Nevada.html
351,,12,11,,,13,,Las Vegas,USA,
352,,,,,,,Clear all filters,Las Vegas,USA,
353,Grand Canyon Helicopter Flight and Sunset Valley of Fire Landing,Adventure Tours,4 hours,$599.00,per adult,Free cancellation,By 5 Star Grand Canyon Helicopter Tours,Las Vegas,USA,https://www.tripadvisor.com/Attraction_Review-g60881-d3160367-Reviews-5_Star_Grand_Canyon_Helicopter_Tours-Boulder_City_Nevada.html
354,"3-Day National Parks Tour from Las Vegas: Grand Canyon, Zion and Bryce Canyon",Bus Tours,3 days,$590.00,per adult,Free cancellation,By Empire Vacations Day Tours - New York,Las Vegas,USA,https://www.tripadvisor.com/Attraction_Review-g60763-d2518930-Reviews-Empire_Vacations_Day_Tours_New_York-New_York_City_New_York.html
355,Valley of Fire & Wildlife Photo Tour from Las Vegas,Bus Tours,6+ hours,$116.45,per adult,Free cancellation,By Play In US,Las Vegas,USA,https://www.tripadvisor.com/Attraction_Review-g45953-d15239375-Reviews-Play_In_US-Henderson_Nevada.html
356,Red Rock Canyon Tour w/Private Option (2-6 people),Bus Tours,3 hours,$105.00,per adult,Free cancellation,By Las Vegas D-Tours,Las Vegas,USA,https://www.tripadvisor.com/Attraction_Review-g45963-d15812107-Reviews-Las_Vegas_D_Tours-Las_Vegas_Nevada.html
357,Colorado River Full Day Kayak Tour from Las Vegas,Private and Luxury,6+ hours,$192.20,per adult,,By River Dogz,Las Vegas,USA,https://www.tripadvisor.com/Attraction_Review-g45963-d7909844-Reviews-River_Dogz-Las_Vegas_Nevada.html
358,Grand Canyon White Water Rafting Trip from Las Vegas,Adventure Tours,6+ hours,$645.99,per adult,Free cancellation,By Lets GO Grand Canyon Tours,Las Vegas,USA,https://www.tripadvisor.com/Attraction_Review-g45953-d13974741-Reviews-Lets_GO_Grand_Canyon_Tours-Henderson_Nevada.html
359,Small-Group Grand Canyon West Rim Day Trip from Las Vegas with Optional Skywalk,Adventure Tours,6+ hours,$233.00,per adult,Free cancellation,By Gray Line Las Vegas,Las Vegas,USA,https://www.tripadvisor.com/Attraction_Review-g45963-d622824-Reviews-Gray_Line_Las_Vegas-Las_Vegas_Nevada.html
360,Small Group Grand Canyon West Rim Day Trip from Las Vegas,Adventure Tours,6+ hours,$199.00,per adult,Free cancellation,By Grand Canyon Destinations,Las Vegas,USA,https://www.tripadvisor.com/Attraction_Review-g45963-d8517251-Reviews-Grand_Canyon_Destinations-Las_Vegas_Nevada.html
361,"Grand Canyon, Monument Valley, and Zion Winter 3-Day Tour from Las Vegas",Bus Tours,3 days,$795.00,per adult,Free cancellation,By Bindlestiff Tours,Las Vegas,USA,https://www.tripadvisor.com/Attraction_Review-g45963-d2481056-Reviews-Bindlestiff_Tours-Las_Vegas_Nevada.html
362,Stripper 101 at Planet Hollywood Resort and Casino,Burlesque Shows,1–2 hours,$69.99,per adult,Free cancellation,By V Theater,Las Vegas,USA,https://www.tripadvisor.com/Attraction_Review-g45963-d2366347-Reviews-V_Theater-Las_Vegas_Nevada.html
363,Las Vegas Night Flight Helicopter Wedding Ceremony,Helicopter Tours,2 hours,$549.00,per adult,Free cancellation,By 5 Star Las Vegas Helicopter Tours,Las Vegas,USA,https://www.tripadvisor.com/Attraction_Review-g45963-d7835594-Reviews-5_Star_Las_Vegas_Helicopter_Tours-Las_Vegas_Nevada.html
364,Full-day Tour in Antelope Canyon and Horseshoe Bend,Full-day Tours,12–13 hours,$189.00,per adult,Free cancellation,By Empire Vacations Day Tours,Las Vegas,USA,https://www.tripadvisor.com/Attraction_Review-g45963-d23583085-Reviews-Empire_Vacations_Day_Tours-Las_Vegas_Nevada.html
365,Las Vegas Hip Hop Pool Crawl by Party Bus,Private and Luxury,4 hours,$50.00,per adult,Free cancellation,By Supreme Club Tours,Las Vegas,USA,https://www.tripadvisor.com/Attraction_Review-g45963-d8655595-Reviews-Supreme_Club_Tours-Las_Vegas_Nevada.html
366,Small Group Guided Walking Tour of Zion National Park,Full-day Tours,6+ hours,$269.00,per adult,Free cancellation,By iTravel USA,Las Vegas,USA,https://www.tripadvisor.com/Attraction_Review-g45963-d15612535-Reviews-ITravel_USA-Las_Vegas_Nevada.html
367,Desert Off-Road Racing On A Dirt Track in Las Vegas,,2 hours,$299.00,per adult,Free cancellation,By Speedvegas,Las Vegas,USA,https://www.tripadvisor.com/Attraction_Review-g45963-d10187865-Reviews-Speedvegas-Las_Vegas_Nevada.html
368,Las Vegas UTV / Buggy's Tours,Adventure Tours,2 hours,$206.50,per adult,Free cancellation,By Las Vegas ATV Tours,Las Vegas,USA,https://www.tripadvisor.com/Attraction_Review-g45981-d2506905-Reviews-Las_Vegas_ATV_Tours-North_Las_Vegas_Nevada.html
369,Antelope Canyon and Horseshoe Bend,Walking Tours,6+ hours,$199.00,per adult,,By West Pearl Tours,Las Vegas,USA,https://www.tripadvisor.com/Attraction_Review-g45963-d17666282-Reviews-West_Pearl_Tours-Las_Vegas_Nevada.html
370,"2Day Small Group Tour: Grand Canyon, Zion Canyon and Bryce Canyon from Las Vegas",Bus Tours,2 days,$699.00,per adult,Free cancellation,By Private Grand Canyon Tour,Las Vegas,USA,https://www.tripadvisor.com/Attraction_Review-g45981-d21396126-Reviews-Private_Grand_Canyon_Tour-North_Las_Vegas_Nevada.html
371,Red Rock Canyon Wedding by Private Limousine,,3 hours,$549.00,per adult,Free cancellation,By A Special Memory Wedding Chapel,Las Vegas,USA,https://www.tripadvisor.com/Attraction_Review-g45963-d1409130-Reviews-A_Special_Memory_Wedding_Chapel-Las_Vegas_Nevada.html
372,Skip the Line: Nostalgia Street Rods Museum Ticket and Optional VIP Tour,Attractions & Museums,45–90 minutes,$20.00,per adult,Free cancellation,By Nostalgia Street Rods,Las Vegas,USA,https://www.tripadvisor.com/Attraction_Review-g45963-d7125990-Reviews-Nostalgia_Street_Rods-Las_Vegas_Nevada.html
373,Ghost Town Hunt Adventure Tour,Adventure Tours,4 hours,$299.00,per adult,Free cancellation,By Las Vegas Adrenaline Junkies Tours,Las Vegas,USA,https://www.tripadvisor.com/Attraction_Review-g45963-d23229909-Reviews-Las_Vegas_Adrenaline_Junkies_Tours-Las_Vegas_Nevada.html
374,Las Vegas to Grand Canyon West Sunset Tour,Bus Tours,7–8 hours,$149.00,per adult,Free cancellation,By National Park Express,Las Vegas,USA,https://www.tripadvisor.com/Attraction_Review-g45963-d15673500-Reviews-National_Park_Express-Las_Vegas_Nevada.html
375,Las Vegas VIP Party Bus Crawl,Bus Tours,5–6 hours,$54.00,per adult,Free cancellation,By Nocturnal Tours,Las Vegas,USA,https://www.tripadvisor.com/Attraction_Review-g45963-d8382959-Reviews-Nocturnal_Tours-Las_Vegas_Nevada.html
376,2-Day Antelope Canyon Grand Canyon Horseshoe Bend Tour from Las Vegas,Bus Tours,2 days,$590.00,per adult,,By Wannar Travel Inc,Las Vegas,USA,https://www.tripadvisor.com/Attraction_Review-g60834-d16666685-Reviews-Wannar_Travel_Inc-Page_Arizona.html
377,Femme Fatale Experience,,40 minutes,$119.00,per adult,Free cancellation,By Machine Guns Vegas,Las Vegas,USA,https://www.tripadvisor.com/Attraction_Review-g45963-d2534148-Reviews-Machine_Guns_Vegas-Las_Vegas_Nevada.html
378,Skip the Line: Springs Preserve in Las Vegas Admission Ticket,Nature Parks,1 day,$14.99,per adult,Free cancellation,By Springs Preserve,Las Vegas,USA,https://www.tripadvisor.com/Attraction_Review-g45963-d658315-Reviews-Springs_Preserve-Las_Vegas_Nevada.html
379,Grand Canyon West Rim Bus Tour with Optional Extras,Full-day Tours,6+ hours,$179.00,per adult,,By TakeYourTrip,Las Vegas,USA,https://www.tripadvisor.com/Attraction_Review-g45963-d17434701-Reviews-TakeYourTrip-Las_Vegas_Nevada.html
380,Mountain Bike Historical Tunnel Trail to Hoover Dam from Las Vegas,Adventure Tours,6+ hours,$191.17,per adult,,By Desert Adventures,Las Vegas,USA,https://www.tripadvisor.com/Attraction_Review-g45963-d983577-Reviews-Desert_Adventures-Las_Vegas_Nevada.html
381,Las Vegas Strip by SUV Stretch Limo with Personal Photographer,Limousine Tours,2 hours,$779.23,per group,Free cancellation,By My Vegas Limo Tour,Las Vegas,USA,https://www.tripadvisor.com/Attraction_Review-g45963-d7149005-Reviews-My_Vegas_Limo_Tour-Las_Vegas_Nevada.html
382,Private 2-Hour LV Limo Tour with Champagne and LV Goodies,Limousine Tours,2 hours,$349.00,per group,Free cancellation,By New Vegas VIP,Las Vegas,USA,https://www.tripadvisor.com/Attraction_Review-g45963-d10375380-Reviews-New_Vegas_VIP-Las_Vegas_Nevada.html
383,,13,12,,,14,,Las Vegas,USA,
384,,,,,,,Clear all filters,Las Vegas,USA,
385,Las Vegas Nightclub Crawl by Party Bus with Fast Pass Entry,Bus Tours,4–6 hours,$40.52,per adult,,By Unlock Las Vegas,Las Vegas,USA,https://www.tripadvisor.com/Attraction_Review-g45963-d17712184-Reviews-Unlock_Las_Vegas-Las_Vegas_Nevada.html
386,Red Rock Electric Scooter Tours,Adventure Tours,3–4 hours,$145.00,per adult,Free cancellation,By Segway Las Vegas,Las Vegas,USA,https://www.tripadvisor.com/Attraction_Review-g45963-d6368299-Reviews-Segway_Las_Vegas-Las_Vegas_Nevada.html
387,"Grand Canyon, Monument Valley and Zion National Park 3-Day Tour",Bus Tours,3 days,$675.00,per adult,Free cancellation,By Bindlestiff Tours,Las Vegas,USA,https://www.tripadvisor.com/Attraction_Review-g45963-d2481056-Reviews-Bindlestiff_Tours-Las_Vegas_Nevada.html
388,Polaris Slingshot Rentals,Rentals,4–24 hours,$249.00,per group,Free cancellation,By SinCity Moto,Las Vegas,USA,https://www.tripadvisor.com/Attraction_Review-g45963-d15087564-Reviews-SinCity_Moto-Las_Vegas_Nevada.html
389,Bachelorette Party Club Crawl,Bus Tours,5–6 hours,$30.13,per adult,Free cancellation,By Club Crawl Co,Las Vegas,USA,https://www.tripadvisor.com/Attraction_Review-g45963-d18338592-Reviews-Club_Crawl_Co-Las_Vegas_Nevada.html
390,1 Day Tour at Valley of Fire and Zion Park,Full-day Tours,11–12 hours,$189.00,per adult,Free cancellation,By Empire Vacations Day Tours,Las Vegas,USA,https://www.tripadvisor.com/Attraction_Review-g45963-d23583085-Reviews-Empire_Vacations_Day_Tours-Las_Vegas_Nevada.html
391,Las Vegas Pool Party Crawl by Party Bus with Fast Pass Entry,Bus Tours,4 hours,$59.00,per adult,Free cancellation,By Unlock Las Vegas,Las Vegas,USA,https://www.tripadvisor.com/Attraction_Review-g45963-d17712184-Reviews-Unlock_Las_Vegas-Las_Vegas_Nevada.html
392,Murray the Magician at Tropicana Hotel and Casino,Theaters,1 hour,$34.49,per adult,Free cancellation,By Tropicana Theater,Las Vegas,USA,https://www.tripadvisor.com/Attraction_Review-g45963-d2369708-Reviews-Tropicana_Theater-Las_Vegas_Nevada.html
393,Hidden Valley and Primm Extreme ATV Tour,Adventure Tours,4–5 hours,$278.99,per adult,Free cancellation,By American Adventure Tours,Las Vegas,USA,https://www.tripadvisor.com/Attraction_Review-g45963-d1206511-Reviews-American_Adventure_Tours-Las_Vegas_Nevada.html
394,Las Vegas Vegan Food Tour,Luxury Car Tours,2–3 hours,$97.00,per adult,Free cancellation,By Lance McGowan,Las Vegas,USA,https://www.tripadvisor.com/Attraction_Review-g45963-d19922605-Reviews-Lance_McGowan-Las_Vegas_Nevada.html
395,Arrival Private Transfer: Las Vegas Airport to Las Vegas City by Business Sedan,SPECIAL OFFER,1 hour,$51.08,per adult,Free cancellation,"By EUROPE SHUTTLE Las Vegas, United States",Las Vegas,USA,https://www.tripadvisor.com/Attraction_Review-g45963-d19512822-Reviews-EUROPE_SHUTTLE_Las_Vegas_United_States-Las_Vegas_Nevada.html
396,Las Vegas Guided Kayak Tour & Grand Canyon Helicopter Tour,Helicopter Tours,6+ hours,$599.00,per adult,Free cancellation,By 5 Star Grand Canyon Helicopter Tours,Las Vegas,USA,https://www.tripadvisor.com/Attraction_Review-g60881-d3160367-Reviews-5_Star_Grand_Canyon_Helicopter_Tours-Boulder_City_Nevada.html
397,Private Arrival Transfer: Las Vegas Airport,,20 minutes,$107.32,per group,Free cancellation,By Mears Las Vegas Chauffeured Services,Las Vegas,USA,https://www.tripadvisor.com/Attraction_Review-g45963-d17822230-Reviews-Mears_Las_Vegas_Chauffeured_Services-Las_Vegas_Nevada.html
398,Full-Day Tour to Zion National Park from Las Vegas,Full-day Tours,6+ hours,$159.00,per adult,Free cancellation,"By SWEETours, Inc.",Las Vegas,USA,https://www.tripadvisor.com/Attraction_Review-g45963-d1102793-Reviews-SWEETours_Inc-Las_Vegas_Nevada.html
399,Private 2 Hour Las Vegas Strip Tour,City Tours,2 hours,$580.00,per group,Free cancellation,By Vegas VIP,Las Vegas,USA,https://www.tripadvisor.com/Attraction_Review-g45963-d23082801-Reviews-Vegas_VIP-Las_Vegas_Nevada.html
400,Private Las Vegas Airport to Hotel Luxury Limousine Transfer,,45 minutes,$279.00,per group,Free cancellation,By A Special Memory Wedding Chapel,Las Vegas,USA,https://www.tripadvisor.com/Attraction_Review-g45963-d1409130-Reviews-A_Special_Memory_Wedding_Chapel-Las_Vegas_Nevada.html
401,Laugh After Dark at Notoriety in Las Vegas,Comedy Shows,1–2 hours,$29.15,per adult,Free cancellation,By Notoriety,Las Vegas,USA,https://www.tripadvisor.com/Attraction_Review-g45963-d23407570-Reviews-Notoriety-Las_Vegas_Nevada.html
402,Lockdown Western Escape Room In Las Vegas,,1 hour,$35.00,per adult,,By Lockdown - Las Vegas Flamingo,Las Vegas,USA,https://www.tripadvisor.com/Attraction_Review-g45963-d12681846-Reviews-Lockdown_Las_Vegas_Flamingo-Las_Vegas_Nevada.html
403,Suzys Cell Escape Game,,1 hour,$41.03,per adult,,By Number One Escape Room,Las Vegas,USA,https://www.tripadvisor.com/Attraction_Review-g45963-d13008359-Reviews-Number_One_Escape_Room-Las_Vegas_Nevada.html
404,RoundTrip Private Transfer Las Vegas by Luxury SUV Cadillac Escalade up to 5 pax,SPECIAL OFFER,1 hour,$119.18,per adult,Free cancellation,"By EUROPE SHUTTLE Las Vegas, United States",Las Vegas,USA,https://www.tripadvisor.com/Attraction_Review-g45963-d19512822-Reviews-EUROPE_SHUTTLE_Las_Vegas_United_States-Las_Vegas_Nevada.html
405,Limo Tour of the Strip,Luxury Car Tours,1 hour,$222.08,per group,Free cancellation,By Asterride,Las Vegas,USA,https://www.tripadvisor.com/Attraction_Review-g45963-d13662259-Reviews-Asterride-Las_Vegas_Nevada.html
406,Haunts and The Mob Las Vegas Walking Tour,Walking Tours,1 hour,$20.00,per adult,Free cancellation,By Haunts and The Mob Las Vegas Walking Tour,Las Vegas,USA,https://www.tripadvisor.com/Attraction_Review-g45963-d20241014-Reviews-Haunts_and_The_Mob_Las_Vegas_Walking_Tour-Las_Vegas_Nevada.html
407,Arrival Private Transfer from Las Vegas Airport to Las Vegas by electric Tesla,SPECIAL OFFER,1 hour,$51.08,per adult,Free cancellation,"By EUROPE SHUTTLE Las Vegas, United States",Las Vegas,USA,https://www.tripadvisor.com/Attraction_Review-g45963-d19512822-Reviews-EUROPE_SHUTTLE_Las_Vegas_United_States-Las_Vegas_Nevada.html
408,Transfer Airport to Hotel or Hotel to Airport,,10–30 minutes,$39.00,per group,,By West Pearl Tours,Las Vegas,USA,https://www.tripadvisor.com/Attraction_Review-g45963-d16845148-Reviews-West_Pearl_Tours-Las_Vegas_Nevada.html
409,Private Transfer: Las Vegas to LAS Airport by Luxury SUV or Limousine up to 8 p,SPECIAL OFFER,1 hour,$57.04,per adult,Free cancellation,"By EUROPE SHUTTLE Las Vegas, United States",Las Vegas,USA,https://www.tripadvisor.com/Attraction_Review-g45963-d19512822-Reviews-EUROPE_SHUTTLE_Las_Vegas_United_States-Las_Vegas_Nevada.html
410,Las Vegas Strip: Past and Present Glory Exploration Game,Walking Tours,1–2 hours,$7.91,per adult,Free cancellation,By Questo App | Las Vegas Walking Tours & City Games,Las Vegas,USA,https://www.tripadvisor.com/Attraction_Review-g45963-d21393823-Reviews-Questo_App_Las_Vegas_Walking_Tours_City_Games-Las_Vegas_Nevada.html
411,Single/Double Rider for Exploring Las Vegas All Day Rental,Self-guided Tours & Rentals,1 day,$66.67,per group,Free cancellation,By Vegas Scooter & Slingshot Rentals,Las Vegas,USA,https://www.tripadvisor.com/Attraction_Review-g45963-d10820355-Reviews-Vegas_Scooter_Slingshot_Rentals-Las_Vegas_Nevada.html
412,Rent Electric Scooters in Downtown Las Vegas,Rentals,4–10 hours,$25.00,per adult,,By Atomic Scooters Rentals and Tours,Las Vegas,USA,https://www.tripadvisor.com/Attraction_Review-g45963-d15519068-Reviews-Atomic_Scooters_Rentals_and_Tours-Las_Vegas_Nevada.html
413,Epic Pool Party Tour by Party Bus,Private and Luxury,5 hours,$59.00,per adult,,By Rockstar Las Vegas,Las Vegas,USA,https://www.tripadvisor.com/Attraction_Review-g45963-d18994830-Reviews-Rockstar_Las_Vegas-Las_Vegas_Nevada.html
414,Private Departure Transfer: Las Vegas Airport,,20 minutes,$97.90,per group,Free cancellation,By Mears Las Vegas Chauffeured Services,Las Vegas,USA,https://www.tripadvisor.com/Attraction_Review-g45963-d17822230-Reviews-Mears_Las_Vegas_Chauffeured_Services-Las_Vegas_Nevada.html
415,,14,13,,,15,,Las Vegas,USA,
