,Tour Name,Tour Type,Tour Duration,Tour Price,Price Per,Cancellation,Tour By,City,Country,Link
211,"Nizwa , Bahla and Jabrin fort for Kids",Bus Tours,7–9 hours,$200.00,per adult,Free cancellation,By Oman Day Tours,Muscat,Oman,https://www.tripadvisor.com/Attraction_Review-g1940497-d4481238-Reviews-Oman_Day_Tours-Muscat_Muscat_Governorate.html
212,Private Transfer from Park Inn by Radisson Muscat to Muscat Airport (MCT),,25 minutes,$57.70,per group,Free cancellation,By Airport Transfer Services in Oman,Muscat,Oman,https://www.tripadvisor.com/Attraction_Review-g1940497-d20481797-Reviews-Airport_Transfer_Services_in_Oman-Muscat_Muscat_Governorate.html
213,Charming Muscat- Half Day City Tour,Luxury Car Tours,4–5 hours,$120.00,per group,Free cancellation,By Yalla Traveler,Muscat,Oman,https://www.tripadvisor.com/Attraction_Review-g1940497-d19858819-Reviews-Yalla_Traveler-Muscat_Muscat_Governorate.html
214,7 Day Bedouin Cultural Experience from Muscat,Ports of Call Tours,3+ days,"$1,964.54",per adult,Free cancellation,By Khimji's House of Travel,Muscat,Oman,https://www.tripadvisor.com/Attraction_Review-g1940497-d12819738-Reviews-Khimji_s_House_of_Travel-Muscat_Muscat_Governorate.html
215,Mystic Muscat Half-Day City Tour,Bus Tours,3–5 hours,$100.00,per adult,Free cancellation,By Oman Day Tours,Muscat,Oman,https://www.tripadvisor.com/Attraction_Review-g1940497-d4481238-Reviews-Oman_Day_Tours-Muscat_Muscat_Governorate.html
216,Super Special Sea Trip,Shore Excursions,5–7 hours,$140.00,per adult,Free cancellation,By Oman Day Tours,Muscat,Oman,https://www.tripadvisor.com/Attraction_Review-g1940497-d4481238-Reviews-Oman_Day_Tours-Muscat_Muscat_Governorate.html
217,Wahiba Sands and Desert Safari from Muscat,City Tours,7–9 hours,$200.00,per adult,Free cancellation,By Oman Day Tours,Muscat,Oman,https://www.tripadvisor.com/Attraction_Review-g1940497-d4481238-Reviews-Oman_Day_Tours-Muscat_Muscat_Governorate.html
218,Private Transfer from Muscat Airport (MCT) to Golden Tulip Nizwa Hotel,,1–2 hours,$304.34,per group,Free cancellation,By Airport Transfer Services in Oman,Muscat,Oman,https://www.tripadvisor.com/Attraction_Review-g1940497-d20481797-Reviews-Airport_Transfer_Services_in_Oman-Muscat_Muscat_Governorate.html
219,4 Days 3 Nights Package Oman Private Tour,Adventure Tours,3+ days,"$1,286.00",per adult,Free cancellation,By Star Tours Oman,Muscat,Oman,https://www.tripadvisor.com/Attraction_Review-g1940497-d14046842-Reviews-Star_Tours_Oman-Muscat_Muscat_Governorate.html
220,Private Transfer from Muscat Airport (MCT) to Crowne Plaza Duqm,,5–6 hours,$411.82,per group,Free cancellation,By Airport Transfer Services in Oman,Muscat,Oman,https://www.tripadvisor.com/Attraction_Review-g1940497-d20481797-Reviews-Airport_Transfer_Services_in_Oman-Muscat_Muscat_Governorate.html
221,Nizwa Full Day (Muscat tours) : Oman Shore excursions,Bus Tours,6+ hours,$200.00,per adult,Free cancellation,By Oman Day Tours,Muscat,Oman,https://www.tripadvisor.com/Attraction_Review-g1940497-d4481238-Reviews-Oman_Day_Tours-Muscat_Muscat_Governorate.html
222,Night Muscat Private Tour with dinner,Bus Tours,3 hours,$96.00,per adult,Free cancellation,By GidOman,Muscat,Oman,https://www.tripadvisor.com/Attraction_Review-g1940497-d17398989-Reviews-GidOman-Muscat_Muscat_Governorate.html
223,Private Transfer from Platinum Hotel to Muscat Airport (MCT),,20 minutes,$61.09,per group,Free cancellation,By Airport Transfer Services in Oman,Muscat,Oman,https://www.tripadvisor.com/Attraction_Review-g1940497-d20481797-Reviews-Airport_Transfer_Services_in_Oman-Muscat_Muscat_Governorate.html
224,Private Transfer from Muscat Airport (MCT) to Al Sawadi Beach Resort & Spa Barka,,1–2 hours,$126.71,per group,Free cancellation,By Airport Transfer Services in Oman,Muscat,Oman,https://www.tripadvisor.com/Attraction_Review-g1940497-d20481797-Reviews-Airport_Transfer_Services_in_Oman-Muscat_Muscat_Governorate.html
225,Wadi Abyadh and Wekan Village from Muscat,Full-day Tours,7–8 hours,$200.00,per adult,Free cancellation,By Oman Day Tours,Muscat,Oman,https://www.tripadvisor.com/Attraction_Review-g1940497-d4481238-Reviews-Oman_Day_Tours-Muscat_Muscat_Governorate.html
226,Sugar Dunes Camping 2 days,Adventure Tours,2 days,$900.00,per group,Free cancellation,By GidOman,Muscat,Oman,https://www.tripadvisor.com/Attraction_Review-g1940497-d17398989-Reviews-GidOman-Muscat_Muscat_Governorate.html
227,"Nizwa , Bahla and Jabrin fort for cultural tours",Bus Tours,7–9 hours,$200.00,per adult,Free cancellation,By Oman Day Tours,Muscat,Oman,https://www.tripadvisor.com/Attraction_Review-g1940497-d4481238-Reviews-Oman_Day_Tours-Muscat_Muscat_Governorate.html
228,Private Transfer from Muscat Holiday to Muscat Airport (MCT),,25 minutes,$57.70,per group,Free cancellation,By Airport Transfer Services in Oman,Muscat,Oman,https://www.tripadvisor.com/Attraction_Review-g1940497-d20481797-Reviews-Airport_Transfer_Services_in_Oman-Muscat_Muscat_Governorate.html
229,Private Transfer from Holiday Inn Muscat Al Seeb to Muscat Airport (MCT),,25 minutes,$57.70,per group,Free cancellation,By Airport Transfer Services in Oman,Muscat,Oman,https://www.tripadvisor.com/Attraction_Review-g1940497-d20481797-Reviews-Airport_Transfer_Services_in_Oman-Muscat_Muscat_Governorate.html
230,Muscat Tours,Bus Tours,4 hours,$154.67,per group,Free cancellation,By Taxi Oman Tours,Muscat,Oman,https://www.tripadvisor.com/Attraction_Review-g1940497-d18844559-Reviews-Taxi_Oman_Tours-Muscat_Muscat_Governorate.html
231,Private Transfer from Muscat Airport (MCT) to Sur Beach Sur Oman,,2–3 hours,$390.32,per group,Free cancellation,By Airport Transfer Services in Oman,Muscat,Oman,https://www.tripadvisor.com/Attraction_Review-g1940497-d20481797-Reviews-Airport_Transfer_Services_in_Oman-Muscat_Muscat_Governorate.html
232,9-Day Essence of the Orient Private Tour from Muscat,Ports of Call Tours,3+ days,"$3,028.67",per adult,Free cancellation,By Khimji's House of Travel,Muscat,Oman,https://www.tripadvisor.com/Attraction_Review-g1940497-d12819738-Reviews-Khimji_s_House_of_Travel-Muscat_Muscat_Governorate.html
233,"7 days / 6 nights program, salalah",Multi-day Tours,3+ days,"$2,500.00",per adult,Free cancellation,By Raya Tour,Muscat,Oman,https://www.tripadvisor.com/Attraction_Review-g298419-d19611035-Reviews-Raya_Tour-Salalah_Dhofar_Governorate.html
234,Private Transfer from Muscat Airport (MCT) to Mercure Hotel Sohar,,2–3 hours,$347.33,per group,Free cancellation,By Airport Transfer Services in Oman,Muscat,Oman,https://www.tripadvisor.com/Attraction_Review-g1940497-d20481797-Reviews-Airport_Transfer_Services_in_Oman-Muscat_Muscat_Governorate.html
235,Full-Day Private Tour of Wadi Shab and Bimmah Sinkhole,Adventure Tours,7–8 hours,$154.00,per adult,Free cancellation,By Oman Sharing Tours,Muscat,Oman,https://www.tripadvisor.com/Attraction_Review-g1940497-d21402738-Reviews-Oman_Sharing_Tours-Muscat_Muscat_Governorate.html
236,Camping Tour 14 Days Package (Oman North & South),Adventure Tours,3+ days,"$5,452.47",per adult,Free cancellation,By Discover Mazoon Tours Oman,Muscat,Oman,https://www.tripadvisor.com/Attraction_Review-g1940497-d15840326-Reviews-Discover_Mazoon_Tours_Oman-Muscat_Muscat_Governorate.html
237,,1,9,,,11,,Muscat,Oman,
238,,,,,,,Clear all filters,Muscat,Oman,
239,Private Transfer from Muscat Airport (MCT) to Park Inn by Radisson Hotel Duqm,,5–6 hours,$629.04,per group,Free cancellation,By Airport Transfer Services in Oman,Muscat,Oman,https://www.tripadvisor.com/Attraction_Review-g1940497-d20481797-Reviews-Airport_Transfer_Services_in_Oman-Muscat_Muscat_Governorate.html
240,Billad Sayt (Day trip) 4WD :Oman Shore excursions,Private and Luxury,6–8 hours,$200.00,per adult,Free cancellation,By Oman Day Tours,Muscat,Oman,https://www.tripadvisor.com/Attraction_Review-g1940497-d4481238-Reviews-Oman_Day_Tours-Muscat_Muscat_Governorate.html
241,Oman's Treasure Chest,Bus Tours,3+ days,"$2,002.51",per adult,Free cancellation,By 1stQuest,Muscat,Oman,https://www.tripadvisor.com/Attraction_Review-g1940497-d20300520-Reviews-1stQuest-Muscat_Muscat_Governorate.html
242,Private Transfer from Muscat Airport (MCT) to Ras Al Jinz Turtle Reserve Sur,,3–4 hours,$434.44,per group,Free cancellation,By Airport Transfer Services in Oman,Muscat,Oman,https://www.tripadvisor.com/Attraction_Review-g1940497-d20481797-Reviews-Airport_Transfer_Services_in_Oman-Muscat_Muscat_Governorate.html
243,Canyoning Oman Adventure Tour One Day,,1–8 hours,$237.59,per adult,Free cancellation,By Majan Views - Oman Adventure Tour,Muscat,Oman,https://www.tripadvisor.com/Attraction_Review-g3181692-d18852371-Reviews-Majan_Views_Oman_Adventure_Tour-Seeb_Muscat_Governorate.html
244,Wadi Tayeen Tour,Full-day Tours,6+ hours,$512.00,per group,Free cancellation,By BAHWAN TOURISM LLC,Muscat,Oman,https://www.tripadvisor.com/Attraction_Review-g1940497-d18845610-Reviews-BAHWAN_TOURISM_LLC-Muscat_Muscat_Governorate.html
245,Private Muscat City Tour,Bus Tours,5–6 hours,$135.00,per adult,Free cancellation,,Muscat,Oman,
246,Private Transfer from Muscat Airport (MCT) to Platinum Hotel,,20 minutes,$61.09,per group,Free cancellation,By Airport Transfer Services in Oman,Muscat,Oman,https://www.tripadvisor.com/Attraction_Review-g1940497-d20481797-Reviews-Airport_Transfer_Services_in_Oman-Muscat_Muscat_Governorate.html
247,03 Nights 4 Days Mountain Desert Beach,Multi-day Tours,3+ days,"$1,400.00",per adult,,By BAHWAN TOURISM LLC,Muscat,Oman,https://www.tripadvisor.com/Attraction_Review-g1940497-d18845610-Reviews-BAHWAN_TOURISM_LLC-Muscat_Muscat_Governorate.html
248,Oman Grand Canyon,Full-day Tours,6+ hours,$622.00,per group,Free cancellation,By BAHWAN TOURISM LLC,Muscat,Oman,https://www.tripadvisor.com/Attraction_Review-g1940497-d18845610-Reviews-BAHWAN_TOURISM_LLC-Muscat_Muscat_Governorate.html
249,Half Day Muscat City Tour Price Up To 2 Person,Private and Luxury,4–5 hours,$100.87,per adult,Free cancellation,By Discover Mazoon Tours Oman,Muscat,Oman,https://www.tripadvisor.com/Attraction_Review-g1940497-d15840326-Reviews-Discover_Mazoon_Tours_Oman-Muscat_Muscat_Governorate.html
250,Explore Nizwa and Jabal Akhdar in 4WD from Muscat - Full Day Private Tour,Adventure Tours,6+ hours,$225.00,per adult,Free cancellation,By Jabal Akhdar Tours,Muscat,Oman,https://www.tripadvisor.com/Attraction_Review-g10046289-d19512999-Reviews-Jabal_Akhdar_Tours-Jabal_Akhdar_Nizwa_Ad_Dakhiliyah_Governorate.html
251,Wadi Shab full day tour (Muscat tours) : outdoor activities,Bus Tours,7–8 hours,$200.00,per adult,Free cancellation,By Oman Day Tours,Muscat,Oman,https://www.tripadvisor.com/Attraction_Review-g1940497-d4481238-Reviews-Oman_Day_Tours-Muscat_Muscat_Governorate.html
252,Private Transfer from Muscat Airport (MCT) to AL Multaqa Hotel Sohar,,2–3 hours,$347.33,per group,Free cancellation,By Airport Transfer Services in Oman,Muscat,Oman,https://www.tripadvisor.com/Attraction_Review-g1940497-d20481797-Reviews-Airport_Transfer_Services_in_Oman-Muscat_Muscat_Governorate.html
253,Private Transfer from Radisson Blue to Muscat Airport (MCT),,30 minutes,$57.70,per group,Free cancellation,By Airport Transfer Services in Oman,Muscat,Oman,https://www.tripadvisor.com/Attraction_Review-g1940497-d20481797-Reviews-Airport_Transfer_Services_in_Oman-Muscat_Muscat_Governorate.html
254,Encounter Oman 3 Nights 4 Days,Bus Tours,3+ days,"$2,490.00",per group,,By BAHWAN TOURISM LLC,Muscat,Oman,https://www.tripadvisor.com/Attraction_Review-g1940497-d18845610-Reviews-BAHWAN_TOURISM_LLC-Muscat_Muscat_Governorate.html
255,Private Transfer from Coral Muscat Hotel and Apartments to Muscat Airport (MCT),,30 minutes,$57.70,per group,Free cancellation,By Airport Transfer Services in Oman,Muscat,Oman,https://www.tripadvisor.com/Attraction_Review-g1940497-d20481797-Reviews-Airport_Transfer_Services_in_Oman-Muscat_Muscat_Governorate.html
256,Nizwa full day (Travel),Full-day Tours,7–8 hours,$200.00,per adult,Free cancellation,By Oman Day Tours,Muscat,Oman,https://www.tripadvisor.com/Attraction_Review-g1940497-d4481238-Reviews-Oman_Day_Tours-Muscat_Muscat_Governorate.html
257,Jabl Shams and Nizwa for Honeymooners,Full-day Tours,7–9 hours,$200.00,per adult,Free cancellation,By Oman Day Tours,Muscat,Oman,https://www.tripadvisor.com/Attraction_Review-g1940497-d4481238-Reviews-Oman_Day_Tours-Muscat_Muscat_Governorate.html
258,FLY & DRIVE- Discover The Sultanate of Oman 7 days / 6 nights,Bus Tours,3+ days,$746.00,per adult,Free cancellation,By Gray Line Oman,Muscat,Oman,https://www.tripadvisor.com/Attraction_Review-g1940497-d2272986-Reviews-Gray_Line_Oman-Muscat_Muscat_Governorate.html
259,Private Transfer from Muscat Airport (MCT) to Sheraton Oman Hotel,,30 minutes,$61.09,per group,Free cancellation,By Airport Transfer Services in Oman,Muscat,Oman,https://www.tripadvisor.com/Attraction_Review-g1940497-d20481797-Reviews-Airport_Transfer_Services_in_Oman-Muscat_Muscat_Governorate.html
260,Private Transfer from InterContinental Muscat to Muscat Airport (MCT),,30 minutes,$57.70,per group,Free cancellation,By Airport Transfer Services in Oman,Muscat,Oman,https://www.tripadvisor.com/Attraction_Review-g1940497-d20481797-Reviews-Airport_Transfer_Services_in_Oman-Muscat_Muscat_Governorate.html
261,Glimpse of Oman 4 Nights 5 Days,Bus Tours,3+ days,"$3,160.00",per group,,By BAHWAN TOURISM LLC,Muscat,Oman,https://www.tripadvisor.com/Attraction_Review-g1940497-d18845610-Reviews-BAHWAN_TOURISM_LLC-Muscat_Muscat_Governorate.html
262,Muscat City Tour Full Day,Ports of Call Tours,6+ hours,$214.00,per adult,Free cancellation,By Vacation Packages Oman,Muscat,Oman,https://www.tripadvisor.com/Attraction_Review-g1940497-d8312979-Reviews-Vacation_Packages_Oman-Muscat_Muscat_Governorate.html
263,Private Transfer from Ibis AlKhwair to Muscat Airport (MCT),,25 minutes,$53.17,per group,Free cancellation,By Airport Transfer Services in Oman,Muscat,Oman,https://www.tripadvisor.com/Attraction_Review-g1940497-d20481797-Reviews-Airport_Transfer_Services_in_Oman-Muscat_Muscat_Governorate.html
264,"Private Tours, Groups, Self drive",,4–8 hours,"$1,500.00",per adult,,By National Travel & Tourism,Muscat,Oman,https://www.tripadvisor.com/Attraction_Review-g1940497-d20111714-Reviews-National_Travel_Tourism-Muscat_Muscat_Governorate.html
265,Nizwa tour (price per vehicle),Full-day Tours,6+ hours,$360.54,per group,Free cancellation,By Muscat Advanced Tourism,Muscat,Oman,https://www.tripadvisor.com/Attraction_Review-g1940497-d16868236-Reviews-Muscat_Advanced_Tourism-Muscat_Muscat_Governorate.html
266,Private Transfer from Muscat Airport (MCT) to Crystal Suites Hotel,,35 minutes,$57.70,per group,Free cancellation,By Airport Transfer Services in Oman,Muscat,Oman,https://www.tripadvisor.com/Attraction_Review-g1940497-d20481797-Reviews-Airport_Transfer_Services_in_Oman-Muscat_Muscat_Governorate.html
267,Muscat Half day City Tour,Bus Tours,5 hours,$63.23,per adult,Free cancellation,By Pink Stone Travel & Tourism LLC,Muscat,Oman,https://www.tripadvisor.com/Attraction_Review-g1940497-d19067152-Reviews-Pink_Stone_Travel_Tourism_LLC-Muscat_Muscat_Governorate.html
268,Private Full Day Jebel Akhdar Tour from Muscat,Adventure Tours,6+ hours,$233.00,per adult,Free cancellation,By Gray Line Oman,Muscat,Oman,https://www.tripadvisor.com/Attraction_Review-g1940497-d2272986-Reviews-Gray_Line_Oman-Muscat_Muscat_Governorate.html
269,,1,10,,,12,,Muscat,Oman,
270,Private Transfer from Muscat Airport (MCT) to Park Inn by Radisson Hotel Duqm,,5–6 hours,$629.04,per group,Free cancellation,By Airport Transfer Services in Oman,Muscat,Oman,https://www.tripadvisor.com/Attraction_Review-g1940497-d20481797-Reviews-Airport_Transfer_Services_in_Oman-Muscat_Muscat_Governorate.html
271,Billad Sayt (Day trip) 4WD :Oman Shore excursions,Private and Luxury,6–8 hours,$200.00,per adult,Free cancellation,By Oman Day Tours,Muscat,Oman,https://www.tripadvisor.com/Attraction_Review-g1940497-d4481238-Reviews-Oman_Day_Tours-Muscat_Muscat_Governorate.html
272,Oman's Treasure Chest,Bus Tours,3+ days,"$2,002.51",per adult,Free cancellation,By 1stQuest,Muscat,Oman,https://www.tripadvisor.com/Attraction_Review-g1940497-d20300520-Reviews-1stQuest-Muscat_Muscat_Governorate.html
273,Private Transfer from Muscat Airport (MCT) to Ras Al Jinz Turtle Reserve Sur,,3–4 hours,$434.44,per group,Free cancellation,By Airport Transfer Services in Oman,Muscat,Oman,https://www.tripadvisor.com/Attraction_Review-g1940497-d20481797-Reviews-Airport_Transfer_Services_in_Oman-Muscat_Muscat_Governorate.html
274,Canyoning Oman Adventure Tour One Day,,1–8 hours,$237.59,per adult,Free cancellation,By Majan Views - Oman Adventure Tour,Muscat,Oman,https://www.tripadvisor.com/Attraction_Review-g3181692-d18852371-Reviews-Majan_Views_Oman_Adventure_Tour-Seeb_Muscat_Governorate.html
275,,1,11,,,13,,Muscat,Oman,
276,,,,,,,Clear all filters,Muscat,Oman,
277,Vacation Photography Package (30 photographs),,1 hour,$164.11,per group,Free cancellation,By Imran Zahid - Vacation Photographer,Muscat,Oman,https://www.tripadvisor.com/Attraction_Review-g1940497-d19246756-Reviews-Imran_Zahid_Vacation_Photographer-Muscat_Muscat_Governorate.html
278,Private Transfer from Muscat Airport (MCT) to Sur Plaza Hotel,,2–3 hours,$390.32,per group,Free cancellation,By Airport Transfer Services in Oman,Muscat,Oman,https://www.tripadvisor.com/Attraction_Review-g1940497-d20481797-Reviews-Airport_Transfer_Services_in_Oman-Muscat_Muscat_Governorate.html
279,Sharqiyah Desert Safari,Adventure Tours,6+ hours,$402.14,per group,Free cancellation,By Old Muscat Tourism,Muscat,Oman,https://www.tripadvisor.com/Attraction_Review-g1940497-d17835557-Reviews-Old_Muscat_Tourism-Muscat_Muscat_Governorate.html
280,Private Transfer from Centara Hotel to Muscat Airport (MCT),,20 minutes,$57.70,per group,Free cancellation,By Airport Transfer Services in Oman,Muscat,Oman,https://www.tripadvisor.com/Attraction_Review-g1940497-d20481797-Reviews-Airport_Transfer_Services_in_Oman-Muscat_Muscat_Governorate.html
281,Muscat By Night Tour,Bus Tours,4 hours,$173.34,per adult,Free cancellation,By Smart Travel and Tourism,Muscat,Oman,https://www.tripadvisor.com/Attraction_Review-g1940497-d12179009-Reviews-Smart_Travel_and_Tourism-Muscat_Muscat_Governorate.html
282,"WADI SHAB - Muscat, Oman",Bus Tours,6+ hours,$149.43,per adult,Free cancellation,By Aryaf Jibreen Tourism,Muscat,Oman,https://www.tripadvisor.com/Attraction_Review-g1940497-d16787845-Reviews-Aryaf_Jibreen_Tourism-Muscat_Muscat_Governorate.html
283,Discover Oman 3 nights and 4 days full costs,Adventure Tours,3+ days,"$2,133.34",per group,Free cancellation,By Taxi Oman Tours,Muscat,Oman,https://www.tripadvisor.com/Attraction_Review-g1940497-d18844559-Reviews-Taxi_Oman_Tours-Muscat_Muscat_Governorate.html
284,Wadi Shab & Wadi Tiwi; Fins Beach & City of Sur,Adventure Tours,2 days,"$1,508.49",per group,Free cancellation,By Golden Highlands,Muscat,Oman,https://www.tripadvisor.com/Attraction_Review-g1940497-d15663135-Reviews-Golden_Highlands-Muscat_Muscat_Governorate.html
285,Private Transfer from Rami Guest Line Qurum Beach to Muscat Airport (MCT),,30 minutes,$57.70,per group,Free cancellation,By Airport Transfer Services in Oman,Muscat,Oman,https://www.tripadvisor.com/Attraction_Review-g1940497-d20481797-Reviews-Airport_Transfer_Services_in_Oman-Muscat_Muscat_Governorate.html
286,Nizwa tour with Jabal Akhdar tour- (Oman) Special offer (price per vehicle),Full-day Tours,6+ hours,$362.67,per group,Free cancellation,By Muscat Advanced Tourism,Muscat,Oman,https://www.tripadvisor.com/Attraction_Review-g1940497-d16868236-Reviews-Muscat_Advanced_Tourism-Muscat_Muscat_Governorate.html
287,6 Days Private Guided Journey in Oman,Adventure Tours,3+ days,"$1,739.44",per adult,Free cancellation,By Khimji's House of Travel,Muscat,Oman,https://www.tripadvisor.com/Attraction_Review-g1940497-d12819738-Reviews-Khimji_s_House_of_Travel-Muscat_Muscat_Governorate.html
288,Wahiba Sands Desert with Wadi Bani Khalid Tour by 4X4,Day Trips,6+ hours,$439.00,per adult,,By Magic Arabia Oman,Muscat,Oman,https://www.tripadvisor.com/Attraction_Review-g1940497-d21244905-Reviews-Magic_Arabia_Oman-Muscat_Muscat_Governorate.html
289,Nizwa Fort-Jebel Akhdar Oman Adventure Tour,Shore Excursions,1–8 hours,$195.50,per adult,Free cancellation,By Majan Views - Oman Adventure Tour,Muscat,Oman,https://www.tripadvisor.com/Attraction_Review-g3181692-d18852371-Reviews-Majan_Views_Oman_Adventure_Tour-Seeb_Muscat_Governorate.html
290,Private Full Day Historical Trip in Oman,Adventure Tours,7–8 hours,$182.30,per adult,Free cancellation,By Star Tours Oman,Muscat,Oman,https://www.tripadvisor.com/Attraction_Review-g1940497-d14046842-Reviews-Star_Tours_Oman-Muscat_Muscat_Governorate.html
291,Private 3 days 2 nights Roundtrip Tour in Oman,Shore Excursions,3 days,$887.00,per adult,Free cancellation,By Sunshine Tours Oman,Muscat,Oman,https://www.tripadvisor.com/Attraction_Review-g1940497-d8617192-Reviews-Sunshine_Tours_Oman-Muscat_Muscat_Governorate.html
292,Jabl Shams with Nizwa as Kids friendly trip,Full-day Tours,7–9 hours,$200.00,per adult,Free cancellation,By Oman Day Tours,Muscat,Oman,https://www.tripadvisor.com/Attraction_Review-g1940497-d4481238-Reviews-Oman_Day_Tours-Muscat_Muscat_Governorate.html
293,TOUR ALADIN 11 Day Tour with Musandam,Private and Luxury,3+ days,"$3,400.00",per adult,Free cancellation,By Oman Day Tours,Muscat,Oman,https://www.tripadvisor.com/Attraction_Review-g1940497-d4481238-Reviews-Oman_Day_Tours-Muscat_Muscat_Governorate.html
294,"The highlights of Oman - 6 nights, 7 days",Multi-day Tours,3+ days,"$3,080.00",per adult,,By BAHWAN TOURISM LLC,Muscat,Oman,https://www.tripadvisor.com/Attraction_Review-g1940497-d18845610-Reviews-BAHWAN_TOURISM_LLC-Muscat_Muscat_Governorate.html
295,Full day Muscat City Tour with Sunset Cruise,Bus Tours,6+ hours,$110.00,per adult,Free cancellation,By Gray Line Oman,Muscat,Oman,https://www.tripadvisor.com/Attraction_Review-g1940497-d2272986-Reviews-Gray_Line_Oman-Muscat_Muscat_Governorate.html
296,2-Days 1 Night Private Jebel Shams Tour,Adventure Tours,2 days,$494.00,per adult,Free cancellation,By Star Tours Oman,Muscat,Oman,https://www.tripadvisor.com/Attraction_Review-g1940497-d14046842-Reviews-Star_Tours_Oman-Muscat_Muscat_Governorate.html
297,From the Oman Gulf to the Arabian Sea in 12 Days,Bus Tours,3+ days,"$4,016.33",per adult,Free cancellation,By 1stQuest,Muscat,Oman,https://www.tripadvisor.com/Attraction_Review-g1940497-d20300520-Reviews-1stQuest-Muscat_Muscat_Governorate.html
298,Tour Arwa 3 Days Package,Private and Luxury,3 days,$912.00,per adult,Free cancellation,By Discover Mazoon Tours Oman,Muscat,Oman,https://www.tripadvisor.com/Attraction_Review-g1940497-d15840326-Reviews-Discover_Mazoon_Tours_Oman-Muscat_Muscat_Governorate.html
299,"Nakhal - Muscat, Oman",Bus Tours,6+ hours,$149.52,per adult,Free cancellation,By Aryaf Jibreen Tourism,Muscat,Oman,https://www.tripadvisor.com/Attraction_Review-g1940497-d16787845-Reviews-Aryaf_Jibreen_Tourism-Muscat_Muscat_Governorate.html
300,Full Day Nizwa Tour,Bus Tours,6+ hours,$436.00,per adult,,By Magic Arabia Oman,Muscat,Oman,https://www.tripadvisor.com/Attraction_Review-g1940497-d21244905-Reviews-Magic_Arabia_Oman-Muscat_Muscat_Governorate.html
301,Wadi Bani Khalid Tour ( per vehicle),Full-day Tours,6+ hours,$388.38,per group,Free cancellation,By Muscat Advanced Tourism,Muscat,Oman,https://www.tripadvisor.com/Attraction_Review-g1940497-d16868236-Reviews-Muscat_Advanced_Tourism-Muscat_Muscat_Governorate.html
302,Rustaq Day Tour from Muscat,Full-day Tours,6+ hours,$142.27,per adult,Free cancellation,By Pink Stone Travel & Tourism LLC,Muscat,Oman,https://www.tripadvisor.com/Attraction_Review-g1940497-d19067152-Reviews-Pink_Stone_Travel_Tourism_LLC-Muscat_Muscat_Governorate.html
303,Muscat airport to Nizwa,,2 hours,$192.00,per group,Free cancellation,By Taxi Oman Tours,Muscat,Oman,https://www.tripadvisor.com/Attraction_Review-g1940497-d18844559-Reviews-Taxi_Oman_Tours-Muscat_Muscat_Governorate.html
304,Culinary Tour - Oman,Bus Tours,8–20 hours,$149.52,per adult,Free cancellation,By Aryaf Jibreen Tourism,Muscat,Oman,https://www.tripadvisor.com/Attraction_Review-g1940497-d16787845-Reviews-Aryaf_Jibreen_Tourism-Muscat_Muscat_Governorate.html
305,Camping Tour 7 Days Package,Adventure Tours,3+ days,"$2,489.94",per adult,Free cancellation,By Discover Mazoon Tours Oman,Muscat,Oman,https://www.tripadvisor.com/Attraction_Review-g1940497-d15840326-Reviews-Discover_Mazoon_Tours_Oman-Muscat_Muscat_Governorate.html
306,"Coastal Trip, Oman",Full-day Tours,8–10 hours,$420.00,per group,Free cancellation,By Primeway Tours,Muscat,Oman,https://www.tripadvisor.com/Attraction_Review-g1940497-d19903877-Reviews-Primeway_Tours-Muscat_Muscat_Governorate.html
307,,1,12,,,14,,Muscat,Oman,
308,,,,,,,Clear all filters,Muscat,Oman,
309,"Explore Nizwa, Bahla & Jabreen Forts in Full Day Guided Tour with Omani Guide",Full-day Tours,7–8 hours,$145.00,per adult,Free cancellation,By Wonderful Oman Tours,Muscat,Oman,https://www.tripadvisor.com/Attraction_Review-g1940497-d19512943-Reviews-Wonderful_Oman_Tours-Muscat_Muscat_Governorate.html
310,Snorkeling and Dolphin Sightseeing Private Experience,Ports of Call Tours,3 hours,$441.00,per group,Free cancellation,By Anchored ships,Muscat,Oman,https://www.tripadvisor.com/Attraction_Review-g1940497-d15080501-Reviews-Anchored_ships-Muscat_Muscat_Governorate.html
311,Full Day Exploration Al Hamra-Jabel Shams Tour,Shore Excursions,6+ hours,$186.67,per adult,Free cancellation,By Majan Views - Oman Adventure Tour,Muscat,Oman,https://www.tripadvisor.com/Attraction_Review-g3181692-d18852371-Reviews-Majan_Views_Oman_Adventure_Tour-Seeb_Muscat_Governorate.html
