,Tour Name,Tour Type,Tour Duration,Tour Price,Price Per,Cancellation,Tour By,City,Country,Link
0,,,,,,,Clear all filters,Muscat,Oman,
1,Full-Day Private Wahiba Sands Desert and Wadi Bani Khalid Tour,Car Tours,6+ hours,$194.00,per adult,Free cancellation,By Sunshine Tours Oman,Muscat,Oman,https://www.tripadvisor.com/Attraction_Review-g1940497-d8617192-Reviews-Sunshine_Tours_Oman-Muscat_Muscat_Governorate.html
2,Snorkeling at Dimaniyat Islands,Adventure Tours,4–5 hours,$100.00,per adult,Free cancellation,By Demaniyat Adventures,Muscat,Oman,https://www.tripadvisor.com/Attraction_Review-g1940497-d23746972-Reviews-Demaniyat_Adventures-Muscat_Muscat_Governorate.html
3,Wadi Shab and Bimmah Sinkhole Private Full Day Tour,Adventure Tours,8–10 hours,$180.00,per adult,Free cancellation,By GidOman,Muscat,Oman,https://www.tripadvisor.com/Attraction_Review-g1940497-d17398989-Reviews-GidOman-Muscat_Muscat_Governorate.html
4,Discover the South and Wadi Shab from Muscat,Bus Tours,6+ hours,$79.00,per adult,Free cancellation,By Gray Line Oman,Muscat,Oman,https://www.tripadvisor.com/Attraction_Review-g1940497-d2272986-Reviews-Gray_Line_Oman-Muscat_Muscat_Governorate.html
5,Private Day-Tour in Nizwa and Jebel Akhdar,Full-day Tours,6+ hours,$174.00,per adult,Free cancellation,By Star Tours Oman,Muscat,Oman,https://www.tripadvisor.com/Attraction_Review-g1940497-d14046842-Reviews-Star_Tours_Oman-Muscat_Muscat_Governorate.html
6,Wadi Shab and Bimmah Sinkhole Group Full Day Tour,Full-day Tours,6+ hours,$95.00,per adult,Free cancellation,By GidOman,Muscat,Oman,https://www.tripadvisor.com/Attraction_Review-g1940497-d17398989-Reviews-GidOman-Muscat_Muscat_Governorate.html
7,Day Trip To Nizwa & Jabal Shams (The Grand Canyon of Oman),Shore Excursions,8–9 hours,$220.00,per adult,Free cancellation,By Discover Mazoon Tours Oman,Muscat,Oman,https://www.tripadvisor.com/Attraction_Review-g1940497-d15840326-Reviews-Discover_Mazoon_Tours_Oman-Muscat_Muscat_Governorate.html
8,Day Trip To Wahiba Sands & Wadi Bani Khalid (Desert Safari),Full-day Tours,9–10 hours,$220.00,per adult,Free cancellation,By Discover Mazoon Tours Oman,Muscat,Oman,https://www.tripadvisor.com/Attraction_Review-g1940497-d15840326-Reviews-Discover_Mazoon_Tours_Oman-Muscat_Muscat_Governorate.html
9,Nizwa and Jabl Shams private and custom tour,Full-day Tours,7–9 hours,$200.00,per adult,Free cancellation,By Oman Day Tours,Muscat,Oman,https://www.tripadvisor.com/Attraction_Review-g1940497-d4481238-Reviews-Oman_Day_Tours-Muscat_Muscat_Governorate.html
10,Wahiba Sands And Wadi Bani Khalid,Full-day Tours,7–10 hours,$208.00,per adult,Free cancellation,By Tours Oman Private Day tours,Muscat,Oman,https://www.tripadvisor.com/Attraction_Review-g1940497-d12292716-Reviews-Tours_Oman_Private_Day_tours-Muscat_Muscat_Governorate.html
11,Private Muscat City Tour,Bus Tours,4–5 hours,$112.83,per adult,Free cancellation,By GidOman,Muscat,Oman,https://www.tripadvisor.com/Attraction_Review-g1940497-d17398989-Reviews-GidOman-Muscat_Muscat_Governorate.html
12,Half-Day Muscat City Tour,Private and Luxury,4–5 hours,$100.00,per adult,Free cancellation,By Discover Mazoon Tours Oman,Muscat,Oman,https://www.tripadvisor.com/Attraction_Review-g1940497-d15840326-Reviews-Discover_Mazoon_Tours_Oman-Muscat_Muscat_Governorate.html
13,2 days and 1 night Private tour to Jebel Shams/Nizwa - Muscat,Shore Excursions,2 days,$497.00,per adult,Free cancellation,By Sunshine Tours Oman,Muscat,Oman,https://www.tripadvisor.com/Attraction_Review-g1940497-d8617192-Reviews-Sunshine_Tours_Oman-Muscat_Muscat_Governorate.html
14,Mystical Muscat,Bus Tours,5 hours,$250.00,per group,Free cancellation,By VS Private Tours,Muscat,Oman,https://www.tripadvisor.com/Attraction_Review-g1940497-d6651163-Reviews-VS_Private_Tours-Muscat_Muscat_Governorate.html
15,"Day Trip To Nizwa, Jabal Akhdar (Green Mountain) & Birkat Al Moz",Full-day Tours,8–9 hours,$220.00,per adult,Free cancellation,By Discover Mazoon Tours Oman,Muscat,Oman,https://www.tripadvisor.com/Attraction_Review-g1940497-d15840326-Reviews-Discover_Mazoon_Tours_Oman-Muscat_Muscat_Governorate.html
16,Highlights of Muscat (Half-day City Tour),Bus Tours,4–5 hours,$86.67,per adult,Free cancellation,By Old Muscat Tourism,Muscat,Oman,https://www.tripadvisor.com/Attraction_Review-g1940497-d17835557-Reviews-Old_Muscat_Tourism-Muscat_Muscat_Governorate.html
17,Desert Safari Sharing Tours,Full-day Tours,8–9 hours,$138.67,per adult,Free cancellation,By WABAR TOURS,Muscat,Oman,https://www.tripadvisor.com/Attraction_Review-g1940497-d15262754-Reviews-WABAR_TOURS-Muscat_Muscat_Governorate.html
18,Muscat city tour (price per vehicle),Private and Luxury,6 hours,$249.71,per group,Free cancellation,By Muscat Advanced Tourism,Muscat,Oman,https://www.tripadvisor.com/Attraction_Review-g1940497-d16868236-Reviews-Muscat_Advanced_Tourism-Muscat_Muscat_Governorate.html
19,Desert experience - Private Wahiba sands full day tour,Full-day Tours,8–10 hours,$199.00,per adult,Free cancellation,By GidOman,Muscat,Oman,https://www.tripadvisor.com/Attraction_Review-g1940497-d17398989-Reviews-GidOman-Muscat_Muscat_Governorate.html
20,Full-Day Private Guided Tour in Muscat with Pickup,Bus Tours,5–6 hours,$90.00,per adult,Free cancellation,By Tours with local touch,Muscat,Oman,https://www.tripadvisor.com/Attraction_Review-g1940497-d23787917-Reviews-Tours_with_local_touch-Muscat_Muscat_Governorate.html
21,Wahiba Sands Tour with Wadi Bani Khalid tour (price per vehicle),Full-day Tours,6+ hours,$388.38,per group,Free cancellation,By Muscat Advanced Tourism,Muscat,Oman,https://www.tripadvisor.com/Attraction_Review-g1940497-d16868236-Reviews-Muscat_Advanced_Tourism-Muscat_Muscat_Governorate.html
22,Wadishab and Bhima Sink Hole (Sharing Tours,Full-day Tours,8–9 hours,$138.67,per adult,Free cancellation,By WABAR TOURS,Muscat,Oman,https://www.tripadvisor.com/Attraction_Review-g1940497-d15262754-Reviews-WABAR_TOURS-Muscat_Muscat_Governorate.html
23,Experience Local Food at a Host Home,,2–3 hours,$82.00,per adult,Free cancellation,By BAHWAN TOURISM LLC,Muscat,Oman,https://www.tripadvisor.com/Attraction_Review-g1940497-d18845610-Reviews-BAHWAN_TOURISM_LLC-Muscat_Muscat_Governorate.html
24,Sunset & Night Kayak,,2 hours,$25.00,per adult,Free cancellation,By WikiTours Adventures,Muscat,Oman,https://www.tripadvisor.com/Attraction_Review-g1940497-d23825886-Reviews-WikiTours_Adventures-Muscat_Muscat_Governorate.html
25,Muscat Half Day City Tour,Bus Tours,4 hours,$30.00,per adult,Free cancellation,By Gray Line Oman,Muscat,Oman,https://www.tripadvisor.com/Attraction_Review-g1940497-d2272986-Reviews-Gray_Line_Oman-Muscat_Muscat_Governorate.html
26,Snorkeling and Dolphin Sightseeing Group Experience,Ports of Call Tours,3 hours,$45.00,per adult,Free cancellation,By Anchored ships,Muscat,Oman,https://www.tripadvisor.com/Attraction_Review-g1940497-d15080501-Reviews-Anchored_ships-Muscat_Muscat_Governorate.html
27,Nizwa Full Day Tour from Muscat,Bus Tours,6+ hours,$90.00,per adult,Free cancellation,By Gray Line Oman,Muscat,Oman,https://www.tripadvisor.com/Attraction_Review-g1940497-d2272986-Reviews-Gray_Line_Oman-Muscat_Muscat_Governorate.html
28,Authentic Omani Home Dining,Ports of Call Tours,3 hours,$75.00,per adult,Free cancellation,By Zayr for Food Experiences,Muscat,Oman,https://www.tripadvisor.com/Attraction_Review-g1940497-d15696880-Reviews-Zayr_for_Food_Experiences-Muscat_Muscat_Governorate.html
29,Snorkeling At Daymaniyat Islands Nature Reserve,Shore Excursions,6 hours,$150.00,per adult,Free cancellation,By Qantab Tourism,Muscat,Oman,https://www.tripadvisor.com/Attraction_Review-g1940497-d12356088-Reviews-Qantab_Tourism-Muscat_Muscat_Governorate.html
30,Nizwa and Jebal Shams Grand canyon,Full-day Tours,7–9 hours,$208.00,per adult,Free cancellation,By Tours Oman Private Day tours,Muscat,Oman,https://www.tripadvisor.com/Attraction_Review-g1940497-d12292716-Reviews-Tours_Oman_Private_Day_tours-Muscat_Muscat_Governorate.html
31,,2,,,,,,Muscat,Oman,
32,,Which experiences are best for tours in Muscat?,What are the best places for tours in Muscat?,Which places provide the best tours in Muscat for groups?,,Which places provide the best tours in Muscat for kids and families?,,Muscat,Oman,
33,,1,3,,,,,Muscat,Oman,
34,,,,,,,Clear all filters,Muscat,Oman,
35,Full-Day Grand Canyon and Nizwa Tour by 4x4,Adventure Tours,6+ hours,$233.00,per adult,Free cancellation,By Gray Line Oman,Muscat,Oman,https://www.tripadvisor.com/Attraction_Review-g1940497-d2272986-Reviews-Gray_Line_Oman-Muscat_Muscat_Governorate.html
36,Wahiba Sands and Wadi Bani Khalid Desert Safari,Shore Excursions,7–9 hours,$200.00,per adult,Free cancellation,By Oman Day Tours,Muscat,Oman,https://www.tripadvisor.com/Attraction_Review-g1940497-d4481238-Reviews-Oman_Day_Tours-Muscat_Muscat_Governorate.html
37,Nizwa and Jabal Shams,Full-day Tours,6+ hours,$430.00,per group,Free cancellation,By Muscat Nature Tours - Day Tours,Muscat,Oman,https://www.tripadvisor.com/Attraction_Review-g1940497-d8783146-Reviews-Muscat_Nature_Tours_Day_Tours-Muscat_Muscat_Governorate.html
38,Wadi Shab full day tour,Bus Tours,7–8 hours,$200.00,per adult,Free cancellation,By Oman Day Tours,Muscat,Oman,https://www.tripadvisor.com/Attraction_Review-g1940497-d4481238-Reviews-Oman_Day_Tours-Muscat_Muscat_Governorate.html
39,Wahiba Sands Desert Safari 4X4,Adventure Tours,6+ hours,$214.00,per adult,Free cancellation,By Vacation Packages Oman,Muscat,Oman,https://www.tripadvisor.com/Attraction_Review-g1940497-d8312979-Reviews-Vacation_Packages_Oman-Muscat_Muscat_Governorate.html
40,Muscat City Tour -Half-Day- Mystic Muscat,Bus Tours,4–5 hours,$100.00,per adult,Free cancellation,By Oman Day Tours,Muscat,Oman,https://www.tripadvisor.com/Attraction_Review-g1940497-d4481238-Reviews-Oman_Day_Tours-Muscat_Muscat_Governorate.html
41,Private Tour: The Grand Canyon of Oman and Jebel Shams Day Trip,Full-day Tours,6+ hours,$556.00,per group,Free cancellation,By Mark Tours - Oman Tours,Muscat,Oman,https://www.tripadvisor.com/Attraction_Review-g298418-d5075460-Reviews-Mark_Tours_Oman_Tours-Ruwi_Muscat_Governorate.html
42,Muscat City and Wadi Shab Private Full Day Tour,Full-day Tours,8–12 hours,$246.16,per adult,Free cancellation,By GidOman,Muscat,Oman,https://www.tripadvisor.com/Attraction_Review-g1940497-d17398989-Reviews-GidOman-Muscat_Muscat_Governorate.html
43,Jebal Akhdar And Nizwa Cool And Green,Full-day Tours,7–9 hours,$208.00,per adult,Free cancellation,By Tours Oman Private Day tours,Muscat,Oman,https://www.tripadvisor.com/Attraction_Review-g1940497-d12292716-Reviews-Tours_Oman_Private_Day_tours-Muscat_Muscat_Governorate.html
44,Private Safari Wahiba Sands and Wadi Bani Khalid from Muscat,City Tours,7–9 hours,$200.00,per adult,Free cancellation,By Oman Day Tours,Muscat,Oman,https://www.tripadvisor.com/Attraction_Review-g1940497-d4481238-Reviews-Oman_Day_Tours-Muscat_Muscat_Governorate.html
45,Jebel Shams Day Trip: The Grand Canyon of Oman,Full-day Tours,7–9 hours,$200.00,per adult,Free cancellation,By Oman Day Tours,Muscat,Oman,https://www.tripadvisor.com/Attraction_Review-g1940497-d4481238-Reviews-Oman_Day_Tours-Muscat_Muscat_Governorate.html
46,Dolphin Watching and Snorkeling Tour from Muscat,Private and Luxury,3–4 hours,$94.00,per adult,Free cancellation,By Oman Day Tours,Muscat,Oman,https://www.tripadvisor.com/Attraction_Review-g1940497-d4481238-Reviews-Oman_Day_Tours-Muscat_Muscat_Governorate.html
47,4 Days Package TOUR FARAH,Private and Luxury,3+ days,"$1,200.00",per adult,Free cancellation,By Oman Day Tours,Muscat,Oman,https://www.tripadvisor.com/Attraction_Review-g1940497-d4481238-Reviews-Oman_Day_Tours-Muscat_Muscat_Governorate.html
48,Wadi Shab Coastal Trekking,Adventure Tours,6–8 hours,$208.00,per adult,Free cancellation,By Tours Oman Private Day tours,Muscat,Oman,https://www.tripadvisor.com/Attraction_Review-g1940497-d12292716-Reviews-Tours_Oman_Private_Day_tours-Muscat_Muscat_Governorate.html
49,Dimaniyat Island from Muscat,Lunch Cruises,5–6 minutes,$154.00,per adult,Free cancellation,By Oman Day Tours,Muscat,Oman,https://www.tripadvisor.com/Attraction_Review-g1940497-d4481238-Reviews-Oman_Day_Tours-Muscat_Muscat_Governorate.html
50,Dolphin Watching & Snorkeling,,3 hours,$86.16,per adult,Free cancellation,By Qantab Tourism,Muscat,Oman,https://www.tripadvisor.com/Attraction_Review-g1940497-d12356088-Reviews-Qantab_Tourism-Muscat_Muscat_Governorate.html
51,Nizwa Full Day tour,Bus Tours,7–9 minutes,$200.00,per adult,Free cancellation,By Oman Day Tours,Muscat,Oman,https://www.tripadvisor.com/Attraction_Review-g1940497-d4481238-Reviews-Oman_Day_Tours-Muscat_Muscat_Governorate.html
52,Day Trip To Wadi Shab & Bimmah Sinkhole,Full-day Tours,8–9 hours,$220.00,per adult,Free cancellation,By Discover Mazoon Tours Oman,Muscat,Oman,https://www.tripadvisor.com/Attraction_Review-g1940497-d15840326-Reviews-Discover_Mazoon_Tours_Oman-Muscat_Muscat_Governorate.html
53,Wadi Hiking & canyoning,,10–14 hours,$198.72,per adult,Free cancellation,By Extreme Tours Oman,Muscat,Oman,https://www.tripadvisor.com/Attraction_Review-g1940497-d15344641-Reviews-Extreme_Tours_Oman-Muscat_Muscat_Governorate.html
54,Tour Fatimah 2 Days Package,Adventure Tours,2 days,$608.00,per adult,Free cancellation,By Discover Mazoon Tours Oman,Muscat,Oman,https://www.tripadvisor.com/Attraction_Review-g1940497-d15840326-Reviews-Discover_Mazoon_Tours_Oman-Muscat_Muscat_Governorate.html
55,Wadi Shab full day tour (Muscat tours) : Private & custom tours,Bus Tours,7–8 hours,$200.00,per adult,Free cancellation,By Oman Day Tours,Muscat,Oman,https://www.tripadvisor.com/Attraction_Review-g1940497-d4481238-Reviews-Oman_Day_Tours-Muscat_Muscat_Governorate.html
56,Nizwa and Grand Canyon Private Full Day,Full-day Tours,6+ hours,$240.00,per adult,Free cancellation,By GidOman,Muscat,Oman,https://www.tripadvisor.com/Attraction_Review-g1940497-d17398989-Reviews-GidOman-Muscat_Muscat_Governorate.html
57,Muscat City Tour Half day,Bus Tours,3–5 hours,$112.00,per adult,Free cancellation,By Tours Oman Private Day tours,Muscat,Oman,https://www.tripadvisor.com/Attraction_Review-g1940497-d12292716-Reviews-Tours_Oman_Private_Day_tours-Muscat_Muscat_Governorate.html
58,Big Bus Muscat Hop-On Hop-Off Tour,Bus Tours,1–2 hours,$73.80,per adult,Free cancellation,By Big Bus Tours Muscat,Muscat,Oman,https://www.tripadvisor.com/Attraction_Review-g1940497-d3735608-Reviews-Big_Bus_Tours_Muscat-Muscat_Muscat_Governorate.html
59,Wahiba Sands and Sur Full Day Private Tour from Muscat,Full-day Tours,6+ hours,$233.00,per adult,Free cancellation,By Gray Line Oman,Muscat,Oman,https://www.tripadvisor.com/Attraction_Review-g1940497-d2272986-Reviews-Gray_Line_Oman-Muscat_Muscat_Governorate.html
60,Jabl Shams with Nizwa for tours and sightseeing,Full-day Tours,7–9 hours,$200.00,per adult,Free cancellation,By Oman Day Tours,Muscat,Oman,https://www.tripadvisor.com/Attraction_Review-g1940497-d4481238-Reviews-Oman_Day_Tours-Muscat_Muscat_Governorate.html
61,Jebel al Akhdar - Rose Garden/Balad Sayt Village/Diana's Point,Full-day Tours,10–12 hours,$724.07,per group,Free cancellation,By Golden Highlands,Muscat,Oman,https://www.tripadvisor.com/Attraction_Review-g1940497-d15663135-Reviews-Golden_Highlands-Muscat_Muscat_Governorate.html
62,Desert Safari to Wahiba Sands and Wadi Bani Khalid from Muscat,Full-day Tours,6+ hours,$556.00,per group,Free cancellation,By Mark Tours - Oman Tours,Muscat,Oman,https://www.tripadvisor.com/Attraction_Review-g298418-d5075460-Reviews-Mark_Tours_Oman_Tours-Ruwi_Muscat_Governorate.html
63,Wadi Shab and Bimmah Sinkhole 4X4,Full-day Tours,6+ hours,$214.00,per adult,Free cancellation,By Vacation Packages Oman,Muscat,Oman,https://www.tripadvisor.com/Attraction_Review-g1940497-d8312979-Reviews-Vacation_Packages_Oman-Muscat_Muscat_Governorate.html
64,Jebel Shams Day trip (Muscat tours) :Oman Shore excursions,Full-day Tours,7–9 hours,$200.00,per adult,Free cancellation,By Oman Day Tours,Muscat,Oman,https://www.tripadvisor.com/Attraction_Review-g1940497-d4481238-Reviews-Oman_Day_Tours-Muscat_Muscat_Governorate.html
65,,1,2,,,4,,Muscat,Oman,
66,,,,,,,Clear all filters,Muscat,Oman,
67,"36' Private Boat Charter for 15 Person in Muscat, Oman",,2 hours,$586.67,per group,Free cancellation,By Qantab Tourism,Muscat,Oman,https://www.tripadvisor.com/Attraction_Review-g1940497-d12356088-Reviews-Qantab_Tourism-Muscat_Muscat_Governorate.html
68,Premium Muscat half day excursion-Italian guide,Bus Tours,3–4 hours,$58.67,per adult,Free cancellation,By OMAN DAY TRIPS,Muscat,Oman,https://www.tripadvisor.com/Attraction_Review-g1940497-d17735893-Reviews-OMAN_DAY_TRIPS-Muscat_Muscat_Governorate.html
69,Coastal And Sunset Tour,Rentals,2 hours,$51.29,per adult,Free cancellation,By Qantab Tourism,Muscat,Oman,https://www.tripadvisor.com/Attraction_Review-g1940497-d12356088-Reviews-Qantab_Tourism-Muscat_Muscat_Governorate.html
70,2 Days and 1 Night Private Wahiba Sands Desert Tour,Adventure Tours,2 days,$503.50,per adult,Free cancellation,By Star Tours Oman,Muscat,Oman,https://www.tripadvisor.com/Attraction_Review-g1940497-d14046842-Reviews-Star_Tours_Oman-Muscat_Muscat_Governorate.html
71,"Mountain, Desert & Coastal Tour (03 Days / 02 Nights)",Adventure Tours,3 days,"$1,240.00",per adult,Free cancellation,By Desert Flower Tours,Muscat,Oman,https://www.tripadvisor.com/Attraction_Review-g1940497-d15243662-Reviews-Desert_Flower_Tours-Muscat_Muscat_Governorate.html
72,Muscat City Tours Full Day,Full-day Tours,8–9 hours,$426.67,per group,Free cancellation,By WABAR TOURS,Muscat,Oman,https://www.tripadvisor.com/Attraction_Review-g1940497-d15262754-Reviews-WABAR_TOURS-Muscat_Muscat_Governorate.html
73,Game Fishing in Muscat,Adventure Tours,4–8 hours,$565.34,per adult,Free cancellation,By Qantab Tourism,Muscat,Oman,https://www.tripadvisor.com/Attraction_Review-g1940497-d12356088-Reviews-Qantab_Tourism-Muscat_Muscat_Governorate.html
74,Full Day Private Muscat City Tour,Shore Excursions,6+ hours,$174.00,per adult,Free cancellation,By Sunshine Tours Oman,Muscat,Oman,https://www.tripadvisor.com/Attraction_Review-g1940497-d8617192-Reviews-Sunshine_Tours_Oman-Muscat_Muscat_Governorate.html
75,Snake Canyon 2.0,Walking Tours,6+ hours,$158.00,per adult,Free cancellation,By Twenty3 Extreme,Muscat,Oman,https://www.tripadvisor.com/Attraction_Review-g1940497-d10887876-Reviews-Twenty3_Extreme-Muscat_Muscat_Governorate.html
76,Wadi shab and Sinkhole adventure,Day Trips,6 hours,$169.70,per group,Free cancellation,By Round In Oman,Muscat,Oman,https://www.tripadvisor.com/Attraction_Review-g1940497-d19876356-Reviews-Round_In_Oman-Muscat_Muscat_Governorate.html
77,Muscat City Tour frensh or Italien Guide,Ports of Call Tours,4 hours,$225.14,per group,Free cancellation,By Round In Oman,Muscat,Oman,https://www.tripadvisor.com/Attraction_Review-g1940497-d19876356-Reviews-Round_In_Oman-Muscat_Muscat_Governorate.html
78,Camping & Snorkelling at Daymaniyat Islands,,2 days,$280.00,per adult,Free cancellation,By Qantab Tourism,Muscat,Oman,https://www.tripadvisor.com/Attraction_Review-g1940497-d12356088-Reviews-Qantab_Tourism-Muscat_Muscat_Governorate.html
79,Off-road driving and swimming at the wild Wadi Arbeen,Ports of Call Tours,6+ hours,$400.00,per group,Free cancellation,By Lifetime Tours - Day Tours,Muscat,Oman,https://www.tripadvisor.com/Attraction_Review-g1940497-d6436760-Reviews-Lifetime_Tours_Day_Tours-Muscat_Muscat_Governorate.html
80,Private Full Day Muscat City Tour,Adventure Tours,7–8 hours,$150.00,per adult,Free cancellation,By Star Tours Oman,Muscat,Oman,https://www.tripadvisor.com/Attraction_Review-g1940497-d14046842-Reviews-Star_Tours_Oman-Muscat_Muscat_Governorate.html
81,Transfer to and from the airport,,30 minutes,$40.00,per group,Free cancellation,By Taxi Oman Tours,Muscat,Oman,https://www.tripadvisor.com/Attraction_Review-g1940497-d18844559-Reviews-Taxi_Oman_Tours-Muscat_Muscat_Governorate.html
82,Highlights of ancient Oman (6 days /5 nights),City Tours,3+ days,$744.54,per group,Free cancellation,By Oman Safari Tours,Muscat,Oman,https://www.tripadvisor.com/Attraction_Review-g1940497-d18848409-Reviews-Oman_Safari_Tours-Muscat_Muscat_Governorate.html
83,Nizwa Friday Market Jabal Chams,Full-day Tours,6+ hours,$282.84,per group,Free cancellation,By Round In Oman,Muscat,Oman,https://www.tripadvisor.com/Attraction_Review-g1940497-d19876356-Reviews-Round_In_Oman-Muscat_Muscat_Governorate.html
84,Full Day Wadi Bani Awf-Bilad Sayt Private Tour,Adventure Tours,7–8 hours,$190.90,per adult,Free cancellation,By Star Tours Oman,Muscat,Oman,https://www.tripadvisor.com/Attraction_Review-g1940497-d14046842-Reviews-Star_Tours_Oman-Muscat_Muscat_Governorate.html
85,Muscat City Tour Half Day,Ports of Call Tours,4 hours,$104.00,per adult,Free cancellation,By Vacation Packages Oman,Muscat,Oman,https://www.tripadvisor.com/Attraction_Review-g1940497-d8312979-Reviews-Vacation_Packages_Oman-Muscat_Muscat_Governorate.html
86,3 Day Package TOUR JASMIN,Private and Luxury,3 days,$980.00,per adult,Free cancellation,By Oman Day Tours,Muscat,Oman,https://www.tripadvisor.com/Attraction_Review-g1940497-d4481238-Reviews-Oman_Day_Tours-Muscat_Muscat_Governorate.html
87,"Muscat Full Day Tour,",Bus Tours,6–7 hours,$80.00,per adult,Free cancellation,By OMAN DAY TRIPS,Muscat,Oman,https://www.tripadvisor.com/Attraction_Review-g1940497-d17735893-Reviews-OMAN_DAY_TRIPS-Muscat_Muscat_Governorate.html
88,Billad Sayt (Day trip) 4WD :Muscat Tours,Private and Luxury,6–8 hours,$200.00,per adult,Free cancellation,By Oman Day Tours,Muscat,Oman,https://www.tripadvisor.com/Attraction_Review-g1940497-d4481238-Reviews-Oman_Day_Tours-Muscat_Muscat_Governorate.html
89,Wadi Shab Adventure,Ports of Call Tours,6+ hours,$461.54,per group,Free cancellation,By VS Private Tours,Muscat,Oman,https://www.tripadvisor.com/Attraction_Review-g1940497-d6651163-Reviews-VS_Private_Tours-Muscat_Muscat_Governorate.html
90,Private-Muscat City tour (Half Day),Bus Tours,4 hours,$156.80,per group,Free cancellation,By OMAN DAY TRIPS,Muscat,Oman,https://www.tripadvisor.com/Attraction_Review-g1940497-d17735893-Reviews-OMAN_DAY_TRIPS-Muscat_Muscat_Governorate.html
91,Private Tour to Jabal Shams Grand Canyon Balcony Walk,Bus Tours,12–13 hours,$124.45,per adult,Free cancellation,By Radka Slavikova,Muscat,Oman,https://www.tripadvisor.com/Attraction_Review-g1940497-d22977059-Reviews-Radka_Slavikova-Muscat_Muscat_Governorate.html
92,Private Full-Day Wadi Shab and Bimmah Sinkhole Tour,Adventure Tours,7–8 hours,$156.20,per adult,Free cancellation,By Star Tours Oman,Muscat,Oman,https://www.tripadvisor.com/Attraction_Review-g1940497-d14046842-Reviews-Star_Tours_Oman-Muscat_Muscat_Governorate.html
93,Diserto and Wadi bani khaled with an ITA / FRA guide,Full-day Tours,6+ hours,$316.78,per group,Free cancellation,By Round In Oman,Muscat,Oman,https://www.tripadvisor.com/Attraction_Review-g1940497-d19876356-Reviews-Round_In_Oman-Muscat_Muscat_Governorate.html
94,Tour Shahad 4 Days Package,Private and Luxury,3+ days,"$1,246.67",per adult,Free cancellation,By Discover Mazoon Tours Oman,Muscat,Oman,https://www.tripadvisor.com/Attraction_Review-g1940497-d15840326-Reviews-Discover_Mazoon_Tours_Oman-Muscat_Muscat_Governorate.html
95,Jebel Akhdar - Cool and Green,Full-day Tours,7–9 hours,$205.00,per adult,Free cancellation,By Oman Day Tours,Muscat,Oman,https://www.tripadvisor.com/Attraction_Review-g1940497-d4481238-Reviews-Oman_Day_Tours-Muscat_Muscat_Governorate.html
96,Sunset in Al Wahiba Sands. (Tramonto Al diserto),Ports of Call Tours,8–10 minutes,$339.41,per group,Free cancellation,By Round In Oman,Muscat,Oman,https://www.tripadvisor.com/Attraction_Review-g1940497-d19876356-Reviews-Round_In_Oman-Muscat_Muscat_Governorate.html
97,,1,3,,,5,,Muscat,Oman,
98,"36' Private Boat Charter for 15 Person in Muscat, Oman",,2 hours,$586.67,per group,Free cancellation,By Qantab Tourism,Muscat,Oman,https://www.tripadvisor.com/Attraction_Review-g1940497-d12356088-Reviews-Qantab_Tourism-Muscat_Muscat_Governorate.html
99,Premium Muscat half day excursion-Italian guide,Bus Tours,3–4 hours,$58.67,per adult,Free cancellation,By OMAN DAY TRIPS,Muscat,Oman,https://www.tripadvisor.com/Attraction_Review-g1940497-d17735893-Reviews-OMAN_DAY_TRIPS-Muscat_Muscat_Governorate.html
100,Coastal And Sunset Tour,Rentals,2 hours,$51.29,per adult,Free cancellation,By Qantab Tourism,Muscat,Oman,https://www.tripadvisor.com/Attraction_Review-g1940497-d12356088-Reviews-Qantab_Tourism-Muscat_Muscat_Governorate.html
101,2 Days and 1 Night Private Wahiba Sands Desert Tour,Adventure Tours,2 days,$503.50,per adult,Free cancellation,By Star Tours Oman,Muscat,Oman,https://www.tripadvisor.com/Attraction_Review-g1940497-d14046842-Reviews-Star_Tours_Oman-Muscat_Muscat_Governorate.html
102,"Mountain, Desert & Coastal Tour (03 Days / 02 Nights)",Adventure Tours,3 days,"$1,240.00",per adult,Free cancellation,By Desert Flower Tours,Muscat,Oman,https://www.tripadvisor.com/Attraction_Review-g1940497-d15243662-Reviews-Desert_Flower_Tours-Muscat_Muscat_Governorate.html
103,,1,4,,,6,,Muscat,Oman,
104,,,,,,,Clear all filters,Muscat,Oman,
105,Private Muscat Layover with Pickup and Guide,Bus Tours,2–3 hours,$105.52,per group,Free cancellation,By AskMaya,Muscat,Oman,https://www.tripadvisor.com/Attraction_Review-g1940497-d19969922-Reviews-AskMaya-Muscat_Muscat_Governorate.html
106,"Muscat Tours at Bimmah Sink hole, Wadi Al Arbeieen, and Fins Beach",Adventure Tours,6+ hours,$166.00,per adult,Free cancellation,By Sunshine Tours Oman,Muscat,Oman,https://www.tripadvisor.com/Attraction_Review-g1940497-d8617192-Reviews-Sunshine_Tours_Oman-Muscat_Muscat_Governorate.html
