,Tour Name,Tour Type,Tour Duration,Tour Price,Price Per,Cancellation,Tour By,City,Country,Link
0,,,,,,,Clear all filters,Toronto,Canada,
1,Niagara Falls Day Tour from Toronto,Bus Tours,9–10 hours,$76.40,per adult,Free cancellation,By Niagara Day Tour,Toronto,Canada,https://www.tripadvisor.com/Attraction_Review-g155019-d2723287-Reviews-Niagara_Day_Tour-Toronto_Ontario.html
2,Niagara Falls Day and Evening Tour With Boat Cruise,Bus Tours,9–10 hours,$152.16,per adult,Free cancellation,By Zoom Tours Niagara Falls,Toronto,Canada,https://www.tripadvisor.com/Attraction_Review-g155019-d1627398-Reviews-Zoom_Tours_Niagara_Falls-Toronto_Ontario.html
3,Luxury Day Tour of Niagara Falls & Niagara Cruise from Toronto,Full-day Tours,6+ hours,$152.16,per adult,Free cancellation,By Airlink Niagara Falls Tours,Toronto,Canada,https://www.tripadvisor.com/Attraction_Review-g155019-d1891074-Reviews-Airlink_Niagara_Falls_Tours-Toronto_Ontario.html
4,Niagara Falls Small-Group Day Tour from Toronto with Experienced Guide,Bus Tours,6+ hours,$82.05,per adult,Free cancellation,By Queen Tour Niagara Falls Tours,Toronto,Canada,https://www.tripadvisor.com/Attraction_Review-g155019-d3435181-Reviews-Queen_Tour_Niagara_Falls_Tours-Toronto_Ontario.html
5,Best of Toronto Morning Tour,Bus Tours,4 hours,$173.10,per adult,Free cancellation,By See Sight Tours,Toronto,Canada,https://www.tripadvisor.com/Attraction_Review-g155019-d10717673-Reviews-See_Sight_Tours-Toronto_Ontario.html
6,Kensington Market -Toronto's Neighborhood International Food Tour,Walking Tours,2–3 hours,$78.09,per adult,Free cancellation,By Chopsticks+Forks,Toronto,Canada,https://www.tripadvisor.com/Attraction_Review-g155019-d12034909-Reviews-Chopsticks_Forks-Toronto_Ontario.html
7,Niagara Falls Platinum Tour from Toronto with Cruise and Lunch,Lunch Cruises,6+ hours,$119.96,per adult,Free cancellation,By TBCL - Toronto Bus Co. Ltd.,Toronto,Canada,https://www.tripadvisor.com/Attraction_Review-g155019-d2518919-Reviews-TBCL_Toronto_Bus_Co_Ltd-Toronto_Ontario.html
8,Toronto Aerial Tour with Niagara Falls Winery Tasting Tour with iflyTOTO,Adventure Tours,5 hours,$205.30,per adult,Free cancellation,By iflyTOTO,Toronto,Canada,https://www.tripadvisor.com/Attraction_Review-g181720-d15220521-Reviews-IflyTOTO-Markham_Ontario.html
9,Best of Niagara Falls Tour from Toronto,Bus Tours,6+ hours,$241.53,per adult,Free cancellation,By See Sight Tours,Toronto,Canada,https://www.tripadvisor.com/Attraction_Review-g155019-d10717673-Reviews-See_Sight_Tours-Toronto_Ontario.html
10,Exhilarating 120km Aerial Tour of Toronto with iflyTOTO,Private and Luxury,24 minutes,$79.70,per adult,Free cancellation,By iflyTOTO,Toronto,Canada,https://www.tripadvisor.com/Attraction_Review-g181720-d15220521-Reviews-IflyTOTO-Markham_Ontario.html
11,All-Inclusive Niagara Falls Day Tour Maple Syrup and Wine Tasting from Toronto,Full-day Tours,6+ hours,$200.47,per adult,Free cancellation,By Airlink Niagara Falls Tours,Toronto,Canada,https://www.tripadvisor.com/Attraction_Review-g155019-d1891074-Reviews-Airlink_Niagara_Falls_Tours-Toronto_Ontario.html
12,"Niagara Falls Tour from Toronto with Boat, Journey Behind the Falls and Lunch",Adventure Tours,9–10 hours,$240.72,per adult,Free cancellation,By Zoom Tours Niagara Falls,Toronto,Canada,https://www.tripadvisor.com/Attraction_Review-g155019-d1627398-Reviews-Zoom_Tours_Niagara_Falls-Toronto_Ontario.html
13,One hour Aerial Tour of Toronto and Niagara Falls with iflyTOTO,Adventure Tours,57 minutes,$205.30,per adult,Free cancellation,By iflyTOTO,Toronto,Canada,https://www.tripadvisor.com/Attraction_Review-g181720-d15220521-Reviews-IflyTOTO-Markham_Ontario.html
14,Exclusive Private Tour to Niagara Falls from Toronto,Bus Tours,6+ hours,$723.78,per group,Free cancellation,By VIP Ontario Tours,Toronto,Canada,https://www.tripadvisor.com/Attraction_Review-g155019-d12240293-Reviews-VIP_Ontario_Tours-Toronto_Ontario.html
15,14-Minute Helicopter Tour Over Toronto,Helicopter Tours,14 minutes,$189.20,per adult,Free cancellation,By Toronto Heli Tours,Toronto,Canada,https://www.tripadvisor.com/Attraction_Review-g155019-d6733082-Reviews-Toronto_Heli_Tours-Toronto_Ontario.html
16,Royal Ontario Museum Ticket,Attractions & Museums,3–4 hours,$18.52,per adult,Free cancellation,By Royal Ontario Museum,Toronto,Canada,https://www.tripadvisor.com/Attraction_Review-g155019-d155481-Reviews-Royal_Ontario_Museum-Toronto_Ontario.html
17,Private Niagara Falls Full-Day Tour from Toronto,Bus Tours,4–7 hours,$723.78,per group,Free cancellation,By VIP Ontario Tours,Toronto,Canada,https://www.tripadvisor.com/Attraction_Review-g155019-d12240293-Reviews-VIP_Ontario_Tours-Toronto_Ontario.html
18,Full-Day Niagara Winery Tour from Toronto,Bus Tours,6+ hours,$103.86,per adult,Free cancellation,By Niagara Day Tour,Toronto,Canada,https://www.tripadvisor.com/Attraction_Review-g155019-d2723287-Reviews-Niagara_Day_Tour-Toronto_Ontario.html
19,Niagara Falls One Day Sightseeing Tour from Toronto,Full-day Tours,6+ hours,$123.98,per adult,Free cancellation,By Niagara & Toronto Tours,Toronto,Canada,https://www.tripadvisor.com/Attraction_Review-g155019-d1541586-Reviews-Niagara_Toronto_Tours-Toronto_Ontario.html
20,Day-Trip from Toronto to Niagara Falls with Falls Boat Ride,Bus Tours,6+ hours,$124.79,per adult,Free cancellation,By VIP Ontario Tours,Toronto,Canada,https://www.tripadvisor.com/Attraction_Review-g155019-d12240293-Reviews-VIP_Ontario_Tours-Toronto_Ontario.html
21,Niagara Falls Luxury Bus Day Tour From Toronto With Hornblower Boat Cruise,Bus Tours,6+ hours,$144.11,per adult,Free cancellation,By Airlink Niagara Falls Tours,Toronto,Canada,https://www.tripadvisor.com/Attraction_Review-g155019-d1891074-Reviews-Airlink_Niagara_Falls_Tours-Toronto_Ontario.html
22,Private Niagara Falls Tour in a SUV,Full-day Tours,6+ hours,$590.94,per group,Free cancellation,By King Tours,Toronto,Canada,https://www.tripadvisor.com/Attraction_Review-g154998-d1148888-Reviews-King_Tours-Niagara_Falls_Ontario.html
23,Guided Day Trip to Canadian Side of Niagara Falls from Toronto,Bus Tours,6+ hours,$103.86,per adult,Free cancellation,By Zoom Tours Niagara Falls,Toronto,Canada,https://www.tripadvisor.com/Attraction_Review-g155019-d1627398-Reviews-Zoom_Tours_Niagara_Falls-Toronto_Ontario.html
24,Niagara Falls Sightseeing Day Tour from Toronto,Bus Tours,6+ hours,$108.69,per adult,Free cancellation,By Zoom Tours Niagara Falls,Toronto,Canada,https://www.tripadvisor.com/Attraction_Review-g155019-d1627398-Reviews-Zoom_Tours_Niagara_Falls-Toronto_Ontario.html
25,7-Minute Helicopter Tour over Toronto,Helicopter Tours,7 minutes,$112.71,per adult,Free cancellation,By Toronto Heli Tours,Toronto,Canada,https://www.tripadvisor.com/Attraction_Review-g155019-d6733082-Reviews-Toronto_Heli_Tours-Toronto_Ontario.html
26,"Show Me The City, Toronto Walking Tour",City Tours,3 hours,$36.23,per adult,Free cancellation,By Buzz Tours,Toronto,Canada,https://www.tripadvisor.com/Attraction_Review-g155019-d12289740-Reviews-Buzz_Tours-Toronto_Ontario.html
27,Small-Group Toronto Beer Tour,City Tours,4 hours,$64.41,per adult,Free cancellation,By Intrepid Urban Adventures - Toronto,Toronto,Canada,https://www.tripadvisor.com/Attraction_Review-g155019-d23587913-Reviews-Intrepid_Urban_Adventures_Toronto-Toronto_Ontario.html
28,Private Niagara Falls Tours with Wine tasting,Bus Tours,6+ hours,$617.38,per group,Free cancellation,By Airlink Niagara Falls Tours,Toronto,Canada,https://www.tripadvisor.com/Attraction_Review-g155019-d1891074-Reviews-Airlink_Niagara_Falls_Tours-Toronto_Ontario.html
29,Dog Sledding and Snowshoeing Tour from Toronto,,6+ hours,$369.54,per adult,,By Travelling Chicken,Toronto,Canada,https://www.tripadvisor.com/Attraction_Review-g155019-d11918297-Reviews-Travelling_Chicken-Toronto_Ontario.html
30,Full-Day Niagara Falls Tour from Toronto,Full-day Tours,6+ hours,$90.98,per adult,Free cancellation,By King Tours,Toronto,Canada,https://www.tripadvisor.com/Attraction_Review-g154998-d1148888-Reviews-King_Tours-Niagara_Falls_Ontario.html
31,,2,,,,,,Toronto,Canada,
32,,Which experiences are best for tours in Toronto?,What are the best places for tours in Toronto?,Which places provide the best tours in Toronto for groups?,,Which places provide the best tours in Toronto for kids and families?,,Toronto,Canada,
33,,1,3,,,,,Toronto,Canada,
34,,,,,,,Clear all filters,Toronto,Canada,
35,Queen Street West: An audio tour exploring Toronto's coolest street,Walking Tours,45–60 minutes,$5.20,per adult,,By VoiceMap Toronto,Toronto,Canada,https://www.tripadvisor.com/Attraction_Review-g155019-d21087151-Reviews-VoiceMap_Toronto-Toronto_Ontario.html
36,From Ravines of Rosedale to the Towers of Yorkville: A Self-Guided Audio Tour,City Tours,1 hour,$5.13,per adult,,By VoiceMap Toronto,Toronto,Canada,https://www.tripadvisor.com/Attraction_Review-g155019-d21087151-Reviews-VoiceMap_Toronto-Toronto_Ontario.html
37,Luxury Niagara Falls Day Trip from Toronto with Cruise and Lunch,Bus Tours,9–10 hours,$144.11,per adult,Free cancellation,By Zoom Tours Niagara Falls,Toronto,Canada,https://www.tripadvisor.com/Attraction_Review-g155019-d1627398-Reviews-Zoom_Tours_Niagara_Falls-Toronto_Ontario.html
38,Luxury Small-Group Niagara Falls Day Tour from Toronto with Hornblower Cruise,Bus Tours,9–10 hours,$226.53,per adult,Free cancellation,By TruExperiences Tours,Toronto,Canada,https://www.tripadvisor.com/Attraction_Review-g155019-d8442530-Reviews-TruExperiences_Tours-Toronto_Ontario.html
39,Toronto Dinner Cruise,Coffee Cruises,3 hours,$98.24,per adult,Free cancellation,By City Cruises Toronto,Toronto,Canada,https://www.tripadvisor.com/Attraction_Review-g155019-d1744957-Reviews-City_Cruises_Toronto-Toronto_Ontario.html
40,Downtown Toronto Bike Tour,City Tours,3–4 hours,$72.78,per adult,Free cancellation,By Toronto Bicycle Tours,Toronto,Canada,https://www.tripadvisor.com/Attraction_Review-g155019-d2301516-Reviews-Toronto_Bicycle_Tours-Toronto_Ontario.html
41,Niagara Falls Day Tour from Toronto including Hornblower Boat Tour,Full-day Tours,6+ hours,$92.59,per adult,Free cancellation,By TBCL - Toronto Bus Co. Ltd.,Toronto,Canada,https://www.tripadvisor.com/Attraction_Review-g155019-d2518919-Reviews-TBCL_Toronto_Bus_Co_Ltd-Toronto_Ontario.html
42,Algonquin Provincial Park Day Tour from Toronto,Adventure Tours,6+ hours,$181.15,per adult,,By Travelling Chicken,Toronto,Canada,https://www.tripadvisor.com/Attraction_Review-g155019-d11918297-Reviews-Travelling_Chicken-Toronto_Ontario.html
43,Toronto Islands Morning Bike Tour,Bike Tours,3–4 hours,$79.32,per adult,Free cancellation,By Toronto Bicycle Tours,Toronto,Canada,https://www.tripadvisor.com/Attraction_Review-g155019-d2301516-Reviews-Toronto_Bicycle_Tours-Toronto_Ontario.html
44,Tour to Niagara Falls with Cruise,Full-day Tours,6+ hours,$111.91,per adult,Free cancellation,By Tour To Niagara Falls,Toronto,Canada,https://www.tripadvisor.com/Attraction_Review-g155019-d15815379-Reviews-Tour_To_Niagara_Falls-Toronto_Ontario.html
45,Toronto Islands Evening Bike Tour,City Tours,3–4 hours,$81.88,per adult,Free cancellation,By Toronto Bicycle Tours,Toronto,Canada,https://www.tripadvisor.com/Attraction_Review-g155019-d2301516-Reviews-Toronto_Bicycle_Tours-Toronto_Ontario.html
46,Toronto Food Tour: Taste the World in Kensington Market,Walking Tours,2–3 hours,$71.65,per adult,Free cancellation,By Tasty Tours,Toronto,Canada,https://www.tripadvisor.com/Attraction_Review-g155019-d2486978-Reviews-Tasty_Tours-Toronto_Ontario.html
47,Niagara Wine Region Experience - Luxury Small Group Day Tour,Bus Tours,6+ hours,$131.92,per adult,Free cancellation,By Redback Tours,Toronto,Canada,https://www.tripadvisor.com/Attraction_Review-g154990-d15874699-Reviews-Redback_Tours-Hamilton_Ontario.html
48,Romantic Jewel - Private Helicopter Tour for 2,Helicopter Tours,7 minutes,$138.88,per adult,Free cancellation,By Toronto Heli Tours,Toronto,Canada,https://www.tripadvisor.com/Attraction_Review-g155019-d6733082-Reviews-Toronto_Heli_Tours-Toronto_Ontario.html
49,Small-Group Niagara Falls Day Tour from Toronto with Boat and Lunch Options,Bus Tours,6+ hours,$140.89,per adult,Free cancellation,By Zoom Tours Niagara Falls,Toronto,Canada,https://www.tripadvisor.com/Attraction_Review-g155019-d1627398-Reviews-Zoom_Tours_Niagara_Falls-Toronto_Ontario.html
50,Toronto Brunch Cruise,Coffee Cruises,2 hours,$71.04,per adult,Free cancellation,By City Cruises Toronto,Toronto,Canada,https://www.tripadvisor.com/Attraction_Review-g155019-d1744957-Reviews-City_Cruises_Toronto-Toronto_Ontario.html
51,Toronto Great Canadian Food Tour,Walking Tours,2–3 hours,$73.50,per adult,Free cancellation,By Chopsticks+Forks,Toronto,Canada,https://www.tripadvisor.com/Attraction_Review-g155019-d12034909-Reviews-Chopsticks_Forks-Toronto_Ontario.html
52,Small-Group Walking Tour of Toronto's Kensington Market and Chinatown,City Tours,2 hours,$42.67,per adult,Free cancellation,By Intrepid Urban Adventures - Toronto,Toronto,Canada,https://www.tripadvisor.com/Attraction_Review-g155019-d23587913-Reviews-Intrepid_Urban_Adventures_Toronto-Toronto_Ontario.html
53,Private Tour: Niagara Falls from Toronto with Lunch and Boat,Luxury Car Tours,6–8 hours,$362.29,per adult,Free cancellation,By Airlink Niagara Falls Tours,Toronto,Canada,https://www.tripadvisor.com/Attraction_Review-g155019-d1891074-Reviews-Airlink_Niagara_Falls_Tours-Toronto_Ontario.html
54,Luxury Private Tour of Niagara Falls from Toronto,Bus Tours,5–8 hours,$764.84,per group,Free cancellation,By Zoom Tours Niagara Falls,Toronto,Canada,https://www.tripadvisor.com/Attraction_Review-g155019-d1627398-Reviews-Zoom_Tours_Niagara_Falls-Toronto_Ontario.html
55,Niagara Falls Day Tour With Lights and Fireworks over the Falls,Full-day Tours,6+ hours,$160.21,per adult,Free cancellation,By Airlink Niagara Falls Tours,Toronto,Canada,https://www.tripadvisor.com/Attraction_Review-g155019-d1891074-Reviews-Airlink_Niagara_Falls_Tours-Toronto_Ontario.html
56,Algonquin Group Camping Adventure (2 Day),Adventure Tours,2 days,$261.66,per adult,Free cancellation,By Lake Fever Wilderness Co.,Toronto,Canada,https://www.tripadvisor.com/Attraction_Review-g155019-d17591963-Reviews-Lake_Fever_Wilderness_Co-Toronto_Ontario.html
57,Spirits of the Distillery District Ghost Tour,Night Tours,1–2 hours,$22.74,per adult,Free cancellation,By Haunted Walk of Toronto,Toronto,Canada,https://www.tripadvisor.com/Attraction_Review-g155019-d3203639-Reviews-Haunted_Walk_of_Toronto-Toronto_Ontario.html
58,Bruce Peninsula Day Trip from Toronto,Adventure Tours,6+ hours,$173.10,per adult,Free cancellation,By Travelling Chicken,Toronto,Canada,https://www.tripadvisor.com/Attraction_Review-g155019-d11918297-Reviews-Travelling_Chicken-Toronto_Ontario.html
59,"Best of Toronto Private, In-Car, Food + Sightseeing Tour",Bus Tours,3–5 hours,$269.71,per adult,Free cancellation,By Eating Through T.O.,Toronto,Canada,https://www.tripadvisor.com/Attraction_Review-g155019-d15639587-Reviews-Eating_Through_T_O-Toronto_Ontario.html
60,Scenic Toronto Night Tour,Bus Tours,2–3 hours,$103.86,per adult,Free cancellation,By See Sight Tours,Toronto,Canada,https://www.tripadvisor.com/Attraction_Review-g155019-d10717673-Reviews-See_Sight_Tours-Toronto_Ontario.html
61,Niagara Falls and Niagara on the Lake All Inclusive Luxury Bus Day Tour,Bus Tours,1 day,$165.15,per adult,Free cancellation,By Airlink Niagara Falls Tours,Toronto,Canada,https://www.tripadvisor.com/Attraction_Review-g155019-d1891074-Reviews-Airlink_Niagara_Falls_Tours-Toronto_Ontario.html
62,Ontario Place Segway Glide,Segway Tours,60–75 minutes,$55.55,per adult,Free cancellation,By Go Tours Canada,Toronto,Canada,https://www.tripadvisor.com/Attraction_Review-g155019-d1924753-Reviews-Go_Tours_Canada-Toronto_Ontario.html
63,Small Group Niagara Tour from Toronto with Boat,Full-day Tours,6+ hours,$152.16,per adult,Free cancellation,By Tour To Niagara Falls,Toronto,Canada,https://www.tripadvisor.com/Attraction_Review-g155019-d15815379-Reviews-Tour_To_Niagara_Falls-Toronto_Ontario.html
64,Toronto to Niagara Falls luxuary Tour,Bus Tours,7–9 hours,$377.59,per adult,Free cancellation,By Airlink Niagara Falls Tours,Toronto,Canada,https://www.tripadvisor.com/Attraction_Review-g155019-d1891074-Reviews-Airlink_Niagara_Falls_Tours-Toronto_Ontario.html
65,,1,2,,,4,,Toronto,Canada,
66,,,,,,,Clear all filters,Toronto,Canada,
67,Small-Group Downtown Toronto Walking Tour,Walking Tours,2 hours,$28.90,per adult,Free cancellation,By Top Dog Tours Toronto,Toronto,Canada,https://www.tripadvisor.com/Attraction_Review-g155019-d17747774-Reviews-Top_Dog_Tours_Toronto-Toronto_Ontario.html
68,Niagara Falls Guided 9 Hour Day Trip with Round-trip Transfer,Bus Tours,6+ hours,$111.91,per adult,Free cancellation,By VIP Ontario Tours,Toronto,Canada,https://www.tripadvisor.com/Attraction_Review-g155019-d12240293-Reviews-VIP_Ontario_Tours-Toronto_Ontario.html
69,"Niagara Wine Region Tour (from Toronto), plus Toronto Walking Tour",Bus Tours,6+ hours,$138.15,per adult,Free cancellation,By Vox City Toronto & Niagara,Toronto,Canada,https://www.tripadvisor.com/Attraction_Review-g155019-d23416812-Reviews-Vox_City_Toronto_Niagara-Toronto_Ontario.html
70,Private Downtown Toronto Walking Tour in English,Walking Tours,2 hours,$57.81,per adult,Free cancellation,By Top Dog Tours Toronto,Toronto,Canada,https://www.tripadvisor.com/Attraction_Review-g155019-d17747774-Reviews-Top_Dog_Tours_Toronto-Toronto_Ontario.html
71,Small-Group Niagara Falls Tour,Bus Tours,6+ hours,$160.21,per adult,Free cancellation,By VIP Ontario Tours,Toronto,Canada,https://www.tripadvisor.com/Attraction_Review-g155019-d12240293-Reviews-VIP_Ontario_Tours-Toronto_Ontario.html
72,Private Toronto Guided City Tour,Bus Tours,2–3 hours,$483.06,per group,Free cancellation,By VIP Ontario Tours,Toronto,Canada,https://www.tripadvisor.com/Attraction_Review-g155019-d12240293-Reviews-VIP_Ontario_Tours-Toronto_Ontario.html
73,"Toronto Private Tour with a Local Guide, Tailored to Your Interests ★★★★★",City Tours,3–8 hours,$124.59,per adult,Free cancellation,By City Unscripted Toronto,Toronto,Canada,https://www.tripadvisor.com/Attraction_Review-g155019-d21306817-Reviews-City_Unscripted_Toronto-Toronto_Ontario.html
74,"Guided Bicycle Tour - Toronto Waterfront, Island and Distillery",Bike Tours,3 hours,$80.51,per adult,Free cancellation,By Pedal Toronto,Toronto,Canada,https://www.tripadvisor.com/Attraction_Review-g155019-d14009496-Reviews-Pedal_Toronto-Toronto_Ontario.html
75,Niagara Falls Day and Evening Tour from Toronto With Niagara SkyWheel,Bus Tours,6+ hours,$119.96,per adult,Free cancellation,By Zoom Tours Niagara Falls,Toronto,Canada,https://www.tripadvisor.com/Attraction_Review-g155019-d1627398-Reviews-Zoom_Tours_Niagara_Falls-Toronto_Ontario.html
76,"Explore and Taste The Junction, Toronto’s Hippest Neighbourhood (3 Hours)",Walking Tours,3 hours,$79.70,per adult,Free cancellation,By Toronto Food Adventures,Toronto,Canada,https://www.tripadvisor.com/Attraction_Review-g155019-d20268703-Reviews-Toronto_Food_Adventures-Toronto_Ontario.html
77,"Low Cost - Private Arrival Transfer: Toronto Airport to Niagara Falls, Canada",,2 hours,$242.93,per adult,Free cancellation,By Elite GTA Airport Limousine/Taxi,Toronto,Canada,https://www.tripadvisor.com/Attraction_Review-g155019-d10077573-Reviews-Elite_GTA_Airport_Limousine_Taxi-Toronto_Ontario.html
78,Toronto Sights & Sips Cocktail Cruise,City Tours,1 hour,$30.84,per adult,Free cancellation,By City Cruises Toronto,Toronto,Canada,https://www.tripadvisor.com/Attraction_Review-g155019-d1744957-Reviews-City_Cruises_Toronto-Toronto_Ontario.html
79,Private Toronto Kensington Market and Chinatown Walking Tour in English,Walking Tours,2 hours,$57.81,per adult,Free cancellation,By Top Dog Tours Toronto,Toronto,Canada,https://www.tripadvisor.com/Attraction_Review-g155019-d17747774-Reviews-Top_Dog_Tours_Toronto-Toronto_Ontario.html
80,"Guided Bicycle Tour - Midtown, Brickworks and Distillery District",Adventure Tours,3 hours,$80.51,per adult,Free cancellation,By Pedal Toronto,Toronto,Canada,https://www.tripadvisor.com/Attraction_Review-g155019-d14009496-Reviews-Pedal_Toronto-Toronto_Ontario.html
81,White Water Camping At Elora Gorge (2 Day),Adventure Tours,2 days,$322.04,per adult,Free cancellation,By Lake Fever Wilderness Co.,Toronto,Canada,https://www.tripadvisor.com/Attraction_Review-g155019-d17591963-Reviews-Lake_Fever_Wilderness_Co-Toronto_Ontario.html
82,Niagara Falls Day Tour from Toronto Airport,Adventure Tours,6+ hours,$103.86,per adult,Free cancellation,By Zoom Tours Niagara Falls,Toronto,Canada,https://www.tripadvisor.com/Attraction_Review-g155019-d1627398-Reviews-Zoom_Tours_Niagara_Falls-Toronto_Ontario.html
83,Toronto Pass for 2 Guided and 7 Self-Guided Walking Tours,Full-day Tours,1 day,$23.50,per adult,Free cancellation,By Vox City Toronto & Niagara,Toronto,Canada,https://www.tripadvisor.com/Attraction_Review-g155019-d23416812-Reviews-Vox_City_Toronto_Niagara-Toronto_Ontario.html
84,Private Arrival Transfer in Toronto Pearson International Airport (YYZ),Bus Tours,40–60 minutes,$35.00,per adult,Free cancellation,By Elife Limo,Toronto,Canada,https://www.tripadvisor.com/Attraction_Review-g155019-d23172014-Reviews-Elife_Limo-Toronto_Ontario.html
85,Luxury Niagara Falls Day Tour,Full-day Tours,6+ hours,$103.86,per adult,Free cancellation,By Airlink Niagara Falls Tours,Toronto,Canada,https://www.tripadvisor.com/Attraction_Review-g155019-d1891074-Reviews-Airlink_Niagara_Falls_Tours-Toronto_Ontario.html
86,Toronto Scavenger Hunt: The Wonders of Old Toronto,Self-guided Tours & Rentals,2 hours,$12.31,per adult,,By Let's Roam Toronto,Toronto,Canada,https://www.tripadvisor.com/Attraction_Review-g155019-d20098806-Reviews-Let_s_Roam_Toronto-Toronto_Ontario.html
87,Toronto Obsession III Dinner Boat Cruise,Night Tours,3–4 hours,$116.18,per adult,,By Cruise Toronto,Toronto,Canada,https://www.tripadvisor.com/Attraction_Review-g155019-d8283628-Reviews-Cruise_Toronto-Toronto_Ontario.html
88,Private Departure Transfer to Toronto Pearson Airport (YYZ),,45 minutes,$72.03,per group,Free cancellation,,Toronto,Canada,
89,Private Toronto Arrival Transfer - Pearson Airport to Hotel/Accommodations,,1 hour,$63.07,per adult,Free cancellation,By Elite GTA Airport Limousine/Taxi,Toronto,Canada,https://www.tripadvisor.com/Attraction_Review-g155019-d10077573-Reviews-Elite_GTA_Airport_Limousine_Taxi-Toronto_Ontario.html
90,Kensington Market By The Sidewalk Food Tour,Walking Tours,2–3 hours,$56.78,per adult,,By By The Sidewalk Food Tours,Toronto,Canada,https://www.tripadvisor.com/Attraction_Review-g155019-d14195112-Reviews-By_The_Sidewalk_Food_Tours-Toronto_Ontario.html
91,Abstract Acrylic Paint Pouring Adventure,Painting Classes,1–2 hours,$32.20,per adult,Free cancellation,By Fresh Paint Studio + Cafe,Toronto,Canada,https://www.tripadvisor.com/Attraction_Review-g155019-d19682778-Reviews-Fresh_Paint_Studio_Cafe-Toronto_Ontario.html
92,Market2Market,Walking Tours,150–180 minutes,$28.90,per adult,Free cancellation,By Buzz Tours,Toronto,Canada,https://www.tripadvisor.com/Attraction_Review-g155019-d12289740-Reviews-Buzz_Tours-Toronto_Ontario.html
93,Discover Toronto's Waterfront with a Smartphone Trivia Game!,City Tours,90–120 minutes,$5.63,per adult,Free cancellation,"By Tripvia Tours: Smartphone Audio Tours | Toronto, ON",Toronto,Canada,https://www.tripadvisor.com/Attraction_Review-g155019-d21388935-Reviews-Tripvia_Tours_Smartphone_Audio_Tours_Toronto_ON-Toronto_Ontario.html
94,Private 2-Hour Walking Crime Tour in Toronto,Walking Tours,2 hours,$30.59,per adult,Free cancellation,By Toronto Crime Tours,Toronto,Canada,https://www.tripadvisor.com/Attraction_Review-g155019-d23431620-Reviews-Toronto_Crime_Tours-Toronto_Ontario.html
95,Underground Toronto PATH Tour,Walking Tours,2 hours,$28.90,per adult,Free cancellation,By Top Dog Tours Toronto,Toronto,Canada,https://www.tripadvisor.com/Attraction_Review-g155019-d17747774-Reviews-Top_Dog_Tours_Toronto-Toronto_Ontario.html
96,2 Villages & The Main Street,Walking Tours,150–180 minutes,$27.37,per adult,Free cancellation,By Buzz Tours,Toronto,Canada,https://www.tripadvisor.com/Attraction_Review-g155019-d12289740-Reviews-Buzz_Tours-Toronto_Ontario.html
97,,1,3,,,5,,Toronto,Canada,
98,,,,,,,Clear all filters,Toronto,Canada,
99,Toronto Obsession III Brunch Cruise,Water Tours,2–3 hours,$75.89,per adult,,By Cruise Toronto,Toronto,Canada,https://www.tripadvisor.com/Attraction_Review-g155019-d8283628-Reviews-Cruise_Toronto-Toronto_Ontario.html
100,Yorkville-Bloor: Discover Canadian Haight-Ashbury on a Self-Guided Audio Tour,Walking Tours,40–60 minutes,$5.00,per adult,,By VoiceMap Toronto,Toronto,Canada,https://www.tripadvisor.com/Attraction_Review-g155019-d21087151-Reviews-VoiceMap_Toronto-Toronto_Ontario.html
101,West Queen West: Uncover the cultural heart of Toronto on an audio tour,City Tours,50–75 minutes,$5.20,per adult,,By VoiceMap Toronto,Toronto,Canada,https://www.tripadvisor.com/Attraction_Review-g155019-d21087151-Reviews-VoiceMap_Toronto-Toronto_Ontario.html
102,Scavenger Hunt Adventure in Toronto by Operation City Quest,Self-guided Tours & Rentals,2 hours,$11.27,per adult,Free cancellation,By Operation City Quest Scavenger Hunt of Toronto,Toronto,Canada,https://www.tripadvisor.com/Attraction_Review-g155019-d19753832-Reviews-Operation_City_Quest_Scavenger_Hunt_of_Toronto-Toronto_Ontario.html
103,Financial District and City Halls: An audio tour of Toronto's seminal buildings,Walking Tours,30–45 minutes,$5.20,per adult,,By VoiceMap Toronto,Toronto,Canada,https://www.tripadvisor.com/Attraction_Review-g155019-d21087151-Reviews-VoiceMap_Toronto-Toronto_Ontario.html
